[INFO] Scanning for projects...
[INFO]                                                                         
[INFO] ------------------------------------------------------------------------
[INFO] Building Commons Math 3.2-SNAPSHOT
[INFO] ------------------------------------------------------------------------
[INFO] 
[INFO] --- maven-antrun-plugin:1.7:run (javadoc.resources) @ commons-math3 ---
[INFO] Executing tasks

main:
[INFO] Executed tasks
[INFO] 
[INFO] --- maven-remote-resources-plugin:1.4:process (default) @ commons-math3 ---
[INFO] 
[INFO] --- buildnumber-maven-plugin:1.2:create (default) @ commons-math3 ---
[INFO] Checking for local modifications: skipped.
[INFO] Updating project files from SCM: skipped.
[INFO] Executing: /bin/sh -c cd /local/rsaha/FLAIR-temp/dataset-fla/dataset/math/MATH-891_2b852d79dc7f2aaac2a4d27da75f9d22e5d1bea2 && svn --non-interactive info
[INFO] Working directory: /local/rsaha/FLAIR-temp/dataset-fla/dataset/math/MATH-891_2b852d79dc7f2aaac2a4d27da75f9d22e5d1bea2
[INFO] Storing buildNumber: ?????? at timestamp: 1468297105839
[INFO] Executing: /bin/sh -c cd /local/rsaha/FLAIR-temp/dataset-fla/dataset/math/MATH-891_2b852d79dc7f2aaac2a4d27da75f9d22e5d1bea2 && svn --non-interactive info
[INFO] Working directory: /local/rsaha/FLAIR-temp/dataset-fla/dataset/math/MATH-891_2b852d79dc7f2aaac2a4d27da75f9d22e5d1bea2
[INFO] Storing buildScmBranch: UNKNOWN_BRANCH
[INFO] 
[INFO] --- maven-resources-plugin:2.6:resources (default-resources) @ commons-math3 ---
[INFO] Using 'UTF-8' encoding to copy filtered resources.
[INFO] Copying 1 resource
[INFO] Copying 2 resources to META-INF
[INFO] 
[INFO] --- maven-compiler-plugin:3.0:compile (default-compile) @ commons-math3 ---
[INFO] Changes detected - recompiling the module!
[INFO] Compiling 771 source files to /local/rsaha/FLAIR-temp/dataset-fla/dataset/math/MATH-891_2b852d79dc7f2aaac2a4d27da75f9d22e5d1bea2/target/classes
[WARNING] /local/rsaha/FLAIR-temp/dataset-fla/dataset/math/MATH-891_2b852d79dc7f2aaac2a4d27da75f9d22e5d1bea2/src/main/java/org/apache/commons/math3/analysis/function/Asin.java: Some input files use or override a deprecated API.
[WARNING] /local/rsaha/FLAIR-temp/dataset-fla/dataset/math/MATH-891_2b852d79dc7f2aaac2a4d27da75f9d22e5d1bea2/src/main/java/org/apache/commons/math3/analysis/function/Asin.java: Recompile with -Xlint:deprecation for details.
[INFO] 
[INFO] --- maven-bundle-plugin:2.3.7:manifest (bundle-manifest) @ commons-math3 ---
[INFO] 
[INFO] --- maven-resources-plugin:2.6:testResources (default-testResources) @ commons-math3 ---
[INFO] Using 'UTF-8' encoding to copy filtered resources.
[INFO] Copying 28 resources
[INFO] Copying 2 resources to META-INF
[INFO] 
[INFO] --- maven-compiler-plugin:3.0:testCompile (default-testCompile) @ commons-math3 ---
[INFO] Changes detected - recompiling the module!
[INFO] Compiling 459 source files to /local/rsaha/FLAIR-temp/dataset-fla/dataset/math/MATH-891_2b852d79dc7f2aaac2a4d27da75f9d22e5d1bea2/target/test-classes
[WARNING] /local/rsaha/FLAIR-temp/dataset-fla/dataset/math/MATH-891_2b852d79dc7f2aaac2a4d27da75f9d22e5d1bea2/src/test/java/org/apache/commons/math3/optimization/general/NonLinearConjugateGradientOptimizerTest.java: Some input files use or override a deprecated API.
[WARNING] /local/rsaha/FLAIR-temp/dataset-fla/dataset/math/MATH-891_2b852d79dc7f2aaac2a4d27da75f9d22e5d1bea2/src/test/java/org/apache/commons/math3/optimization/general/NonLinearConjugateGradientOptimizerTest.java: Recompile with -Xlint:deprecation for details.
[INFO] 
[INFO] --- maven-surefire-plugin:2.13:test (default-test) @ commons-math3 ---
[INFO] Surefire report directory: /local/rsaha/FLAIR-temp/dataset-fla/dataset/math/MATH-891_2b852d79dc7f2aaac2a4d27da75f9d22e5d1bea2/target/surefire-reports

-------------------------------------------------------
 T E S T S
-------------------------------------------------------
Running org.apache.commons.math3.complex.ComplexTest
Tests run: 123, Failures: 0, Errors: 0, Skipped: 0, Time elapsed: 0.114 sec
Running org.apache.commons.math3.complex.RootsOfUnityTest
Tests run: 6, Failures: 0, Errors: 0, Skipped: 0, Time elapsed: 0 sec
Running org.apache.commons.math3.complex.ComplexFieldTest
Tests run: 3, Failures: 0, Errors: 0, Skipped: 0, Time elapsed: 0 sec
Running org.apache.commons.math3.complex.FrenchComplexFormatTest
Tests run: 31, Failures: 0, Errors: 0, Skipped: 0, Time elapsed: 0.021 sec
Running org.apache.commons.math3.complex.ComplexUtilsTest
Tests run: 5, Failures: 0, Errors: 0, Skipped: 0, Time elapsed: 0.002 sec
Running org.apache.commons.math3.complex.QuaternionTest
Tests run: 22, Failures: 0, Errors: 0, Skipped: 0, Time elapsed: 0.03 sec
Running org.apache.commons.math3.complex.ComplexFormatTest
Tests run: 31, Failures: 0, Errors: 0, Skipped: 0, Time elapsed: 0.013 sec
Running org.apache.commons.math3.fitting.CurveFitterTest
Tests run: 3, Failures: 0, Errors: 0, Skipped: 0, Time elapsed: 0.018 sec
Running org.apache.commons.math3.fitting.GaussianFitterTest
Tests run: 9, Failures: 0, Errors: 0, Skipped: 0, Time elapsed: 0.077 sec
Running org.apache.commons.math3.fitting.PolynomialFitterTest
Tests run: 9, Failures: 0, Errors: 0, Skipped: 0, Time elapsed: 1.174 sec
Running org.apache.commons.math3.fitting.HarmonicFitterTest
Tests run: 7, Failures: 0, Errors: 0, Skipped: 0, Time elapsed: 0.035 sec
Running org.apache.commons.math3.stat.descriptive.moment.VectorialMeanTest
Tests run: 4, Failures: 0, Errors: 0, Skipped: 0, Time elapsed: 0.017 sec
Running org.apache.commons.math3.stat.descriptive.moment.SemiVarianceTest
Tests run: 9, Failures: 0, Errors: 0, Skipped: 0, Time elapsed: 0.008 sec
Running org.apache.commons.math3.stat.descriptive.moment.GeometricMeanTest
Tests run: 13, Failures: 0, Errors: 0, Skipped: 0, Time elapsed: 0.006 sec
Running org.apache.commons.math3.stat.descriptive.moment.MeanTest
Tests run: 14, Failures: 0, Errors: 0, Skipped: 0, Time elapsed: 0.007 sec
Running org.apache.commons.math3.stat.descriptive.moment.ThirdMomentTest
Tests run: 12, Failures: 0, Errors: 0, Skipped: 0, Time elapsed: 0.006 sec
Running org.apache.commons.math3.stat.descriptive.moment.SecondMomentTest
Tests run: 12, Failures: 0, Errors: 0, Skipped: 0, Time elapsed: 0.004 sec
Running org.apache.commons.math3.stat.descriptive.moment.FirstMomentTest
Tests run: 12, Failures: 0, Errors: 0, Skipped: 0, Time elapsed: 0.003 sec
Running org.apache.commons.math3.stat.descriptive.moment.KurtosisTest
Tests run: 13, Failures: 0, Errors: 0, Skipped: 0, Time elapsed: 0.009 sec
Running org.apache.commons.math3.stat.descriptive.moment.VectorialCovarianceTest
Tests run: 4, Failures: 0, Errors: 0, Skipped: 0, Time elapsed: 0.002 sec
Running org.apache.commons.math3.stat.descriptive.moment.SkewnessTest
Tests run: 13, Failures: 0, Errors: 0, Skipped: 0, Time elapsed: 0.007 sec
Running org.apache.commons.math3.stat.descriptive.moment.StandardDeviationTest
Tests run: 14, Failures: 0, Errors: 0, Skipped: 0, Time elapsed: 0.008 sec
Running org.apache.commons.math3.stat.descriptive.moment.InteractionTest
Tests run: 1, Failures: 0, Errors: 0, Skipped: 0, Time elapsed: 0 sec
Running org.apache.commons.math3.stat.descriptive.moment.VarianceTest
Tests run: 15, Failures: 0, Errors: 0, Skipped: 0, Time elapsed: 0.006 sec
Running org.apache.commons.math3.stat.descriptive.moment.FourthMomentTest
Tests run: 12, Failures: 0, Errors: 0, Skipped: 0, Time elapsed: 0.006 sec
Running org.apache.commons.math3.stat.descriptive.rank.PercentileTest
Tests run: 14, Failures: 0, Errors: 0, Skipped: 0, Time elapsed: 0.004 sec
Running org.apache.commons.math3.stat.descriptive.rank.MaxTest
Tests run: 14, Failures: 0, Errors: 0, Skipped: 0, Time elapsed: 0.005 sec
Running org.apache.commons.math3.stat.descriptive.rank.MedianTest
Tests run: 5, Failures: 0, Errors: 0, Skipped: 0, Time elapsed: 0.001 sec
Running org.apache.commons.math3.stat.descriptive.rank.MinTest
Tests run: 14, Failures: 0, Errors: 0, Skipped: 0, Time elapsed: 0.005 sec
Running org.apache.commons.math3.stat.descriptive.SynchronizedMultivariateSummaryStatisticsTest
Tests run: 10, Failures: 0, Errors: 0, Skipped: 0, Time elapsed: 0.02 sec
Running org.apache.commons.math3.stat.descriptive.ListUnivariateImplTest
Tests run: 5, Failures: 0, Errors: 0, Skipped: 0, Time elapsed: 0.008 sec
Running org.apache.commons.math3.stat.descriptive.AbstractUnivariateStatisticTest
Tests run: 2, Failures: 0, Errors: 0, Skipped: 0, Time elapsed: 0 sec
Running org.apache.commons.math3.stat.descriptive.StatisticalSummaryValuesTest
Tests run: 3, Failures: 0, Errors: 0, Skipped: 0, Time elapsed: 0.001 sec
Running org.apache.commons.math3.stat.descriptive.DescriptiveStatisticsTest
Tests run: 10, Failures: 0, Errors: 0, Skipped: 0, Time elapsed: 0.009 sec
Running org.apache.commons.math3.stat.descriptive.summary.SumTest
Tests run: 14, Failures: 0, Errors: 0, Skipped: 0, Time elapsed: 0.004 sec
Running org.apache.commons.math3.stat.descriptive.summary.SumLogTest
Tests run: 13, Failures: 0, Errors: 0, Skipped: 0, Time elapsed: 0.006 sec
Running org.apache.commons.math3.stat.descriptive.summary.ProductTest
Tests run: 14, Failures: 0, Errors: 0, Skipped: 0, Time elapsed: 0.005 sec
Running org.apache.commons.math3.stat.descriptive.summary.SumSqTest
Tests run: 13, Failures: 0, Errors: 0, Skipped: 0, Time elapsed: 0.005 sec
Running org.apache.commons.math3.stat.descriptive.MultivariateSummaryStatisticsTest
Tests run: 10, Failures: 0, Errors: 0, Skipped: 0, Time elapsed: 0.011 sec
Running org.apache.commons.math3.stat.descriptive.SummaryStatisticsTest
Tests run: 13, Failures: 0, Errors: 0, Skipped: 0, Time elapsed: 0.009 sec
Running org.apache.commons.math3.stat.descriptive.AggregateSummaryStatisticsTest
Tests run: 5, Failures: 0, Errors: 0, Skipped: 0, Time elapsed: 0.004 sec
Running org.apache.commons.math3.stat.descriptive.MixedListUnivariateImplTest
Tests run: 4, Failures: 0, Errors: 0, Skipped: 0, Time elapsed: 0.002 sec
Running org.apache.commons.math3.stat.descriptive.SynchronizedDescriptiveStatisticsTest
Tests run: 10, Failures: 0, Errors: 0, Skipped: 0, Time elapsed: 0.006 sec
Running org.apache.commons.math3.stat.descriptive.SynchronizedSummaryStatisticsTest
Tests run: 13, Failures: 0, Errors: 0, Skipped: 0, Time elapsed: 0.009 sec
Running org.apache.commons.math3.stat.correlation.StorelessCovarianceTest
Tests run: 5, Failures: 0, Errors: 0, Skipped: 0, Time elapsed: 0.003 sec
Running org.apache.commons.math3.stat.correlation.PearsonsCorrelationTest
Tests run: 8, Failures: 0, Errors: 0, Skipped: 0, Time elapsed: 0.016 sec
Running org.apache.commons.math3.stat.correlation.SpearmansRankCorrelationTest
Tests run: 11, Failures: 1, Errors: 1, Skipped: 0, Time elapsed: 0.019 sec <<< FAILURE!
testMath891Array(org.apache.commons.math3.stat.correlation.SpearmansRankCorrelationTest)  Time elapsed: 0.005 sec  <<< FAILURE!
java.lang.AssertionError: expected:<0.5> but was:<0.1054092553389458>
	at org.junit.Assert.fail(Assert.java:93)
	at org.junit.Assert.failNotEquals(Assert.java:647)
	at org.junit.Assert.assertEquals(Assert.java:443)
	at org.junit.Assert.assertEquals(Assert.java:512)
	at org.apache.commons.math3.stat.correlation.SpearmansRankCorrelationTest.testMath891Array(SpearmansRankCorrelationTest.java:132)

testMath891Matrix(org.apache.commons.math3.stat.correlation.SpearmansRankCorrelationTest)  Time elapsed: 0.005 sec  <<< ERROR!
org.apache.commons.math3.linear.MatrixDimensionMismatchException: got 4x1 but expected 5x1
	at org.apache.commons.math3.linear.AbstractRealMatrix.setColumn(AbstractRealMatrix.java:587)
	at org.apache.commons.math3.stat.correlation.SpearmansCorrelation.rankTransform(SpearmansCorrelation.java:175)
	at org.apache.commons.math3.stat.correlation.SpearmansCorrelation.<init>(SpearmansCorrelation.java:92)
	at org.apache.commons.math3.stat.correlation.SpearmansRankCorrelationTest.testMath891Matrix(SpearmansRankCorrelationTest.java:148)

Running org.apache.commons.math3.stat.correlation.CovarianceTest
Tests run: 6, Failures: 0, Errors: 0, Skipped: 0, Time elapsed: 0.002 sec
Running org.apache.commons.math3.stat.regression.SimpleRegressionTest
Tests run: 20, Failures: 0, Errors: 0, Skipped: 0, Time elapsed: 0.013 sec
Running org.apache.commons.math3.stat.regression.MillerUpdatingRegressionTest
Tests run: 17, Failures: 0, Errors: 0, Skipped: 0, Time elapsed: 0.085 sec
Running org.apache.commons.math3.stat.regression.OLSMultipleLinearRegressionTest
Tests run: 23, Failures: 0, Errors: 0, Skipped: 0, Time elapsed: 0.018 sec
Running org.apache.commons.math3.stat.regression.GLSMultipleLinearRegressionTest
Tests run: 21, Failures: 0, Errors: 0, Skipped: 0, Time elapsed: 0.3 sec
Running org.apache.commons.math3.stat.StatUtilsTest
Tests run: 16, Failures: 0, Errors: 0, Skipped: 0, Time elapsed: 0.004 sec
Running org.apache.commons.math3.stat.FrequencyTest
Tests run: 11, Failures: 0, Errors: 0, Skipped: 0, Time elapsed: 0.009 sec
Running org.apache.commons.math3.stat.inference.ChiSquareTestTest
Tests run: 7, Failures: 0, Errors: 0, Skipped: 0, Time elapsed: 0.004 sec
Running org.apache.commons.math3.stat.inference.WilcoxonSignedRankTestTest
Tests run: 2, Failures: 0, Errors: 0, Skipped: 0, Time elapsed: 0.001 sec
Running org.apache.commons.math3.stat.inference.TestUtilsTest
Tests run: 14, Failures: 0, Errors: 0, Skipped: 0, Time elapsed: 0.009 sec
Running org.apache.commons.math3.stat.inference.OneWayAnovaTest
Tests run: 4, Failures: 0, Errors: 0, Skipped: 0, Time elapsed: 0.001 sec
Running org.apache.commons.math3.stat.inference.GTestTest
Tests run: 13, Failures: 0, Errors: 0, Skipped: 0, Time elapsed: 0.004 sec
Running org.apache.commons.math3.stat.inference.MannWhitneyUTestTest
Tests run: 3, Failures: 0, Errors: 0, Skipped: 0, Time elapsed: 0.005 sec
Running org.apache.commons.math3.stat.inference.TTestTest
Tests run: 6, Failures: 0, Errors: 0, Skipped: 0, Time elapsed: 0 sec
Running org.apache.commons.math3.stat.ranking.NaturalRankingTest
Tests run: 9, Failures: 0, Errors: 0, Skipped: 0, Time elapsed: 0.001 sec
Running org.apache.commons.math3.stat.data.LewTest
Tests run: 1, Failures: 0, Errors: 0, Skipped: 0, Time elapsed: 0 sec
Running org.apache.commons.math3.stat.data.LotteryTest
Tests run: 1, Failures: 0, Errors: 0, Skipped: 0, Time elapsed: 0 sec
Running org.apache.commons.math3.stat.clustering.EuclideanDoublePointTest
Tests run: 4, Failures: 0, Errors: 0, Skipped: 0, Time elapsed: 0.003 sec
Running org.apache.commons.math3.stat.clustering.EuclideanIntegerPointTest
Tests run: 4, Failures: 0, Errors: 0, Skipped: 0, Time elapsed: 0.002 sec
Running org.apache.commons.math3.stat.clustering.DBSCANClustererTest
Tests run: 7, Failures: 0, Errors: 0, Skipped: 0, Time elapsed: 0.007 sec
Running org.apache.commons.math3.stat.clustering.KMeansPlusPlusClustererTest
Tests run: 5, Failures: 0, Errors: 0, Skipped: 0, Time elapsed: 0.128 sec
Running org.apache.commons.math3.stat.CertifiedDataTest
Tests run: 2, Failures: 0, Errors: 0, Skipped: 0, Time elapsed: 0.089 sec
Running org.apache.commons.math3.fraction.FractionTest
Tests run: 25, Failures: 0, Errors: 0, Skipped: 0, Time elapsed: 0.012 sec
Running org.apache.commons.math3.fraction.FractionFieldTest
Tests run: 3, Failures: 0, Errors: 0, Skipped: 0, Time elapsed: 0.001 sec
Running org.apache.commons.math3.fraction.FractionFormatTest
Tests run: 22, Failures: 0, Errors: 0, Skipped: 0, Time elapsed: 0.007 sec
Running org.apache.commons.math3.fraction.BigFractionFormatTest
Tests run: 19, Failures: 0, Errors: 0, Skipped: 0, Time elapsed: 0.011 sec
Running org.apache.commons.math3.fraction.BigFractionFieldTest
Tests run: 3, Failures: 0, Errors: 0, Skipped: 0, Time elapsed: 0.002 sec
Running org.apache.commons.math3.fraction.BigFractionTest
Tests run: 27, Failures: 0, Errors: 0, Skipped: 0, Time elapsed: 0.032 sec
Running org.apache.commons.math3.distribution.LevyDistributionTest
Tests run: 12, Failures: 0, Errors: 0, Skipped: 0, Time elapsed: 0.17 sec
Running org.apache.commons.math3.distribution.fitting.MultivariateNormalMixtureExpectationMaximizationTest
Tests run: 9, Failures: 0, Errors: 0, Skipped: 0, Time elapsed: 0.043 sec
Running org.apache.commons.math3.distribution.WeibullDistributionTest
Tests run: 14, Failures: 0, Errors: 0, Skipped: 0, Time elapsed: 0.047 sec
Running org.apache.commons.math3.distribution.FDistributionTest
Tests run: 18, Failures: 0, Errors: 0, Skipped: 0, Time elapsed: 0.121 sec
Running org.apache.commons.math3.distribution.EnumeratedRealDistributionTest
Tests run: 13, Failures: 0, Errors: 0, Skipped: 0, Time elapsed: 0.06 sec
Running org.apache.commons.math3.distribution.AbstractRealDistributionTest
Tests run: 2, Failures: 0, Errors: 0, Skipped: 0, Time elapsed: 0.024 sec
Running org.apache.commons.math3.distribution.NormalDistributionTest
Tests run: 19, Failures: 0, Errors: 0, Skipped: 0, Time elapsed: 0.011 sec
Running org.apache.commons.math3.distribution.ZipfDistributionTest
Tests run: 9, Failures: 0, Errors: 0, Skipped: 0, Time elapsed: 0.024 sec
Running org.apache.commons.math3.distribution.GammaDistributionTest
Tests run: 23, Failures: 0, Errors: 0, Skipped: 0, Time elapsed: 0.319 sec
Running org.apache.commons.math3.distribution.KolmogorovSmirnovDistributionTest
Tests run: 1, Failures: 0, Errors: 0, Skipped: 0, Time elapsed: 0.152 sec
Running org.apache.commons.math3.distribution.HypergeometricDistributionTest
Tests run: 15, Failures: 0, Errors: 0, Skipped: 0, Time elapsed: 0.047 sec
Running org.apache.commons.math3.distribution.MultivariateNormalDistributionTest
Tests run: 5, Failures: 0, Errors: 0, Skipped: 0, Time elapsed: 0.193 sec
Running org.apache.commons.math3.distribution.LogNormalDistributionTest
Tests run: 18, Failures: 0, Errors: 0, Skipped: 0, Time elapsed: 0.058 sec
Running org.apache.commons.math3.distribution.PascalDistributionTest
Tests run: 9, Failures: 0, Errors: 0, Skipped: 0, Time elapsed: 0.013 sec
Running org.apache.commons.math3.distribution.UniformIntegerDistributionTest
Tests run: 7, Failures: 0, Errors: 0, Skipped: 0, Time elapsed: 0.002 sec
Running org.apache.commons.math3.distribution.MultivariateNormalMixtureModelDistributionTest
Tests run: 5, Failures: 0, Errors: 0, Skipped: 0, Time elapsed: 0.001 sec
Running org.apache.commons.math3.distribution.TDistributionTest
Tests run: 17, Failures: 0, Errors: 0, Skipped: 0, Time elapsed: 0.031 sec
Running org.apache.commons.math3.distribution.AbstractIntegerDistributionTest
Tests run: 2, Failures: 0, Errors: 0, Skipped: 0, Time elapsed: 0.001 sec
Running org.apache.commons.math3.distribution.ExponentialDistributionTest
Tests run: 17, Failures: 0, Errors: 0, Skipped: 0, Time elapsed: 0.006 sec
Running org.apache.commons.math3.distribution.UniformRealDistributionTest
Tests run: 15, Failures: 0, Errors: 0, Skipped: 0, Time elapsed: 0.006 sec
Running org.apache.commons.math3.distribution.EnumeratedIntegerDistributionTest
Tests run: 9, Failures: 0, Errors: 0, Skipped: 0, Time elapsed: 0.049 sec
Running org.apache.commons.math3.distribution.BinomialDistributionTest
Tests run: 10, Failures: 0, Errors: 0, Skipped: 0, Time elapsed: 0.089 sec
Running org.apache.commons.math3.distribution.BetaDistributionTest
Tests run: 3, Failures: 0, Errors: 0, Skipped: 0, Time elapsed: 0.021 sec
Running org.apache.commons.math3.distribution.ChiSquaredDistributionTest
Tests run: 14, Failures: 0, Errors: 0, Skipped: 0, Time elapsed: 0.042 sec
Running org.apache.commons.math3.distribution.TriangularDistributionTest
Tests run: 17, Failures: 0, Errors: 0, Skipped: 0, Time elapsed: 0.017 sec
Running org.apache.commons.math3.distribution.CauchyDistributionTest
Tests run: 15, Failures: 0, Errors: 0, Skipped: 0, Time elapsed: 0.019 sec
Running org.apache.commons.math3.distribution.PoissonDistributionTest
Tests run: 14, Failures: 0, Errors: 0, Skipped: 0, Time elapsed: 0.016 sec
Running org.apache.commons.math3.analysis.function.LogitTest
Tests run: 15, Failures: 0, Errors: 0, Skipped: 0, Time elapsed: 0.011 sec
Running org.apache.commons.math3.analysis.function.LogisticTest
Tests run: 14, Failures: 0, Errors: 0, Skipped: 0, Time elapsed: 0.007 sec
Running org.apache.commons.math3.analysis.function.SqrtTest
Tests run: 3, Failures: 0, Errors: 0, Skipped: 0, Time elapsed: 0.008 sec
Running org.apache.commons.math3.analysis.function.SincTest
Tests run: 8, Failures: 0, Errors: 0, Skipped: 0, Time elapsed: 0.235 sec
Running org.apache.commons.math3.analysis.function.StepFunctionTest
Tests run: 9, Failures: 0, Errors: 0, Skipped: 0, Time elapsed: 0.002 sec
Running org.apache.commons.math3.analysis.function.GaussianTest
Tests run: 14, Failures: 0, Errors: 0, Skipped: 0, Time elapsed: 0.003 sec
Running org.apache.commons.math3.analysis.function.SigmoidTest
Tests run: 9, Failures: 0, Errors: 0, Skipped: 0, Time elapsed: 0.002 sec
Running org.apache.commons.math3.analysis.function.HarmonicOscillatorTest
Tests run: 8, Failures: 0, Errors: 0, Skipped: 0, Time elapsed: 0.002 sec
Running org.apache.commons.math3.analysis.integration.LegendreGaussIntegratorTest
Tests run: 4, Failures: 0, Errors: 0, Skipped: 0, Time elapsed: 0.259 sec
Running org.apache.commons.math3.analysis.integration.SimpsonIntegratorTest
Tests run: 3, Failures: 0, Errors: 0, Skipped: 0, Time elapsed: 0.002 sec
Running org.apache.commons.math3.analysis.integration.TrapezoidIntegratorTest
Tests run: 3, Failures: 0, Errors: 0, Skipped: 0, Time elapsed: 0.003 sec
Running org.apache.commons.math3.analysis.integration.RombergIntegratorTest
Tests run: 3, Failures: 0, Errors: 0, Skipped: 0, Time elapsed: 0.001 sec
Running org.apache.commons.math3.analysis.integration.gauss.LegendreTest
Tests run: 2, Failures: 0, Errors: 0, Skipped: 0, Time elapsed: 0.033 sec
Running org.apache.commons.math3.analysis.integration.gauss.LegendreParametricTest
Tests run: 30, Failures: 0, Errors: 0, Skipped: 0, Time elapsed: 0.03 sec
Running org.apache.commons.math3.analysis.integration.gauss.LegendreHighPrecisionParametricTest
Tests run: 30, Failures: 0, Errors: 0, Skipped: 0, Time elapsed: 0.978 sec
Running org.apache.commons.math3.analysis.integration.gauss.LegendreHighPrecisionTest
Tests run: 2, Failures: 0, Errors: 0, Skipped: 0, Time elapsed: 5.005 sec
Running org.apache.commons.math3.analysis.integration.gauss.BaseRuleFactoryTest
Tests run: 1, Failures: 0, Errors: 0, Skipped: 0, Time elapsed: 0.024 sec
Running org.apache.commons.math3.analysis.integration.IterativeLegendreGaussIntegratorTest
Tests run: 4, Failures: 0, Errors: 0, Skipped: 0, Time elapsed: 1.172 sec
Running org.apache.commons.math3.analysis.solvers.SecantSolverTest
Tests run: 8, Failures: 0, Errors: 0, Skipped: 0, Time elapsed: 0.005 sec
Running org.apache.commons.math3.analysis.solvers.MullerSolver2Test
Tests run: 4, Failures: 0, Errors: 0, Skipped: 0, Time elapsed: 0.001 sec
Running org.apache.commons.math3.analysis.solvers.RiddersSolverTest
Tests run: 4, Failures: 0, Errors: 0, Skipped: 0, Time elapsed: 0.001 sec
Running org.apache.commons.math3.analysis.solvers.LaguerreSolverTest
Tests run: 5, Failures: 0, Errors: 0, Skipped: 0, Time elapsed: 0.003 sec
Running org.apache.commons.math3.analysis.solvers.BracketingNthOrderBrentSolverTest
Tests run: 15, Failures: 0, Errors: 0, Skipped: 0, Time elapsed: 0.007 sec
Running org.apache.commons.math3.analysis.solvers.RegulaFalsiSolverTest
Tests run: 9, Failures: 0, Errors: 0, Skipped: 0, Time elapsed: 0.005 sec
Running org.apache.commons.math3.analysis.solvers.NewtonRaphsonSolverTest
Tests run: 2, Failures: 0, Errors: 0, Skipped: 0, Time elapsed: 0 sec
Running org.apache.commons.math3.analysis.solvers.IllinoisSolverTest
Tests run: 8, Failures: 0, Errors: 0, Skipped: 0, Time elapsed: 0.002 sec
Running org.apache.commons.math3.analysis.solvers.BisectionSolverTest
Tests run: 3, Failures: 0, Errors: 0, Skipped: 0, Time elapsed: 0.001 sec
Running org.apache.commons.math3.analysis.solvers.MullerSolverTest
Tests run: 4, Failures: 0, Errors: 0, Skipped: 0, Time elapsed: 0.001 sec
Running org.apache.commons.math3.analysis.solvers.BrentSolverTest
Tests run: 6, Failures: 0, Errors: 0, Skipped: 0, Time elapsed: 0.005 sec
Running org.apache.commons.math3.analysis.solvers.PegasusSolverTest
Tests run: 8, Failures: 0, Errors: 0, Skipped: 0, Time elapsed: 0.002 sec
Running org.apache.commons.math3.analysis.solvers.UnivariateSolverUtilsTest
Tests run: 14, Failures: 0, Errors: 0, Skipped: 0, Time elapsed: 0.005 sec
Running org.apache.commons.math3.analysis.solvers.NewtonSolverTest
Tests run: 2, Failures: 0, Errors: 0, Skipped: 0, Time elapsed: 0 sec
Running org.apache.commons.math3.analysis.interpolation.LoessInterpolatorTest
Tests run: 20, Failures: 0, Errors: 0, Skipped: 0, Time elapsed: 0.03 sec
Running org.apache.commons.math3.analysis.interpolation.TricubicSplineInterpolatingFunctionTest
Tests run: 3, Failures: 0, Errors: 0, Skipped: 0, Time elapsed: 0.012 sec
Running org.apache.commons.math3.analysis.interpolation.UnivariatePeriodicInterpolatorTest
Tests run: 5, Failures: 0, Errors: 0, Skipped: 0, Time elapsed: 0.004 sec
Running org.apache.commons.math3.analysis.interpolation.DividedDifferenceInterpolatorTest
Tests run: 3, Failures: 0, Errors: 0, Skipped: 0, Time elapsed: 0.002 sec
Running org.apache.commons.math3.analysis.interpolation.TricubicSplineInterpolatorTest
Tests run: 3, Failures: 0, Errors: 0, Skipped: 0, Time elapsed: 0.028 sec
Running org.apache.commons.math3.analysis.interpolation.NevilleInterpolatorTest
Tests run: 3, Failures: 0, Errors: 0, Skipped: 0, Time elapsed: 0.001 sec
Running org.apache.commons.math3.analysis.interpolation.HermiteInterpolatorTest
Tests run: 11, Failures: 0, Errors: 0, Skipped: 0, Time elapsed: 0.081 sec
Running org.apache.commons.math3.analysis.interpolation.SplineInterpolatorTest
Tests run: 5, Failures: 0, Errors: 0, Skipped: 0, Time elapsed: 0.001 sec
Running org.apache.commons.math3.analysis.interpolation.BicubicSplineInterpolatingFunctionTest
Tests run: 5, Failures: 0, Errors: 0, Skipped: 0, Time elapsed: 0.01 sec
Running org.apache.commons.math3.analysis.interpolation.FieldHermiteInterpolatorTest
Tests run: 12, Failures: 0, Errors: 0, Skipped: 0, Time elapsed: 0.979 sec
Running org.apache.commons.math3.analysis.interpolation.BicubicSplineInterpolatorTest
Tests run: 3, Failures: 0, Errors: 0, Skipped: 0, Time elapsed: 0.001 sec
Running org.apache.commons.math3.analysis.interpolation.LinearInterpolatorTest
Tests run: 4, Failures: 0, Errors: 0, Skipped: 0, Time elapsed: 0 sec
Running org.apache.commons.math3.analysis.interpolation.SmoothingPolynomialBicubicSplineInterpolatorTest
Tests run: 3, Failures: 0, Errors: 0, Skipped: 0, Time elapsed: 0.004 sec
Running org.apache.commons.math3.analysis.interpolation.MicrosphereInterpolatorTest
Tests run: 2, Failures: 0, Errors: 0, Skipped: 0, Time elapsed: 0.134 sec
Running org.apache.commons.math3.analysis.differentiation.JacobianFunctionTest
Tests run: 1, Failures: 0, Errors: 0, Skipped: 0, Time elapsed: 0.024 sec
Running org.apache.commons.math3.analysis.differentiation.DSCompilerTest
Tests run: 7, Failures: 0, Errors: 0, Skipped: 0, Time elapsed: 0.041 sec
Running org.apache.commons.math3.analysis.differentiation.DerivativeStructureTest
Tests run: 122, Failures: 0, Errors: 0, Skipped: 0, Time elapsed: 1.125 sec
Running org.apache.commons.math3.analysis.differentiation.GradientFunctionTest
Tests run: 2, Failures: 0, Errors: 0, Skipped: 0, Time elapsed: 0.079 sec
Running org.apache.commons.math3.analysis.differentiation.FiniteDifferencesDifferentiatorTest
Tests run: 16, Failures: 0, Errors: 0, Skipped: 0, Time elapsed: 0.042 sec
Running org.apache.commons.math3.analysis.polynomials.PolynomialSplineFunctionTest
Tests run: 2, Failures: 0, Errors: 0, Skipped: 0, Time elapsed: 0.001 sec
Running org.apache.commons.math3.analysis.polynomials.PolynomialFunctionNewtonFormTest
Tests run: 5, Failures: 0, Errors: 0, Skipped: 0, Time elapsed: 0.007 sec
Running org.apache.commons.math3.analysis.polynomials.PolynomialFunctionLagrangeFormTest
Tests run: 4, Failures: 0, Errors: 0, Skipped: 0, Time elapsed: 0.001 sec
Running org.apache.commons.math3.analysis.polynomials.PolynomialsUtilsTest
Tests run: 18, Failures: 0, Errors: 0, Skipped: 0, Time elapsed: 0.38 sec
Running org.apache.commons.math3.analysis.polynomials.PolynomialFunctionTest
Tests run: 11, Failures: 0, Errors: 0, Skipped: 0, Time elapsed: 0.002 sec
Running org.apache.commons.math3.analysis.FunctionUtilsTest
Tests run: 18, Failures: 0, Errors: 0, Skipped: 0, Time elapsed: 0.044 sec
Running org.apache.commons.math3.genetics.BinaryChromosomeTest
Tests run: 3, Failures: 0, Errors: 0, Skipped: 0, Time elapsed: 0.001 sec
Running org.apache.commons.math3.genetics.FixedGenerationCountTest
Tests run: 1, Failures: 0, Errors: 0, Skipped: 0, Time elapsed: 0 sec
Running org.apache.commons.math3.genetics.RandomKeyTest
Tests run: 10, Failures: 0, Errors: 0, Skipped: 0, Time elapsed: 0.004 sec
Running org.apache.commons.math3.genetics.NPointCrossoverTest
Tests run: 5, Failures: 0, Errors: 0, Skipped: 0, Time elapsed: 0.002 sec
Running org.apache.commons.math3.genetics.CycleCrossoverTest
Tests run: 6, Failures: 0, Errors: 0, Skipped: 0, Time elapsed: 0.002 sec
Running org.apache.commons.math3.genetics.ElitisticListPopulationTest
Tests run: 8, Failures: 0, Errors: 0, Skipped: 0, Time elapsed: 0.002 sec
Running org.apache.commons.math3.genetics.OnePointCrossoverTest
Tests run: 1, Failures: 0, Errors: 0, Skipped: 0, Time elapsed: 0 sec
Running org.apache.commons.math3.genetics.UniformCrossoverTest
Tests run: 6, Failures: 0, Errors: 0, Skipped: 0, Time elapsed: 0.066 sec
Running org.apache.commons.math3.genetics.FitnessCachingTest
Tests run: 1, Failures: 0, Errors: 0, Skipped: 0, Time elapsed: 0.01 sec
Running org.apache.commons.math3.genetics.FixedElapsedTimeTest
Tests run: 1, Failures: 0, Errors: 0, Skipped: 0, Time elapsed: 3.005 sec
Running org.apache.commons.math3.genetics.RandomKeyMutationTest
Tests run: 1, Failures: 0, Errors: 0, Skipped: 0, Time elapsed: 0.002 sec
Running org.apache.commons.math3.genetics.GeneticAlgorithmTestBinary
Tests run: 1, Failures: 0, Errors: 0, Skipped: 0, Time elapsed: 0.041 sec
Running org.apache.commons.math3.genetics.BinaryMutationTest
Tests run: 1, Failures: 0, Errors: 0, Skipped: 0, Time elapsed: 0.001 sec
Running org.apache.commons.math3.genetics.ListPopulationTest
Tests run: 10, Failures: 0, Errors: 0, Skipped: 0, Time elapsed: 0.005 sec
Running org.apache.commons.math3.genetics.OrderedCrossoverTest
Tests run: 4, Failures: 0, Errors: 0, Skipped: 0, Time elapsed: 0.007 sec
Running org.apache.commons.math3.genetics.GeneticAlgorithmTestPermutations
Tests run: 1, Failures: 0, Errors: 0, Skipped: 0, Time elapsed: 0.113 sec
Running org.apache.commons.math3.genetics.TournamentSelectionTest
Tests run: 1, Failures: 0, Errors: 0, Skipped: 0, Time elapsed: 0 sec
Running org.apache.commons.math3.genetics.ChromosomeTest
Tests run: 2, Failures: 0, Errors: 0, Skipped: 0, Time elapsed: 0.002 sec
Running org.apache.commons.math3.transform.FastSineTransformerTest
Tests run: 20, Failures: 0, Errors: 0, Skipped: 0, Time elapsed: 0.036 sec
Running org.apache.commons.math3.transform.FastHadamardTransformerTest
Tests run: 4, Failures: 0, Errors: 0, Skipped: 0, Time elapsed: 0.002 sec
Running org.apache.commons.math3.transform.FastCosineTransformerTest
Tests run: 18, Failures: 0, Errors: 0, Skipped: 0, Time elapsed: 0.024 sec
Running org.apache.commons.math3.transform.FastFourierTransformerTest
Tests run: 12, Failures: 0, Errors: 0, Skipped: 0, Time elapsed: 0.032 sec
Running org.apache.commons.math3.special.ErfTest
Tests run: 16, Failures: 0, Errors: 0, Skipped: 0, Time elapsed: 0.006 sec
Running org.apache.commons.math3.special.GammaTest
Tests run: 25, Failures: 0, Errors: 0, Skipped: 0, Time elapsed: 0.009 sec
Running org.apache.commons.math3.special.BetaTest
Tests run: 29, Failures: 0, Errors: 0, Skipped: 0, Time elapsed: 0.012 sec
Running org.apache.commons.math3.optimization.SimpleVectorValueCheckerTest
Tests run: 3, Failures: 0, Errors: 0, Skipped: 0, Time elapsed: 0.001 sec
Running org.apache.commons.math3.optimization.fitting.CurveFitterTest
Tests run: 3, Failures: 0, Errors: 0, Skipped: 0, Time elapsed: 0.006 sec
Running org.apache.commons.math3.optimization.fitting.GaussianFitterTest
Tests run: 9, Failures: 0, Errors: 0, Skipped: 0, Time elapsed: 0.075 sec
Running org.apache.commons.math3.optimization.fitting.PolynomialFitterTest
Tests run: 9, Failures: 0, Errors: 0, Skipped: 0, Time elapsed: 3.382 sec
Running org.apache.commons.math3.optimization.fitting.HarmonicFitterTest
Tests run: 7, Failures: 0, Errors: 0, Skipped: 0, Time elapsed: 0.013 sec
Running org.apache.commons.math3.optimization.PointVectorValuePairTest
Tests run: 1, Failures: 0, Errors: 0, Skipped: 0, Time elapsed: 0.001 sec
Running org.apache.commons.math3.optimization.SimpleValueCheckerTest
Tests run: 3, Failures: 0, Errors: 0, Skipped: 0, Time elapsed: 0.001 sec
Running org.apache.commons.math3.optimization.direct.PowellOptimizerTest
Tests run: 4, Failures: 0, Errors: 0, Skipped: 0, Time elapsed: 0.006 sec
Running org.apache.commons.math3.optimization.direct.SimplexOptimizerMultiDirectionalTest
Tests run: 7, Failures: 0, Errors: 0, Skipped: 0, Time elapsed: 0.013 sec
Running org.apache.commons.math3.optimization.direct.SimplexOptimizerNelderMeadTest
Tests run: 10, Failures: 0, Errors: 0, Skipped: 0, Time elapsed: 0.008 sec
Running org.apache.commons.math3.optimization.direct.MultivariateFunctionMappingAdapterTest
Tests run: 4, Failures: 0, Errors: 0, Skipped: 0, Time elapsed: 0.005 sec
Running org.apache.commons.math3.optimization.direct.MultivariateFunctionPenaltyAdapterTest
Tests run: 5, Failures: 0, Errors: 0, Skipped: 0, Time elapsed: 0.008 sec
Running org.apache.commons.math3.optimization.direct.CMAESOptimizerTest
Tests run: 24, Failures: 0, Errors: 0, Skipped: 0, Time elapsed: 3.465 sec
Running org.apache.commons.math3.optimization.MultivariateMultiStartOptimizerTest
Tests run: 1, Failures: 0, Errors: 0, Skipped: 0, Time elapsed: 0.005 sec
Running org.apache.commons.math3.optimization.PointValuePairTest
Tests run: 1, Failures: 0, Errors: 0, Skipped: 0, Time elapsed: 0.001 sec
Running org.apache.commons.math3.optimization.univariate.SimpleUnivariateValueCheckerTest
Tests run: 3, Failures: 0, Errors: 0, Skipped: 0, Time elapsed: 0 sec
Running org.apache.commons.math3.optimization.univariate.UnivariateMultiStartOptimizerTest
Tests run: 3, Failures: 0, Errors: 0, Skipped: 0, Time elapsed: 0.003 sec
Running org.apache.commons.math3.optimization.univariate.BrentOptimizerTest
Tests run: 10, Failures: 0, Errors: 0, Skipped: 0, Time elapsed: 0.012 sec
Running org.apache.commons.math3.optimization.univariate.BracketFinderTest
Tests run: 4, Failures: 0, Errors: 0, Skipped: 0, Time elapsed: 0.001 sec
Running org.apache.commons.math3.optimization.SimplePointCheckerTest
Tests run: 3, Failures: 0, Errors: 0, Skipped: 0, Time elapsed: 0 sec
Running org.apache.commons.math3.optimization.MultivariateDifferentiableVectorMultiStartOptimizerTest
Tests run: 2, Failures: 0, Errors: 0, Skipped: 0, Time elapsed: 0.004 sec
Running org.apache.commons.math3.optimization.general.NonLinearConjugateGradientOptimizerTest
Tests run: 12, Failures: 0, Errors: 0, Skipped: 0, Time elapsed: 0.014 sec
Running org.apache.commons.math3.optimization.general.LevenbergMarquardtOptimizerTest
Tests run: 22, Failures: 0, Errors: 0, Skipped: 1, Time elapsed: 0.077 sec
Running org.apache.commons.math3.optimization.general.AbstractLeastSquaresOptimizerTest
Tests run: 3, Failures: 0, Errors: 0, Skipped: 0, Time elapsed: 0.019 sec
Running org.apache.commons.math3.optimization.general.MinpackTest
Tests run: 18, Failures: 0, Errors: 0, Skipped: 0, Time elapsed: 0.425 sec
Running org.apache.commons.math3.optimization.general.GaussNewtonOptimizerTest
Tests run: 19, Failures: 0, Errors: 0, Skipped: 0, Time elapsed: 0.067 sec
Running org.apache.commons.math3.optimization.linear.SimplexSolverTest
Tests run: 26, Failures: 0, Errors: 0, Skipped: 0, Time elapsed: 0.195 sec
Running org.apache.commons.math3.optimization.linear.SimplexTableauTest
Tests run: 4, Failures: 0, Errors: 0, Skipped: 0, Time elapsed: 0.004 sec
Running org.apache.commons.math3.optimization.MultivariateDifferentiableMultiStartOptimizerTest
Tests run: 1, Failures: 0, Errors: 0, Skipped: 0, Time elapsed: 0.009 sec
Running org.apache.commons.math3.optim.SimpleVectorValueCheckerTest
Tests run: 3, Failures: 0, Errors: 0, Skipped: 0, Time elapsed: 0.001 sec
Running org.apache.commons.math3.optim.PointVectorValuePairTest
Tests run: 1, Failures: 0, Errors: 0, Skipped: 0, Time elapsed: 0.001 sec
Running org.apache.commons.math3.optim.SimpleValueCheckerTest
Tests run: 3, Failures: 0, Errors: 0, Skipped: 0, Time elapsed: 0.001 sec
Running org.apache.commons.math3.optim.PointValuePairTest
Tests run: 1, Failures: 0, Errors: 0, Skipped: 0, Time elapsed: 0.001 sec
Running org.apache.commons.math3.optim.univariate.SimpleUnivariateValueCheckerTest
Tests run: 3, Failures: 0, Errors: 0, Skipped: 0, Time elapsed: 0 sec
Running org.apache.commons.math3.optim.univariate.BrentOptimizerTest
Tests run: 10, Failures: 0, Errors: 0, Skipped: 0, Time elapsed: 0.015 sec
Running org.apache.commons.math3.optim.univariate.MultiStartUnivariateOptimizerTest
Tests run: 5, Failures: 0, Errors: 0, Skipped: 0, Time elapsed: 0.003 sec
Running org.apache.commons.math3.optim.univariate.BracketFinderTest
Tests run: 4, Failures: 0, Errors: 0, Skipped: 0, Time elapsed: 0.002 sec
Running org.apache.commons.math3.optim.SimplePointCheckerTest
Tests run: 3, Failures: 0, Errors: 0, Skipped: 0, Time elapsed: 0 sec
Running org.apache.commons.math3.optim.linear.SimplexSolverTest
Tests run: 27, Failures: 0, Errors: 0, Skipped: 0, Time elapsed: 0.1 sec
Running org.apache.commons.math3.optim.linear.SimplexTableauTest
Tests run: 4, Failures: 0, Errors: 0, Skipped: 0, Time elapsed: 0.003 sec
Running org.apache.commons.math3.optim.nonlinear.scalar.MultivariateFunctionMappingAdapterTest
Tests run: 4, Failures: 0, Errors: 0, Skipped: 0, Time elapsed: 0.008 sec
Running org.apache.commons.math3.optim.nonlinear.scalar.noderiv.PowellOptimizerTest
Tests run: 5, Failures: 0, Errors: 0, Skipped: 0, Time elapsed: 0.004 sec
Running org.apache.commons.math3.optim.nonlinear.scalar.noderiv.SimplexOptimizerMultiDirectionalTest
Tests run: 8, Failures: 0, Errors: 0, Skipped: 0, Time elapsed: 0.013 sec
Running org.apache.commons.math3.optim.nonlinear.scalar.noderiv.SimplexOptimizerNelderMeadTest
Tests run: 11, Failures: 0, Errors: 0, Skipped: 0, Time elapsed: 0.003 sec
Running org.apache.commons.math3.optim.nonlinear.scalar.noderiv.CMAESOptimizerTest
Tests run: 24, Failures: 0, Errors: 0, Skipped: 0, Time elapsed: 4.363 sec
Running org.apache.commons.math3.optim.nonlinear.scalar.MultivariateFunctionPenaltyAdapterTest
Tests run: 5, Failures: 0, Errors: 0, Skipped: 0, Time elapsed: 0.005 sec
Running org.apache.commons.math3.optim.nonlinear.scalar.MultiStartMultivariateOptimizerTest
Tests run: 2, Failures: 0, Errors: 0, Skipped: 0, Time elapsed: 0.011 sec
Running org.apache.commons.math3.optim.nonlinear.scalar.gradient.NonLinearConjugateGradientOptimizerTest
Tests run: 13, Failures: 0, Errors: 0, Skipped: 0, Time elapsed: 0.008 sec
Running org.apache.commons.math3.optim.nonlinear.vector.jacobian.LevenbergMarquardtOptimizerTest
Tests run: 23, Failures: 0, Errors: 0, Skipped: 0, Time elapsed: 0.054 sec
Running org.apache.commons.math3.optim.nonlinear.vector.jacobian.AbstractLeastSquaresOptimizerTest
Tests run: 3, Failures: 0, Errors: 0, Skipped: 0, Time elapsed: 0.006 sec
Running org.apache.commons.math3.optim.nonlinear.vector.jacobian.MinpackTest
Tests run: 18, Failures: 0, Errors: 0, Skipped: 0, Time elapsed: 0.136 sec
Running org.apache.commons.math3.optim.nonlinear.vector.jacobian.GaussNewtonOptimizerTest
Tests run: 21, Failures: 0, Errors: 0, Skipped: 0, Time elapsed: 0.032 sec
Running org.apache.commons.math3.optim.nonlinear.vector.MultiStartMultivariateVectorOptimizerTest
Tests run: 4, Failures: 0, Errors: 0, Skipped: 0, Time elapsed: 0.004 sec
Running org.apache.commons.math3.random.SynchronizedRandomGeneratorTest
Tests run: 2, Failures: 0, Errors: 0, Skipped: 0, Time elapsed: 0.727 sec
Running org.apache.commons.math3.random.ValueServerTest
Tests run: 9, Failures: 0, Errors: 0, Skipped: 0, Time elapsed: 0.042 sec
Running org.apache.commons.math3.random.RandomDataGeneratorTest
Tests run: 49, Failures: 0, Errors: 0, Skipped: 0, Time elapsed: 1.996 sec
Running org.apache.commons.math3.random.ISAACTest
Tests run: 63, Failures: 0, Errors: 0, Skipped: 0, Time elapsed: 2.242 sec
Running org.apache.commons.math3.random.Well512aTest
Tests run: 63, Failures: 0, Errors: 0, Skipped: 0, Time elapsed: 2.242 sec
Running org.apache.commons.math3.random.Well19937cTest
Tests run: 63, Failures: 0, Errors: 0, Skipped: 0, Time elapsed: 2.049 sec
Running org.apache.commons.math3.random.RandomAdaptorTest
Tests run: 1, Failures: 0, Errors: 0, Skipped: 0, Time elapsed: 0 sec
Running org.apache.commons.math3.random.Well19937aTest
Tests run: 63, Failures: 0, Errors: 0, Skipped: 0, Time elapsed: 2.121 sec
Running org.apache.commons.math3.random.AbstractRandomGeneratorTest
Tests run: 62, Failures: 0, Errors: 0, Skipped: 0, Time elapsed: 2.097 sec
Running org.apache.commons.math3.random.EmpiricalDistributionTest
Tests run: 26, Failures: 0, Errors: 0, Skipped: 0, Time elapsed: 1.655 sec
Running org.apache.commons.math3.random.UniformRandomGeneratorTest
Tests run: 1, Failures: 0, Errors: 0, Skipped: 0, Time elapsed: 0.001 sec
Running org.apache.commons.math3.random.StableRandomGeneratorTest
Tests run: 7, Failures: 0, Errors: 0, Skipped: 0, Time elapsed: 0.03 sec
Running org.apache.commons.math3.random.Well44497aTest
Tests run: 63, Failures: 0, Errors: 0, Skipped: 0, Time elapsed: 2.029 sec
Running org.apache.commons.math3.random.UnitSphereRandomVectorGeneratorTest
Tests run: 1, Failures: 0, Errors: 0, Skipped: 0, Time elapsed: 0.298 sec
Running org.apache.commons.math3.random.BitsStreamGeneratorTest
Tests run: 62, Failures: 0, Errors: 0, Skipped: 0, Time elapsed: 1.991 sec
Running org.apache.commons.math3.random.CorrelatedRandomVectorGeneratorTest
Tests run: 5, Failures: 0, Errors: 0, Skipped: 0, Time elapsed: 0.025 sec
Running org.apache.commons.math3.random.Well1024aTest
Tests run: 63, Failures: 0, Errors: 0, Skipped: 0, Time elapsed: 1.947 sec
Running org.apache.commons.math3.random.UncorrelatedRandomVectorGeneratorTest
Tests run: 1, Failures: 0, Errors: 0, Skipped: 0, Time elapsed: 0.006 sec
Running org.apache.commons.math3.random.GaussianRandomGeneratorTest
Tests run: 1, Failures: 0, Errors: 0, Skipped: 0, Time elapsed: 0.001 sec
Running org.apache.commons.math3.random.Well44497bTest
Tests run: 63, Failures: 0, Errors: 0, Skipped: 0, Time elapsed: 2.224 sec
Running org.apache.commons.math3.random.MersenneTwisterTest
Tests run: 63, Failures: 0, Errors: 0, Skipped: 0, Time elapsed: 1.788 sec
Running org.apache.commons.math3.filter.KalmanFilterTest
Tests run: 4, Failures: 0, Errors: 0, Skipped: 0, Time elapsed: 0.003 sec
Running org.apache.commons.math3.geometry.euclidean.threed.RotationTest
Tests run: 15, Failures: 0, Errors: 0, Skipped: 0, Time elapsed: 0.124 sec
Running org.apache.commons.math3.geometry.euclidean.threed.PolyhedronsSetTest
Tests run: 6, Failures: 0, Errors: 0, Skipped: 0, Time elapsed: 0.078 sec
Running org.apache.commons.math3.geometry.euclidean.threed.SubLineTest
Tests run: 12, Failures: 0, Errors: 0, Skipped: 0, Time elapsed: 0.002 sec
Running org.apache.commons.math3.geometry.euclidean.threed.RotationOrderTest
Tests run: 1, Failures: 0, Errors: 0, Skipped: 0, Time elapsed: 0 sec
Running org.apache.commons.math3.geometry.euclidean.threed.Vector3DTest
Tests run: 33, Failures: 0, Errors: 0, Skipped: 0, Time elapsed: 0.025 sec
Running org.apache.commons.math3.geometry.euclidean.threed.FieldRotationDSTest
Tests run: 18, Failures: 0, Errors: 0, Skipped: 0, Time elapsed: 1.046 sec
Running org.apache.commons.math3.geometry.euclidean.threed.FrenchVector3DFormatTest
Tests run: 28, Failures: 0, Errors: 0, Skipped: 0, Time elapsed: 0.005 sec
Running org.apache.commons.math3.geometry.euclidean.threed.SphericalCoordinatesTest
Tests run: 5, Failures: 0, Errors: 0, Skipped: 0, Time elapsed: 0.54 sec
Running org.apache.commons.math3.geometry.euclidean.threed.LineTest
Tests run: 7, Failures: 0, Errors: 0, Skipped: 0, Time elapsed: 0.001 sec
Running org.apache.commons.math3.geometry.euclidean.threed.PlaneTest
Tests run: 10, Failures: 0, Errors: 0, Skipped: 0, Time elapsed: 0.002 sec
Running org.apache.commons.math3.geometry.euclidean.threed.Vector3DFormatTest
Tests run: 28, Failures: 0, Errors: 0, Skipped: 0, Time elapsed: 0.006 sec
Running org.apache.commons.math3.geometry.euclidean.threed.FieldVector3DTest
Tests run: 31, Failures: 0, Errors: 0, Skipped: 0, Time elapsed: 0.122 sec
Running org.apache.commons.math3.geometry.euclidean.threed.FieldRotationDfpTest
Tests run: 17, Failures: 0, Errors: 0, Skipped: 0, Time elapsed: 1.427 sec
Running org.apache.commons.math3.geometry.euclidean.twod.SubLineTest
Tests run: 12, Failures: 0, Errors: 0, Skipped: 0, Time elapsed: 0.001 sec
Running org.apache.commons.math3.geometry.euclidean.twod.LineTest
Tests run: 9, Failures: 0, Errors: 0, Skipped: 0, Time elapsed: 0.001 sec
Running org.apache.commons.math3.geometry.euclidean.twod.SegmentTest
Tests run: 1, Failures: 0, Errors: 0, Skipped: 0, Time elapsed: 0 sec
Running org.apache.commons.math3.geometry.euclidean.twod.PolygonsSetTest
Tests run: 20, Failures: 0, Errors: 0, Skipped: 0, Time elapsed: 0.061 sec
Running org.apache.commons.math3.geometry.euclidean.oned.IntervalsSetTest
Tests run: 4, Failures: 0, Errors: 0, Skipped: 0, Time elapsed: 0.001 sec
Running org.apache.commons.math3.geometry.euclidean.oned.IntervalTest
Tests run: 4, Failures: 0, Errors: 0, Skipped: 0, Time elapsed: 0.001 sec
Running org.apache.commons.math3.geometry.partitioning.utilities.AVLTreeTest
Tests run: 5, Failures: 0, Errors: 0, Skipped: 0, Time elapsed: 0.001 sec
Running org.apache.commons.math3.util.Decimal64Test
Tests run: 63, Failures: 0, Errors: 0, Skipped: 0, Time elapsed: 0.022 sec
Running org.apache.commons.math3.util.ArithmeticUtilsTest
Tests run: 24, Failures: 0, Errors: 0, Skipped: 0, Time elapsed: 0.3 sec
Running org.apache.commons.math3.util.PairTest
Tests run: 4, Failures: 0, Errors: 0, Skipped: 0, Time elapsed: 0.001 sec
Running org.apache.commons.math3.util.OpenIntToFieldTest
Tests run: 17, Failures: 0, Errors: 0, Skipped: 0, Time elapsed: 0.032 sec
Running org.apache.commons.math3.util.BigRealFieldTest
Tests run: 3, Failures: 0, Errors: 0, Skipped: 0, Time elapsed: 0.001 sec
Running org.apache.commons.math3.util.TransformerMapTest
Tests run: 8, Failures: 0, Errors: 0, Skipped: 0, Time elapsed: 0.002 sec
Running org.apache.commons.math3.util.PrecisionTest
Tests run: 15, Failures: 0, Errors: 0, Skipped: 0, Time elapsed: 0.005 sec
Running org.apache.commons.math3.util.MultidimensionalCounterTest
Tests run: 5, Failures: 0, Errors: 0, Skipped: 0, Time elapsed: 0.001 sec
Running org.apache.commons.math3.util.FastMathStrictComparisonTest
Tests run: 53, Failures: 0, Errors: 0, Skipped: 0, Time elapsed: 0.025 sec
Running org.apache.commons.math3.util.BigRealTest
Tests run: 14, Failures: 0, Errors: 0, Skipped: 0, Time elapsed: 0.004 sec
Running org.apache.commons.math3.util.FastMathTest
Tests run: 48, Failures: 0, Errors: 0, Skipped: 1, Time elapsed: 6.24 sec
Running org.apache.commons.math3.util.MathUtilsTest
Tests run: 19, Failures: 0, Errors: 0, Skipped: 0, Time elapsed: 0.013 sec
Running org.apache.commons.math3.util.DefaultTransformerTest
Tests run: 7, Failures: 0, Errors: 0, Skipped: 0, Time elapsed: 0.001 sec
Running org.apache.commons.math3.util.OpenIntToDoubleHashMapTest
Tests run: 17, Failures: 0, Errors: 0, Skipped: 0, Time elapsed: 0.069 sec
Running org.apache.commons.math3.util.ContinuedFractionTest
Tests run: 1, Failures: 0, Errors: 0, Skipped: 0, Time elapsed: 0 sec
Running org.apache.commons.math3.util.MathArraysTest
Tests run: 38, Failures: 0, Errors: 0, Skipped: 0, Time elapsed: 0.018 sec
Running org.apache.commons.math3.util.ResizableDoubleArrayTest
Tests run: 17, Failures: 0, Errors: 0, Skipped: 0, Time elapsed: 0.005 sec
Running org.apache.commons.math3.util.IncrementorTest
Tests run: 10, Failures: 0, Errors: 0, Skipped: 0, Time elapsed: 0.002 sec
Running org.apache.commons.math3.exception.DimensionMismatchExceptionTest
Tests run: 1, Failures: 0, Errors: 0, Skipped: 0, Time elapsed: 0 sec
Running org.apache.commons.math3.exception.NotPositiveExceptionTest
Tests run: 1, Failures: 0, Errors: 0, Skipped: 0, Time elapsed: 0.001 sec
Running org.apache.commons.math3.exception.NumberIsTooSmallExceptionTest
Tests run: 1, Failures: 0, Errors: 0, Skipped: 0, Time elapsed: 0 sec
Running org.apache.commons.math3.exception.TooManyEvaluationsExceptionTest
Tests run: 1, Failures: 0, Errors: 0, Skipped: 0, Time elapsed: 0 sec
Running org.apache.commons.math3.exception.NonMonotonicSequenceExceptionTest
Tests run: 1, Failures: 0, Errors: 0, Skipped: 0, Time elapsed: 0 sec
Running org.apache.commons.math3.exception.util.ArgUtilsTest
Tests run: 1, Failures: 0, Errors: 0, Skipped: 0, Time elapsed: 0 sec
Running org.apache.commons.math3.exception.util.ExceptionContextTest
Tests run: 5, Failures: 0, Errors: 0, Skipped: 0, Time elapsed: 0.009 sec
Running org.apache.commons.math3.exception.util.LocalizedFormatsTest
Tests run: 6, Failures: 0, Errors: 0, Skipped: 0, Time elapsed: 0.075 sec
Running org.apache.commons.math3.exception.NumberIsTooLargeExceptionTest
Tests run: 1, Failures: 0, Errors: 0, Skipped: 0, Time elapsed: 0 sec
Running org.apache.commons.math3.exception.NotStrictlyPositiveExceptionTest
Tests run: 1, Failures: 0, Errors: 0, Skipped: 0, Time elapsed: 0 sec
Running org.apache.commons.math3.exception.MaxCountExceededExceptionTest
Tests run: 1, Failures: 0, Errors: 0, Skipped: 0, Time elapsed: 0 sec
Running org.apache.commons.math3.exception.OutOfRangeExceptionTest
Tests run: 1, Failures: 0, Errors: 0, Skipped: 0, Time elapsed: 0 sec
Running org.apache.commons.math3.primes.PrimesTest
Tests run: 3, Failures: 0, Errors: 0, Skipped: 0, Time elapsed: 0.033 sec
Running org.apache.commons.math3.linear.QRSolverTest
Tests run: 6, Failures: 0, Errors: 0, Skipped: 0, Time elapsed: 0.037 sec
Running org.apache.commons.math3.linear.FieldMatrixImplTest
Tests run: 37, Failures: 0, Errors: 0, Skipped: 0, Time elapsed: 0.055 sec
Running org.apache.commons.math3.linear.SparseRealVectorTest
Tests run: 106, Failures: 0, Errors: 0, Skipped: 8, Time elapsed: 0.109 sec
Running org.apache.commons.math3.linear.RRQRDecompositionTest
Tests run: 7, Failures: 0, Errors: 0, Skipped: 0, Time elapsed: 0.029 sec
Running org.apache.commons.math3.linear.BlockFieldMatrixTest
Tests run: 46, Failures: 0, Errors: 0, Skipped: 0, Time elapsed: 0.395 sec
Running org.apache.commons.math3.linear.HessenbergTransformerTest
Tests run: 9, Failures: 0, Errors: 0, Skipped: 0, Time elapsed: 0.034 sec
Running org.apache.commons.math3.linear.RectangularCholeskyDecompositionTest
Tests run: 3, Failures: 0, Errors: 0, Skipped: 0, Time elapsed: 0 sec
Running org.apache.commons.math3.linear.QRDecompositionTest
Tests run: 7, Failures: 0, Errors: 0, Skipped: 0, Time elapsed: 0.017 sec
Running org.apache.commons.math3.linear.Array2DRowRealMatrixTest
Tests run: 39, Failures: 0, Errors: 0, Skipped: 0, Time elapsed: 0.02 sec
Running org.apache.commons.math3.linear.FrenchRealVectorFormatTest
Tests run: 30, Failures: 0, Errors: 0, Skipped: 0, Time elapsed: 0.007 sec
Running org.apache.commons.math3.linear.FieldLUSolverTest
Tests run: 5, Failures: 0, Errors: 0, Skipped: 0, Time elapsed: 0.002 sec
Running org.apache.commons.math3.linear.SparseFieldMatrixTest
Tests run: 24, Failures: 0, Errors: 0, Skipped: 0, Time elapsed: 0.01 sec
Running org.apache.commons.math3.linear.LUDecompositionTest
Tests run: 9, Failures: 0, Errors: 0, Skipped: 0, Time elapsed: 0.002 sec
Running org.apache.commons.math3.linear.OpenMapRealMatrixTest
Tests run: 1, Failures: 0, Errors: 0, Skipped: 0, Time elapsed: 0 sec
Running org.apache.commons.math3.linear.SymmLQTest
Tests run: 36, Failures: 0, Errors: 0, Skipped: 0, Time elapsed: 0.115 sec
Running org.apache.commons.math3.linear.MatrixUtilsTest
Tests run: 17, Failures: 0, Errors: 0, Skipped: 0, Time elapsed: 0.011 sec
Running org.apache.commons.math3.linear.SingularValueDecompositionTest
Tests run: 13, Failures: 0, Errors: 0, Skipped: 0, Time elapsed: 0.389 sec
Running org.apache.commons.math3.linear.RealVectorFormatTest
Tests run: 30, Failures: 0, Errors: 0, Skipped: 0, Time elapsed: 0.009 sec
Running org.apache.commons.math3.linear.SparseRealMatrixTest
Tests run: 27, Failures: 0, Errors: 0, Skipped: 0, Time elapsed: 0.008 sec
Running org.apache.commons.math3.linear.TriDiagonalTransformerTest
Tests run: 8, Failures: 0, Errors: 0, Skipped: 0, Time elapsed: 0.002 sec
Running org.apache.commons.math3.linear.MatrixDimensionMismatchExceptionTest
Tests run: 1, Failures: 0, Errors: 0, Skipped: 0, Time elapsed: 0 sec
Running org.apache.commons.math3.linear.SparseFieldVectorTest
Tests run: 5, Failures: 0, Errors: 0, Skipped: 0, Time elapsed: 0.003 sec
Running org.apache.commons.math3.linear.BlockRealMatrixTest
Tests run: 48, Failures: 0, Errors: 0, Skipped: 0, Time elapsed: 0.16 sec
Running org.apache.commons.math3.linear.BiDiagonalTransformerTest
Tests run: 8, Failures: 0, Errors: 0, Skipped: 0, Time elapsed: 0.002 sec
Running org.apache.commons.math3.linear.ArrayFieldVectorTest
Tests run: 8, Failures: 0, Errors: 0, Skipped: 0, Time elapsed: 0.003 sec
Running org.apache.commons.math3.linear.CholeskySolverTest
Tests run: 3, Failures: 0, Errors: 0, Skipped: 0, Time elapsed: 0.001 sec
Running org.apache.commons.math3.linear.EigenDecompositionTest
Tests run: 28, Failures: 0, Errors: 0, Skipped: 2, Time elapsed: 0.199 sec
Running org.apache.commons.math3.linear.RealVectorTest
Tests run: 105, Failures: 0, Errors: 0, Skipped: 24, Time elapsed: 0.129 sec
Running org.apache.commons.math3.linear.UnmodifiableOpenMapRealVectorTest
Tests run: 8, Failures: 0, Errors: 0, Skipped: 0, Time elapsed: 0.082 sec
Running org.apache.commons.math3.linear.DiagonalMatrixTest
Tests run: 25, Failures: 0, Errors: 0, Skipped: 0, Time elapsed: 0.004 sec
Running org.apache.commons.math3.linear.CholeskyDecompositionTest
Tests run: 9, Failures: 0, Errors: 0, Skipped: 0, Time elapsed: 0.001 sec
Running org.apache.commons.math3.linear.ConjugateGradientTest
Tests run: 17, Failures: 0, Errors: 0, Skipped: 0, Time elapsed: 0.044 sec
Running org.apache.commons.math3.linear.RRQRSolverTest
Tests run: 6, Failures: 0, Errors: 0, Skipped: 0, Time elapsed: 0.007 sec
Running org.apache.commons.math3.linear.SchurTransformerTest
Tests run: 8, Failures: 0, Errors: 0, Skipped: 0, Time elapsed: 0.129 sec
Running org.apache.commons.math3.linear.UnmodifiableArrayRealVectorTest
Tests run: 8, Failures: 0, Errors: 0, Skipped: 0, Time elapsed: 0.014 sec
Running org.apache.commons.math3.linear.EigenSolverTest
Tests run: 4, Failures: 0, Errors: 0, Skipped: 0, Time elapsed: 0.001 sec
Running org.apache.commons.math3.linear.LUSolverTest
Tests run: 6, Failures: 0, Errors: 0, Skipped: 0, Time elapsed: 0.001 sec
Running org.apache.commons.math3.linear.SingularValueSolverTest
Tests run: 5, Failures: 0, Errors: 0, Skipped: 0, Time elapsed: 0.001 sec
Running org.apache.commons.math3.linear.ArrayRealVectorTest
Tests run: 108, Failures: 0, Errors: 0, Skipped: 6, Time elapsed: 0.107 sec
Running org.apache.commons.math3.linear.FieldLUDecompositionTest
Tests run: 9, Failures: 0, Errors: 0, Skipped: 0, Time elapsed: 0.011 sec
Running org.apache.commons.math3.linear.RealMatrixFormatTest
Tests run: 29, Failures: 0, Errors: 0, Skipped: 1, Time elapsed: 0.007 sec
Running org.apache.commons.math3.ode.sampling.StepNormalizerOutputTest
Tests run: 16, Failures: 0, Errors: 0, Skipped: 0, Time elapsed: 0.029 sec
Running org.apache.commons.math3.ode.sampling.StepNormalizerOutputOverlapTest
Tests run: 16, Failures: 0, Errors: 0, Skipped: 0, Time elapsed: 0.015 sec
Running org.apache.commons.math3.ode.sampling.StepNormalizerTest
Tests run: 2, Failures: 0, Errors: 0, Skipped: 0, Time elapsed: 0.023 sec
Running org.apache.commons.math3.ode.sampling.DummyStepInterpolatorTest
Tests run: 4, Failures: 0, Errors: 0, Skipped: 0, Time elapsed: 0.003 sec
Running org.apache.commons.math3.ode.sampling.NordsieckStepInterpolatorTest
Tests run: 2, Failures: 0, Errors: 0, Skipped: 0, Time elapsed: 0.187 sec
Running org.apache.commons.math3.ode.events.ReappearingEventTest
Tests run: 2, Failures: 0, Errors: 0, Skipped: 0, Time elapsed: 0.003 sec
Running org.apache.commons.math3.ode.events.EventFilterTest
Tests run: 7, Failures: 0, Errors: 0, Skipped: 0, Time elapsed: 0.257 sec
Running org.apache.commons.math3.ode.events.OverlappingEventsTest
Tests run: 2, Failures: 0, Errors: 0, Skipped: 0, Time elapsed: 0.01 sec
Running org.apache.commons.math3.ode.events.EventStateTest
Tests run: 2, Failures: 0, Errors: 0, Skipped: 0, Time elapsed: 0.008 sec
Running org.apache.commons.math3.ode.ContinuousOutputModelTest
Tests run: 4, Failures: 0, Errors: 0, Skipped: 0, Time elapsed: 0.025 sec
Running org.apache.commons.math3.ode.nonstiff.AdamsBashforthIntegratorTest
Tests run: 6, Failures: 0, Errors: 0, Skipped: 0, Time elapsed: 0.073 sec
Running org.apache.commons.math3.ode.nonstiff.GillIntegratorTest
Tests run: 8, Failures: 0, Errors: 0, Skipped: 0, Time elapsed: 0.235 sec
Running org.apache.commons.math3.ode.nonstiff.DormandPrince54StepInterpolatorTest
Tests run: 3, Failures: 0, Errors: 0, Skipped: 0, Time elapsed: 0.036 sec
Running org.apache.commons.math3.ode.nonstiff.ClassicalRungeKuttaIntegratorTest
Tests run: 8, Failures: 0, Errors: 0, Skipped: 0, Time elapsed: 0.11 sec
Running org.apache.commons.math3.ode.nonstiff.ThreeEighthesIntegratorTest
Tests run: 7, Failures: 0, Errors: 0, Skipped: 0, Time elapsed: 0.058 sec
Running org.apache.commons.math3.ode.nonstiff.ThreeEighthesStepInterpolatorTest
Tests run: 2, Failures: 0, Errors: 0, Skipped: 0, Time elapsed: 0.064 sec
Running org.apache.commons.math3.ode.nonstiff.HighamHall54IntegratorTest
Tests run: 9, Failures: 0, Errors: 0, Skipped: 0, Time elapsed: 0.039 sec
Running org.apache.commons.math3.ode.nonstiff.GillStepInterpolatorTest
Tests run: 2, Failures: 0, Errors: 0, Skipped: 0, Time elapsed: 0.049 sec
Running org.apache.commons.math3.ode.nonstiff.EulerStepInterpolatorTest
Tests run: 5, Failures: 0, Errors: 0, Skipped: 0, Time elapsed: 0.025 sec
Running org.apache.commons.math3.ode.nonstiff.MidpointIntegratorTest
Tests run: 6, Failures: 0, Errors: 0, Skipped: 0, Time elapsed: 0.114 sec
Running org.apache.commons.math3.ode.nonstiff.DormandPrince54IntegratorTest
Tests run: 8, Failures: 0, Errors: 0, Skipped: 0, Time elapsed: 0.02 sec
Running org.apache.commons.math3.ode.nonstiff.ClassicalRungeKuttaStepInterpolatorTest
Tests run: 2, Failures: 0, Errors: 0, Skipped: 0, Time elapsed: 0.033 sec
Running org.apache.commons.math3.ode.nonstiff.DormandPrince853StepInterpolatorTest
Tests run: 3, Failures: 0, Errors: 0, Skipped: 0, Time elapsed: 0.017 sec
Running org.apache.commons.math3.ode.nonstiff.GraggBulirschStoerStepInterpolatorTest
Tests run: 3, Failures: 0, Errors: 0, Skipped: 0, Time elapsed: 0.063 sec
Running org.apache.commons.math3.ode.nonstiff.AdamsMoultonIntegratorTest
Tests run: 6, Failures: 0, Errors: 0, Skipped: 0, Time elapsed: 0.02 sec
Running org.apache.commons.math3.ode.nonstiff.DormandPrince853IntegratorTest
Tests run: 12, Failures: 0, Errors: 0, Skipped: 0, Time elapsed: 0.036 sec
Running org.apache.commons.math3.ode.nonstiff.EulerIntegratorTest
Tests run: 6, Failures: 0, Errors: 0, Skipped: 0, Time elapsed: 0.022 sec
Running org.apache.commons.math3.ode.nonstiff.MidpointStepInterpolatorTest
Tests run: 2, Failures: 0, Errors: 0, Skipped: 0, Time elapsed: 0.012 sec
Running org.apache.commons.math3.ode.nonstiff.HighamHall54StepInterpolatorTest
Tests run: 3, Failures: 0, Errors: 0, Skipped: 0, Time elapsed: 0.016 sec
Running org.apache.commons.math3.ode.FirstOrderConverterTest
Tests run: 4, Failures: 0, Errors: 0, Skipped: 0, Time elapsed: 0.1 sec
Running org.apache.commons.math3.ode.JacobianMatricesTest
Tests run: 6, Failures: 0, Errors: 0, Skipped: 0, Time elapsed: 0.838 sec
Running org.apache.commons.math3.dfp.DfpTest
Tests run: 77, Failures: 0, Errors: 0, Skipped: 0, Time elapsed: 0.522 sec
Running org.apache.commons.math3.dfp.DfpMathTest
Tests run: 2, Failures: 0, Errors: 0, Skipped: 0, Time elapsed: 0 sec
Running org.apache.commons.math3.dfp.DfpDecTest
Tests run: 3, Failures: 0, Errors: 0, Skipped: 0, Time elapsed: 0.005 sec
Running org.apache.commons.math3.dfp.BracketingNthOrderBrentSolverDFPTest
Tests run: 4, Failures: 0, Errors: 0, Skipped: 0, Time elapsed: 0.274 sec
Running org.apache.commons.math3.RetryRunnerTest
Tests run: 2, Failures: 0, Errors: 0, Skipped: 0, Time elapsed: 0 sec

Results :

Failed tests: 
  SpearmansRankCorrelationTest.testMath891Array:132 expected:<0.5> but was:<0.1054092553389458>

Tests in error: 
  SpearmansRankCorrelationTest.testMath891Matrix:148  MatrixDimensionMismatch g...

Tests run: 4921, Failures: 1, Errors: 1, Skipped: 43

[INFO] ------------------------------------------------------------------------
[INFO] BUILD FAILURE
[INFO] ------------------------------------------------------------------------
[INFO] Total time: 01:26 min
[INFO] Finished at: 2016-07-11T21:19:50-07:00
[INFO] Final Memory: 22M/270M
[INFO] ------------------------------------------------------------------------
[ERROR] Failed to execute goal org.apache.maven.plugins:maven-surefire-plugin:2.13:test (default-test) on project commons-math3: There are test failures.
[ERROR] 
[ERROR] Please refer to /local/rsaha/FLAIR-temp/dataset-fla/dataset/math/MATH-891_2b852d79dc7f2aaac2a4d27da75f9d22e5d1bea2/target/surefire-reports for the individual test results.
[ERROR] -> [Help 1]
[ERROR] 
[ERROR] To see the full stack trace of the errors, re-run Maven with the -e switch.
[ERROR] Re-run Maven using the -X switch to enable full debug logging.
[ERROR] 
[ERROR] For more information about the errors and possible solutions, please read the following articles:
[ERROR] [Help 1] http://cwiki.apache.org/confluence/display/MAVEN/MojoFailureException
