[INFO] Scanning for projects...
[INFO]                                                                         
[INFO] ------------------------------------------------------------------------
[INFO] Building flink-runtime 0.9-SNAPSHOT
[INFO] ------------------------------------------------------------------------
[INFO] 
[INFO] --- maven-checkstyle-plugin:2.12.1:check (validate) @ flink-runtime ---
[INFO] 
[INFO] 
[INFO] --- maven-enforcer-plugin:1.3.1:enforce (enforce-maven) @ flink-runtime ---
[INFO] 
[INFO] --- git-commit-id-plugin:2.1.5:revision (default) @ flink-runtime ---
[info] 
[info] 
[INFO] 
[INFO] --- build-helper-maven-plugin:1.7:add-source (add-source) @ flink-runtime ---
[INFO] Source directory: /space/parallel/flink/flink9/dataset/flink/FLINK-1930_4dbf030a6b0415832862c3fd0c3fe7403878a998/flink-runtime/src/main/scala added.
[INFO] 
[INFO] --- maven-remote-resources-plugin:1.5:process (default) @ flink-runtime ---
[INFO] 
[INFO] --- maven-resources-plugin:2.6:resources (default-resources) @ flink-runtime ---
[INFO] Using 'UTF-8' encoding to copy filtered resources.
[INFO] Copying 60 resources
[INFO] Copying 3 resources
[INFO] 
[INFO] --- scala-maven-plugin:3.1.4:compile (scala-compile-first) @ flink-runtime ---
[INFO] Nothing to compile - all classes are up to date
[INFO] 
[INFO] --- maven-compiler-plugin:3.1:compile (default-compile) @ flink-runtime ---
[INFO] Nothing to compile - all classes are up to date
[INFO] 
[INFO] --- build-helper-maven-plugin:1.7:add-test-source (add-test-source) @ flink-runtime ---
[INFO] Test Source directory: /space/parallel/flink/flink9/dataset/flink/FLINK-1930_4dbf030a6b0415832862c3fd0c3fe7403878a998/flink-runtime/src/test/scala added.
[INFO] 
[INFO] --- maven-resources-plugin:2.6:testResources (default-testResources) @ flink-runtime ---
[INFO] Using 'UTF-8' encoding to copy filtered resources.
[INFO] Copying 2 resources
[INFO] Copying 3 resources
[INFO] 
[INFO] --- scala-maven-plugin:3.1.4:testCompile (scala-test-compile) @ flink-runtime ---
[INFO] Nothing to compile - all classes are up to date
[INFO] 
[INFO] --- maven-compiler-plugin:3.1:testCompile (default-testCompile) @ flink-runtime ---
[INFO] Nothing to compile - all classes are up to date
[INFO] 
[INFO] --- maven-surefire-plugin:2.17:test (default-test) @ flink-runtime ---
[INFO] Surefire report directory: /space/parallel/flink/flink9/dataset/flink/FLINK-1930_4dbf030a6b0415832862c3fd0c3fe7403878a998/flink-runtime/target/surefire-reports

-------------------------------------------------------
 T E S T S
-------------------------------------------------------

-------------------------------------------------------
 T E S T S
-------------------------------------------------------
Running org.apache.flink.runtime.operators.CoGroupTaskTest
Running org.apache.flink.runtime.operators.drivers.ReduceDriverTest
Running org.apache.flink.runtime.operators.MapTaskTest
Running org.apache.flink.runtime.operators.hash.MemoryHashTableTest
Running org.apache.flink.runtime.operators.drivers.GroupReduceDriverTest
Running org.apache.flink.runtime.operators.drivers.ReduceCombineDriverTest
Running org.apache.flink.runtime.operators.drivers.AllGroupReduceDriverTest
Running org.apache.flink.runtime.operators.resettable.SpillingResettableIteratorTest
Running org.apache.flink.runtime.operators.drivers.AllReduceDriverTest
Running org.apache.flink.runtime.operators.resettable.SpillingResettableMutableObjectIteratorTest
Running org.apache.flink.runtime.operators.chaining.ChainTaskTest
Running org.apache.flink.runtime.operators.resettable.BlockResettableMutableObjectIteratorTest
Running org.apache.flink.runtime.operators.resettable.ReusingBlockResettableIteratorTest
Running org.apache.flink.runtime.operators.resettable.NonReusingBlockResettableIteratorTest
Running org.apache.flink.runtime.operators.DataSinkTaskTest
Running org.apache.flink.runtime.operators.CombineTaskTest
Running org.apache.flink.runtime.operators.CachedMatchTaskTest
Running org.apache.flink.runtime.operators.MatchTaskTest
Running org.apache.flink.runtime.operators.sort.FixedLengthRecordSorterTest
Running org.apache.flink.runtime.operators.sort.MergeIteratorTest
Running org.apache.flink.runtime.operators.sort.LargeRecordHandlerTest
Running org.apache.flink.runtime.operators.sort.NormalizedKeySorterTest
Running org.apache.flink.runtime.operators.util.RecordOutputEmitterTest
Running org.apache.flink.runtime.operators.util.OutputEmitterTest
Tests run: 3, Failures: 0, Errors: 0, Skipped: 0, Time elapsed: 0.637 sec - in org.apache.flink.runtime.operators.sort.MergeIteratorTest
Running org.apache.flink.runtime.operators.DataSourceTaskTest
Tests run: 3, Failures: 0, Errors: 0, Skipped: 0, Time elapsed: 2.824 sec - in org.apache.flink.runtime.operators.drivers.AllGroupReduceDriverTest
Running org.apache.flink.runtime.operators.ReduceTaskTest
Tests run: 3, Failures: 0, Errors: 0, Skipped: 0, Time elapsed: 2.839 sec - in org.apache.flink.runtime.operators.drivers.AllReduceDriverTest
Running org.apache.flink.runtime.operators.CrossTaskTest
Tests run: 5, Failures: 0, Errors: 0, Skipped: 0, Time elapsed: 2.903 sec - in org.apache.flink.runtime.operators.drivers.GroupReduceDriverTest
Running org.apache.flink.runtime.fs.s3.S3FileSystemTest
Tests run: 5, Failures: 0, Errors: 0, Skipped: 0, Time elapsed: 0.098 sec - in org.apache.flink.runtime.fs.s3.S3FileSystemTest
Running org.apache.flink.runtime.memory.MemorySegmentTest
Tests run: 3, Failures: 0, Errors: 0, Skipped: 0, Time elapsed: 3.719 sec - in org.apache.flink.runtime.operators.drivers.ReduceCombineDriverTest
Running org.apache.flink.runtime.memory.DefaultMemoryManagerTest
Tests run: 3, Failures: 0, Errors: 0, Skipped: 0, Time elapsed: 3.726 sec - in org.apache.flink.runtime.operators.drivers.ReduceDriverTest
Running org.apache.flink.runtime.iterative.event.EventWithAggregatorsTest
Tests run: 2, Failures: 0, Errors: 0, Skipped: 0, Time elapsed: 0.025 sec - in org.apache.flink.runtime.iterative.event.EventWithAggregatorsTest
Running org.apache.flink.runtime.iterative.concurrent.SuperstepBarrierTest
Tests run: 7, Failures: 0, Errors: 0, Skipped: 0, Time elapsed: 2.783 sec - in org.apache.flink.runtime.operators.util.OutputEmitterTest
Running org.apache.flink.runtime.iterative.concurrent.BlockingBackChannelTest
Tests run: 6, Failures: 0, Errors: 0, Skipped: 0, Time elapsed: 4.222 sec - in org.apache.flink.runtime.operators.MapTaskTest
Running org.apache.flink.runtime.iterative.concurrent.BrokerTest
Tests run: 3, Failures: 0, Errors: 0, Skipped: 0, Time elapsed: 4.129 sec - in org.apache.flink.runtime.operators.resettable.BlockResettableMutableObjectIteratorTest
Running org.apache.flink.runtime.iterative.concurrent.SuperstepKickoffLatchTest
Tests run: 4, Failures: 0, Errors: 0, Skipped: 0, Time elapsed: 0.983 sec - in org.apache.flink.runtime.memory.DefaultMemoryManagerTest
Running org.apache.flink.runtime.net.NetUtilsTest
Tests run: 9, Failures: 0, Errors: 0, Skipped: 0, Time elapsed: 1.694 sec - in org.apache.flink.runtime.memory.MemorySegmentTest
Tests run: 5, Failures: 0, Errors: 0, Skipped: 0, Time elapsed: 0.468 sec - in org.apache.flink.runtime.iterative.concurrent.SuperstepKickoffLatchTest
Running org.apache.flink.runtime.blob.BlobCacheRetriesTest
Running org.apache.flink.runtime.blob.BlobServerGetTest
Tests run: 3, Failures: 0, Errors: 0, Skipped: 0, Time elapsed: 4.634 sec - in org.apache.flink.runtime.operators.resettable.NonReusingBlockResettableIteratorTest
Running org.apache.flink.runtime.blob.BlobServerPutTest
Tests run: 6, Failures: 0, Errors: 0, Skipped: 0, Time elapsed: 4.503 sec - in org.apache.flink.runtime.operators.CombineTaskTest
Running org.apache.flink.runtime.blob.BlobKeyTest
Tests run: 2, Failures: 0, Errors: 0, Skipped: 0, Time elapsed: 0.345 sec - in org.apache.flink.runtime.blob.BlobCacheRetriesTest
Running org.apache.flink.runtime.blob.BlobUtilsTest
Tests run: 4, Failures: 0, Errors: 0, Skipped: 0, Time elapsed: 0.117 sec - in org.apache.flink.runtime.blob.BlobKeyTest
Running org.apache.flink.runtime.blob.BlobClientTest
Tests run: 2, Failures: 0, Errors: 0, Skipped: 0, Time elapsed: 0.171 sec - in org.apache.flink.runtime.blob.BlobUtilsTest
Running org.apache.flink.runtime.blob.BlobServerDeleteTest
Tests run: 2, Failures: 0, Errors: 0, Skipped: 0, Time elapsed: 1.504 sec - in org.apache.flink.runtime.iterative.concurrent.SuperstepBarrierTest
Running org.apache.flink.runtime.blob.BlobCacheSuccessTest
Tests run: 3, Failures: 0, Errors: 0, Skipped: 0, Time elapsed: 5.165 sec - in org.apache.flink.runtime.operators.resettable.ReusingBlockResettableIteratorTest
Running org.apache.flink.runtime.filecache.FileCacheDeleteValidationTest
Tests run: 4, Failures: 0, Errors: 0, Skipped: 0, Time elapsed: 5.464 sec - in org.apache.flink.runtime.operators.resettable.SpillingResettableIteratorTest
Running org.apache.flink.runtime.jobgraph.JobGraphTest
Tests run: 1, Failures: 0, Errors: 0, Skipped: 0, Time elapsed: 0.316 sec - in org.apache.flink.runtime.blob.BlobCacheSuccessTest
Running org.apache.flink.runtime.jobgraph.JobTaskVertexTest
Tests run: 1, Failures: 0, Errors: 0, Skipped: 0, Time elapsed: 1.908 sec - in org.apache.flink.runtime.iterative.concurrent.BlockingBackChannelTest
Running org.apache.flink.runtime.jobgraph.JobIdTest
Tests run: 1, Failures: 0, Errors: 0, Skipped: 0, Time elapsed: 0.003 sec - in org.apache.flink.runtime.jobgraph.JobIdTest
Running org.apache.flink.runtime.event.task.TaskEventTest
Tests run: 3, Failures: 0, Errors: 0, Skipped: 0, Time elapsed: 0.01 sec - in org.apache.flink.runtime.event.task.TaskEventTest
Running org.apache.flink.runtime.executiongraph.ExecutionStateProgressTest
Tests run: 6, Failures: 0, Errors: 0, Skipped: 0, Time elapsed: 0.346 sec - in org.apache.flink.runtime.jobgraph.JobGraphTest
Running org.apache.flink.runtime.executiongraph.ExecutionVertexSchedulingTest
Tests run: 4, Failures: 0, Errors: 0, Skipped: 0, Time elapsed: 0.342 sec - in org.apache.flink.runtime.jobgraph.JobTaskVertexTest
Tests run: 2, Failures: 0, Errors: 0, Skipped: 0, Time elapsed: 1.218 sec - in org.apache.flink.runtime.blob.BlobServerGetTest
Running org.apache.flink.runtime.executiongraph.ExecutionGraphDeploymentTest
Running org.apache.flink.runtime.executiongraph.VertexSlotSharingTest
Tests run: 1, Failures: 0, Errors: 0, Skipped: 0, Time elapsed: 2.167 sec - in org.apache.flink.runtime.net.NetUtilsTest
Running org.apache.flink.runtime.executiongraph.PointwisePatternTest
Tests run: 5, Failures: 0, Errors: 0, Skipped: 0, Time elapsed: 1.707 sec - in org.apache.flink.runtime.blob.BlobServerDeleteTest
Tests run: 2, Failures: 0, Errors: 0, Skipped: 0, Time elapsed: 6.952 sec - in org.apache.flink.runtime.operators.resettable.SpillingResettableMutableObjectIteratorTest
Running org.apache.flink.runtime.executiongraph.AllVerticesIteratorTest
Running org.apache.flink.runtime.executiongraph.ExecutionVertexCancelTest
Tests run: 1, Failures: 0, Errors: 0, Skipped: 0, Time elapsed: 1.114 sec - in org.apache.flink.runtime.executiongraph.VertexSlotSharingTest
Running org.apache.flink.runtime.executiongraph.ExecutionGraphConstructionTest
Tests run: 1, Failures: 0, Errors: 0, Skipped: 0, Time elapsed: 3.192 sec - in org.apache.flink.runtime.iterative.concurrent.BrokerTest
Running org.apache.flink.runtime.executiongraph.ExecutionVertexDeploymentTest
Tests run: 8, Failures: 0, Errors: 0, Skipped: 0, Time elapsed: 1.297 sec - in org.apache.flink.runtime.executiongraph.ExecutionGraphConstructionTest
Running org.apache.flink.runtime.executiongraph.VertexLocationConstraintTest
Tests run: 18, Failures: 0, Errors: 0, Skipped: 0, Time elapsed: 9.893 sec - in org.apache.flink.runtime.operators.CoGroupTaskTest
Running org.apache.flink.runtime.executiongraph.LocalInputSplitsTest
Tests run: 1, Failures: 0, Errors: 0, Skipped: 0, Time elapsed: 2.804 sec - in org.apache.flink.runtime.executiongraph.AllVerticesIteratorTest
Running org.apache.flink.runtime.profiling.impl.InstanceProfilerTest
Tests run: 7, Failures: 0, Errors: 0, Skipped: 0, Time elapsed: 3.1 sec - in org.apache.flink.runtime.executiongraph.PointwisePatternTest
Running org.apache.flink.runtime.profiling.types.ProfilingTypesTest
Tests run: 3, Failures: 0, Errors: 0, Skipped: 0, Time elapsed: 0.068 sec - in org.apache.flink.runtime.profiling.types.ProfilingTypesTest
Running org.apache.flink.runtime.jobmanager.SlotCountExceedingParallelismTest
Tests run: 1, Failures: 0, Errors: 0, Skipped: 0, Time elapsed: 4.385 sec - in org.apache.flink.runtime.executiongraph.ExecutionStateProgressTest
Running org.apache.flink.runtime.jobmanager.JobManagerProcessReapingTest
Tests run: 12, Failures: 0, Errors: 0, Skipped: 0, Time elapsed: 8.311 sec - in org.apache.flink.runtime.operators.ReduceTaskTest
Running org.apache.flink.runtime.jobmanager.JobManagerStartupTest
Tests run: 6, Failures: 0, Errors: 0, Skipped: 0, Time elapsed: 2.868 sec - in org.apache.flink.runtime.executiongraph.VertexLocationConstraintTest
Running org.apache.flink.runtime.jobmanager.JobManagerConnectionTest
Tests run: 3, Failures: 0, Errors: 0, Skipped: 0, Time elapsed: 6.775 sec - in org.apache.flink.runtime.executiongraph.ExecutionVertexSchedulingTest
Running org.apache.flink.runtime.jobmanager.JobManagerTest
Tests run: 1, Failures: 0, Errors: 0, Skipped: 0, Time elapsed: 0.008 sec - in org.apache.flink.runtime.jobmanager.JobManagerTest
Running org.apache.flink.runtime.jobmanager.scheduler.SchedulerSlotSharingTest
Tests run: 5, Failures: 0, Errors: 0, Skipped: 0, Time elapsed: 8.014 sec - in org.apache.flink.runtime.blob.BlobServerPutTest
Running org.apache.flink.runtime.jobmanager.scheduler.SlotAllocationFutureTest
Tests run: 3, Failures: 0, Errors: 0, Skipped: 0, Time elapsed: 0.27 sec - in org.apache.flink.runtime.jobmanager.scheduler.SlotAllocationFutureTest
Running org.apache.flink.runtime.jobmanager.scheduler.ScheduleOrUpdateConsumersTest
Tests run: 32, Failures: 0, Errors: 0, Skipped: 0, Time elapsed: 10.575 sec - in org.apache.flink.runtime.operators.CrossTaskTest
Running org.apache.flink.runtime.jobmanager.scheduler.SetQueueTest
Tests run: 2, Failures: 0, Errors: 0, Skipped: 0, Time elapsed: 0.001 sec - in org.apache.flink.runtime.jobmanager.scheduler.SetQueueTest
Running org.apache.flink.runtime.jobmanager.scheduler.ScheduleWithCoLocationHintTest
Tests run: 7, Failures: 0, Errors: 0, Skipped: 0, Time elapsed: 6.597 sec - in org.apache.flink.runtime.executiongraph.ExecutionVertexDeploymentTest
Running org.apache.flink.runtime.jobmanager.scheduler.SchedulerIsolatedTasksTest
Tests run: 22, Failures: 0, Errors: 0, Skipped: 0, Time elapsed: 14.038 sec - in org.apache.flink.runtime.operators.CachedMatchTaskTest
Running org.apache.flink.runtime.jobmanager.scheduler.LifoSetQueueTest
Tests run: 2, Failures: 0, Errors: 0, Skipped: 0, Time elapsed: 0.055 sec - in org.apache.flink.runtime.jobmanager.scheduler.LifoSetQueueTest
Running org.apache.flink.runtime.jobmanager.scheduler.SharedSlotsTest
Tests run: 2, Failures: 0, Errors: 0, Skipped: 0, Time elapsed: 3.992 sec - in org.apache.flink.runtime.jobmanager.JobManagerConnectionTest
Running org.apache.flink.runtime.jobmanager.JobSubmitTest
Tests run: 4, Failures: 0, Errors: 0, Skipped: 0, Time elapsed: 10.448 sec - in org.apache.flink.runtime.blob.BlobClientTest
Running org.apache.flink.runtime.taskmanager.TaskExecutionStateTest
Tests run: 2, Failures: 0, Errors: 0, Skipped: 0, Time elapsed: 0.395 sec - in org.apache.flink.runtime.jobmanager.JobSubmitTest
Running org.apache.flink.runtime.taskmanager.TaskManagerTest
Tests run: 2, Failures: 0, Errors: 0, Skipped: 0, Time elapsed: 0.142 sec - in org.apache.flink.runtime.taskmanager.TaskExecutionStateTest
Running org.apache.flink.runtime.taskmanager.TaskManagerRegistrationTest
Tests run: 12, Failures: 0, Errors: 0, Skipped: 0, Time elapsed: 3.154 sec - in org.apache.flink.runtime.jobmanager.scheduler.SchedulerSlotSharingTest
Running org.apache.flink.runtime.taskmanager.TestManagerStartupTest
Tests run: 1, Failures: 0, Errors: 0, Skipped: 0, Time elapsed: 10.487 sec - in org.apache.flink.runtime.filecache.FileCacheDeleteValidationTest
Running org.apache.flink.runtime.taskmanager.TaskManagerComponentsStartupShutdownTest
Tests run: 11, Failures: 0, Errors: 0, Skipped: 0, Time elapsed: 9.138 sec - in org.apache.flink.runtime.executiongraph.ExecutionVertexCancelTest
Running org.apache.flink.runtime.taskmanager.TaskManagerConfigurationTest
Tests run: 2, Failures: 0, Errors: 0, Skipped: 0, Time elapsed: 1.5 sec - in org.apache.flink.runtime.jobmanager.scheduler.SharedSlotsTest
Running org.apache.flink.runtime.taskmanager.TaskTest
Tests run: 3, Failures: 0, Errors: 0, Skipped: 0, Time elapsed: 0.083 sec - in org.apache.flink.runtime.taskmanager.TaskManagerConfigurationTest
Running org.apache.flink.runtime.taskmanager.TaskManagerProcessReapingTest
Tests run: 8, Failures: 0, Errors: 0, Skipped: 0, Time elapsed: 15.53 sec - in org.apache.flink.runtime.operators.util.RecordOutputEmitterTest
Running org.apache.flink.runtime.client.SerializedJobExecutionResultTest
Tests run: 3, Failures: 0, Errors: 0, Skipped: 0, Time elapsed: 15.754 sec - in org.apache.flink.runtime.operators.sort.LargeRecordHandlerTest
Running org.apache.flink.runtime.deployment.TaskDeploymentDescriptorTest
Tests run: 1, Failures: 0, Errors: 0, Skipped: 0, Time elapsed: 0.123 sec - in org.apache.flink.runtime.deployment.TaskDeploymentDescriptorTest
Running org.apache.flink.runtime.execution.librarycache.BlobLibraryCacheManagerTest
Tests run: 2, Failures: 0, Errors: 0, Skipped: 0, Time elapsed: 0.689 sec - in org.apache.flink.runtime.client.SerializedJobExecutionResultTest
Running org.apache.flink.runtime.util.MathUtilTest
Tests run: 3, Failures: 0, Errors: 0, Skipped: 0, Time elapsed: 0.018 sec - in org.apache.flink.runtime.util.MathUtilTest
Running org.apache.flink.runtime.util.SerializedValueTest
Tests run: 2, Failures: 0, Errors: 0, Skipped: 0, Time elapsed: 0.016 sec - in org.apache.flink.runtime.util.SerializedValueTest
Running org.apache.flink.runtime.util.ReusingKeyGroupedIteratorTest
Tests run: 4, Failures: 0, Errors: 0, Skipped: 0, Time elapsed: 0.087 sec - in org.apache.flink.runtime.util.ReusingKeyGroupedIteratorTest
Running org.apache.flink.runtime.util.AtomicDisposableReferenceCounterTest
Tests run: 6, Failures: 0, Errors: 0, Skipped: 0, Time elapsed: 1.026 sec - in org.apache.flink.runtime.taskmanager.TaskTest
Running org.apache.flink.runtime.util.LRUCacheMapTest
Tests run: 5, Failures: 0, Errors: 0, Skipped: 0, Time elapsed: 0.047 sec - in org.apache.flink.runtime.util.LRUCacheMapTest
Running org.apache.flink.runtime.util.event.TaskEventHandlerTest
Tests run: 3, Failures: 0, Errors: 0, Skipped: 0, Time elapsed: 0.158 sec - in org.apache.flink.runtime.util.AtomicDisposableReferenceCounterTest
Running org.apache.flink.runtime.util.DataInputOutputSerializerTest
Tests run: 1, Failures: 0, Errors: 0, Skipped: 0, Time elapsed: 0.34 sec - in org.apache.flink.runtime.util.event.TaskEventHandlerTest
Running org.apache.flink.runtime.util.NonReusingKeyGroupedIteratorTest
Tests run: 4, Failures: 0, Errors: 0, Skipped: 0, Time elapsed: 0.2 sec - in org.apache.flink.runtime.util.NonReusingKeyGroupedIteratorTest
Running org.apache.flink.runtime.util.DelegatingConfigurationTest
Tests run: 1, Failures: 0, Errors: 0, Skipped: 0, Time elapsed: 0.044 sec - in org.apache.flink.runtime.util.DelegatingConfigurationTest
Running org.apache.flink.runtime.util.EnvironmentInformationTest
Tests run: 2, Failures: 0, Errors: 0, Skipped: 0, Time elapsed: 1.529 sec - in org.apache.flink.runtime.execution.librarycache.BlobLibraryCacheManagerTest
Running org.apache.flink.runtime.instance.HardwareTest
Tests run: 2, Failures: 0, Errors: 0, Skipped: 0, Time elapsed: 0.005 sec - in org.apache.flink.runtime.instance.HardwareTest
Running org.apache.flink.runtime.instance.InstanceTest
Tests run: 7, Failures: 0, Errors: 0, Skipped: 0, Time elapsed: 9.06 sec - in org.apache.flink.runtime.executiongraph.LocalInputSplitsTest
Running org.apache.flink.runtime.instance.SimpleSlotTest
Tests run: 3, Failures: 0, Errors: 0, Skipped: 0, Time elapsed: 0.137 sec - in org.apache.flink.runtime.instance.SimpleSlotTest
Running org.apache.flink.runtime.instance.InstanceConnectionInfoTest
Tests run: 4, Failures: 0, Errors: 0, Skipped: 0, Time elapsed: 0.321 sec - in org.apache.flink.runtime.instance.InstanceTest
Running org.apache.flink.runtime.instance.InstanceManagerTest
Tests run: 2, Failures: 0, Errors: 0, Skipped: 0, Time elapsed: 7.323 sec - in org.apache.flink.runtime.jobmanager.JobManagerStartupTest
Running org.apache.flink.runtime.io.disk.iomanager.BufferFileWriterFileSegmentReaderTest
Tests run: 6, Failures: 0, Errors: 0, Skipped: 0, Time elapsed: 0.726 sec - in org.apache.flink.runtime.instance.InstanceConnectionInfoTest
Running org.apache.flink.runtime.io.disk.iomanager.IOManagerAsyncTest
Tests run: 1, Failures: 0, Errors: 0, Skipped: 0, Time elapsed: 1.71 sec - in org.apache.flink.runtime.io.disk.iomanager.BufferFileWriterFileSegmentReaderTest
Running org.apache.flink.runtime.io.disk.iomanager.IOManagerTest
Tests run: 1, Failures: 0, Errors: 0, Skipped: 0, Time elapsed: 0.088 sec - in org.apache.flink.runtime.io.disk.iomanager.IOManagerTest
Running org.apache.flink.runtime.io.disk.iomanager.BufferFileWriterReaderTest
Tests run: 5, Failures: 0, Errors: 0, Skipped: 0, Time elapsed: 6.241 sec - in org.apache.flink.runtime.jobmanager.scheduler.SchedulerIsolatedTasksTest
Running org.apache.flink.runtime.io.disk.iomanager.AsynchronousBufferFileWriterTest
Tests run: 5, Failures: 0, Errors: 0, Skipped: 0, Time elapsed: 5.353 sec - in org.apache.flink.runtime.taskmanager.TaskManagerTest
Running org.apache.flink.runtime.io.disk.iomanager.AsynchronousFileIOChannelTest
Tests run: 1, Failures: 0, Errors: 0, Skipped: 0, Time elapsed: 11.02 sec - in org.apache.flink.runtime.jobmanager.SlotCountExceedingParallelismTest
Running org.apache.flink.runtime.io.disk.ChannelViewsTest
Tests run: 3, Failures: 0, Errors: 0, Skipped: 0, Time elapsed: 4.096 sec - in org.apache.flink.runtime.util.EnvironmentInformationTest
Running org.apache.flink.runtime.io.disk.SeekableFileChannelInputViewTest
Tests run: 1, Failures: 0, Errors: 0, Skipped: 0, Time elapsed: 0.445 sec - in org.apache.flink.runtime.io.disk.SeekableFileChannelInputViewTest
Running org.apache.flink.runtime.io.disk.FileChannelStreamsTest
Tests run: 2, Failures: 0, Errors: 0, Skipped: 0, Time elapsed: 0.162 sec - in org.apache.flink.runtime.io.disk.FileChannelStreamsTest
Running org.apache.flink.runtime.io.disk.SpillingBufferTest
Tests run: 2, Failures: 0, Errors: 0, Skipped: 0, Time elapsed: 2.485 sec - in org.apache.flink.runtime.io.disk.iomanager.BufferFileWriterReaderTest
Running org.apache.flink.runtime.io.network.DefaultChannelSelectorTest
Tests run: 1, Failures: 0, Errors: 0, Skipped: 0, Time elapsed: 0.013 sec - in org.apache.flink.runtime.io.network.DefaultChannelSelectorTest
Running org.apache.flink.runtime.io.network.netty.PartitionRequestClientFactoryTest
Tests run: 6, Failures: 0, Errors: 0, Skipped: 0, Time elapsed: 3.727 sec - in org.apache.flink.runtime.io.disk.iomanager.IOManagerAsyncTest
Running org.apache.flink.runtime.io.network.netty.PartitionRequestClientHandlerTest
Tests run: 3, Failures: 0, Errors: 0, Skipped: 0, Time elapsed: 7.45 sec - in org.apache.flink.runtime.taskmanager.TestManagerStartupTest
Running org.apache.flink.runtime.io.network.netty.NettyMessageSerializationTest
Tests run: 46, Failures: 0, Errors: 0, Skipped: 0, Time elapsed: 22.845 sec - in org.apache.flink.runtime.operators.MatchTaskTest
Running org.apache.flink.runtime.io.network.partition.SpilledSubpartitionViewTest
Tests run: 3, Failures: 0, Errors: 0, Skipped: 0, Time elapsed: 13.633 sec - in org.apache.flink.runtime.profiling.impl.InstanceProfilerTest
Running org.apache.flink.runtime.io.network.partition.SpilledSubpartitionViewSyncIOTest
Tests run: 4, Failures: 0, Errors: 0, Skipped: 0, Time elapsed: 5.425 sec - in org.apache.flink.runtime.instance.InstanceManagerTest
Running org.apache.flink.runtime.io.network.partition.SpillableSubpartitionTest
Tests run: 4, Failures: 0, Errors: 0, Skipped: 0, Time elapsed: 3.578 sec - in org.apache.flink.runtime.io.disk.iomanager.AsynchronousBufferFileWriterTest
Running org.apache.flink.runtime.io.network.partition.PipelinedSubpartitionTest
Tests run: 2, Failures: 0, Errors: 0, Skipped: 0, Time elapsed: 6.705 sec - in org.apache.flink.runtime.util.DataInputOutputSerializerTest
Running org.apache.flink.runtime.io.network.partition.consumer.RemoteInputChannelTest
Tests run: 9, Failures: 0, Errors: 0, Skipped: 0, Time elapsed: 10.678 sec - in org.apache.flink.runtime.jobmanager.scheduler.ScheduleWithCoLocationHintTest
Running org.apache.flink.runtime.io.network.partition.consumer.LocalInputChannelTest
Tests run: 2, Failures: 0, Errors: 0, Skipped: 0, Time elapsed: 1.27 sec - in org.apache.flink.runtime.io.network.partition.SpilledSubpartitionViewSyncIOTest
Running org.apache.flink.runtime.io.network.partition.consumer.UnionInputGateTest
Tests run: 4, Failures: 0, Errors: 0, Skipped: 0, Time elapsed: 2.303 sec - in org.apache.flink.runtime.io.disk.SpillingBufferTest
Running org.apache.flink.runtime.io.network.partition.consumer.SingleInputGateTest
Tests run: 2, Failures: 0, Errors: 0, Skipped: 0, Time elapsed: 2.312 sec - in org.apache.flink.runtime.io.network.netty.PartitionRequestClientHandlerTest
Running org.apache.flink.runtime.io.network.partition.SpilledSubpartitionViewAsyncIOTest
Tests run: 1, Failures: 0, Errors: 0, Skipped: 0, Time elapsed: 0.484 sec - in org.apache.flink.runtime.io.network.partition.consumer.UnionInputGateTest
Running org.apache.flink.runtime.io.network.api.reader.BufferReaderTest
Tests run: 2, Failures: 0, Errors: 0, Skipped: 0, Time elapsed: 0.34 sec - in org.apache.flink.runtime.io.network.partition.consumer.SingleInputGateTest
Running org.apache.flink.runtime.io.network.api.reader.AbstractReaderTest
Tests run: 2, Failures: 0, Errors: 0, Skipped: 0, Time elapsed: 1.581 sec - in org.apache.flink.runtime.io.network.partition.SpillableSubpartitionTest
Running org.apache.flink.runtime.io.network.api.serialization.PagedViewsTest
Tests run: 4, Failures: 0, Errors: 0, Skipped: 0, Time elapsed: 0.118 sec - in org.apache.flink.runtime.io.network.api.reader.AbstractReaderTest
Running org.apache.flink.runtime.io.network.api.serialization.SpanningRecordSerializationTest
Tests run: 1, Failures: 0, Errors: 0, Skipped: 0, Time elapsed: 9.555 sec - in org.apache.flink.runtime.taskmanager.TaskManagerComponentsStartupShutdownTest
Running org.apache.flink.runtime.io.network.api.serialization.SpanningRecordSerializerTest
Tests run: 1, Failures: 0, Errors: 0, Skipped: 0, Time elapsed: 2.994 sec - in org.apache.flink.runtime.io.network.netty.PartitionRequestClientFactoryTest
Running org.apache.flink.runtime.io.network.api.serialization.EventSerializerTest
Tests run: 1, Failures: 0, Errors: 0, Skipped: 0, Time elapsed: 0 sec - in org.apache.flink.runtime.io.network.api.serialization.EventSerializerTest
Running org.apache.flink.runtime.io.network.DataExchangeModeTest
Tests run: 3, Failures: 0, Errors: 0, Skipped: 0, Time elapsed: 0.021 sec - in org.apache.flink.runtime.io.network.DataExchangeModeTest
Running org.apache.flink.runtime.io.network.buffer.NetworkBufferPoolTest
Tests run: 2, Failures: 1, Errors: 0, Skipped: 0, Time elapsed: 0.062 sec <<< FAILURE! - in org.apache.flink.runtime.io.network.buffer.NetworkBufferPoolTest
testDestroyAll(org.apache.flink.runtime.io.network.buffer.NetworkBufferPoolTest)  Time elapsed: 0.047 sec  <<< FAILURE!
java.lang.AssertionError: Should fail with an IllegalStateException
	at org.junit.Assert.fail(Assert.java:88)
	at org.apache.flink.runtime.io.network.buffer.NetworkBufferPoolTest.testDestroyAll(NetworkBufferPoolTest.java:125)

Running org.apache.flink.runtime.io.network.buffer.BufferPoolFactoryTest
Tests run: 7, Failures: 0, Errors: 0, Skipped: 0, Time elapsed: 0.196 sec - in org.apache.flink.runtime.io.network.buffer.BufferPoolFactoryTest
Running org.apache.flink.runtime.io.network.buffer.LocalBufferPoolTest
Tests run: 1, Failures: 0, Errors: 0, Skipped: 0, Time elapsed: 16.201 sec - in org.apache.flink.runtime.jobmanager.JobManagerProcessReapingTest
Running org.apache.flink.runtime.io.network.buffer.BufferTest
Tests run: 2, Failures: 0, Errors: 0, Skipped: 0, Time elapsed: 0.064 sec - in org.apache.flink.runtime.io.network.buffer.BufferTest
Running org.apache.flink.runtime.io.network.serialization.LargeRecordsTest
Tests run: 1, Failures: 0, Errors: 0, Skipped: 0, Time elapsed: 1.305 sec - in org.apache.flink.runtime.io.network.partition.SpilledSubpartitionViewAsyncIOTest
Running org.apache.flink.runtime.io.network.NetworkEnvironmentTest
Tests run: 1, Failures: 0, Errors: 0, Skipped: 0, Time elapsed: 3.546 sec - in org.apache.flink.runtime.io.network.netty.NettyMessageSerializationTest
Tests run: 4, Failures: 0, Errors: 0, Skipped: 0, Time elapsed: 2.595 sec - in org.apache.flink.runtime.io.network.api.serialization.SpanningRecordSerializationTest
Tests run: 1, Failures: 0, Errors: 0, Skipped: 0, Time elapsed: 14.837 sec - in org.apache.flink.runtime.jobmanager.scheduler.ScheduleOrUpdateConsumersTest
Tests run: 11, Failures: 2, Errors: 1, Skipped: 0, Time elapsed: 2.946 sec <<< FAILURE! - in org.apache.flink.runtime.io.network.buffer.LocalBufferPoolTest
testDestroyDuringBlockingRequest(org.apache.flink.runtime.io.network.buffer.LocalBufferPoolTest)  Time elapsed: 0.156 sec  <<< ERROR!
java.util.concurrent.ExecutionException: java.lang.AssertionError: Call should have failed with an IllegalStateException
	at java.util.concurrent.FutureTask.report(FutureTask.java:122)
	at java.util.concurrent.FutureTask.get(FutureTask.java:202)
	at org.apache.flink.runtime.io.network.buffer.LocalBufferPoolTest.testDestroyDuringBlockingRequest(LocalBufferPoolTest.java:323)
Caused by: java.lang.AssertionError: Call should have failed with an IllegalStateException
	at org.junit.Assert.fail(Assert.java:88)
	at org.apache.flink.runtime.io.network.buffer.LocalBufferPoolTest$2.call(LocalBufferPoolTest.java:303)
	at org.apache.flink.runtime.io.network.buffer.LocalBufferPoolTest$2.call(LocalBufferPoolTest.java:284)
	at java.util.concurrent.FutureTask.run(FutureTask.java:262)
	at java.util.concurrent.ThreadPoolExecutor.runWorker(ThreadPoolExecutor.java:1145)
	at java.util.concurrent.ThreadPoolExecutor$Worker.run(ThreadPoolExecutor.java:615)
	at java.lang.Thread.run(Thread.java:745)

testDestroyDuringBlockingRequest(org.apache.flink.runtime.io.network.buffer.LocalBufferPoolTest)  Time elapsed: 0.272 sec  <<< FAILURE!
java.lang.AssertionError: Did not return all buffers to memory segment pool after test. expected:<1024> but was:<1023>
	at org.junit.Assert.fail(Assert.java:88)
	at org.junit.Assert.failNotEquals(Assert.java:743)
	at org.junit.Assert.assertEquals(Assert.java:118)
	at org.junit.Assert.assertEquals(Assert.java:555)
	at org.apache.flink.runtime.io.network.buffer.LocalBufferPoolTest.destroyAndVerifyAllBuffersReturned(LocalBufferPoolTest.java:77)

testRequestAfterDestroy(org.apache.flink.runtime.io.network.buffer.LocalBufferPoolTest)  Time elapsed: 0.001 sec  <<< FAILURE!
java.lang.AssertionError: Call should have failed with an IllegalStateException
	at org.junit.Assert.fail(Assert.java:88)
	at org.apache.flink.runtime.io.network.buffer.LocalBufferPoolTest.testRequestAfterDestroy(LocalBufferPoolTest.java:118)

Tests run: 2, Failures: 0, Errors: 0, Skipped: 0, Time elapsed: 29.198 sec - in org.apache.flink.runtime.operators.chaining.ChainTaskTest
Tests run: 2, Failures: 0, Errors: 0, Skipped: 0, Time elapsed: 6.557 sec - in org.apache.flink.runtime.io.network.partition.SpilledSubpartitionViewTest
Tests run: 10, Failures: 0, Errors: 0, Skipped: 0, Time elapsed: 6.611 sec - in org.apache.flink.runtime.io.network.partition.PipelinedSubpartitionTest
Tests run: 1, Failures: 0, Errors: 0, Skipped: 0, Time elapsed: 4.834 sec - in org.apache.flink.runtime.io.network.NetworkEnvironmentTest
Tests run: 6, Failures: 0, Errors: 0, Skipped: 0, Time elapsed: 26.233 sec - in org.apache.flink.runtime.executiongraph.ExecutionGraphDeploymentTest
Tests run: 1, Failures: 0, Errors: 0, Skipped: 0, Time elapsed: 9.428 sec - in org.apache.flink.runtime.io.network.partition.consumer.LocalInputChannelTest
Tests run: 6, Failures: 0, Errors: 0, Skipped: 0, Time elapsed: 8.177 sec - in org.apache.flink.runtime.io.network.api.serialization.SpanningRecordSerializerTest
Tests run: 4, Failures: 0, Errors: 0, Skipped: 0, Time elapsed: 13.835 sec - in org.apache.flink.runtime.io.disk.iomanager.AsynchronousFileIOChannelTest
Tests run: 6, Failures: 0, Errors: 0, Skipped: 0, Time elapsed: 34.453 sec - in org.apache.flink.runtime.operators.sort.FixedLengthRecordSorterTest
Tests run: 2, Failures: 0, Errors: 0, Skipped: 0, Time elapsed: 10.446 sec - in org.apache.flink.runtime.io.network.api.reader.BufferReaderTest
Tests run: 10, Failures: 0, Errors: 0, Skipped: 0, Time elapsed: 11.582 sec - in org.apache.flink.runtime.io.network.api.serialization.PagedViewsTest
Tests run: 1, Failures: 0, Errors: 0, Skipped: 0, Time elapsed: 21.904 sec - in org.apache.flink.runtime.taskmanager.TaskManagerProcessReapingTest
Tests run: 7, Failures: 0, Errors: 0, Skipped: 0, Time elapsed: 22.818 sec - in org.apache.flink.runtime.taskmanager.TaskManagerRegistrationTest
Tests run: 14, Failures: 0, Errors: 0, Skipped: 0, Time elapsed: 41.986 sec - in org.apache.flink.runtime.operators.hash.MemoryHashTableTest
Tests run: 3, Failures: 0, Errors: 0, Skipped: 0, Time elapsed: 40.915 sec - in org.apache.flink.runtime.operators.DataSourceTaskTest
Tests run: 7, Failures: 0, Errors: 0, Skipped: 0, Time elapsed: 53.255 sec - in org.apache.flink.runtime.operators.DataSinkTaskTest
Tests run: 2, Failures: 0, Errors: 0, Skipped: 0, Time elapsed: 33.014 sec - in org.apache.flink.runtime.io.network.partition.consumer.RemoteInputChannelTest
Tests run: 2, Failures: 0, Errors: 0, Skipped: 0, Time elapsed: 37.756 sec - in org.apache.flink.runtime.io.network.serialization.LargeRecordsTest
Tests run: 8, Failures: 0, Errors: 0, Skipped: 0, Time elapsed: 67.279 sec - in org.apache.flink.runtime.operators.sort.NormalizedKeySorterTest
Tests run: 6, Failures: 0, Errors: 0, Skipped: 0, Time elapsed: 66.096 sec - in org.apache.flink.runtime.io.disk.ChannelViewsTest

Results :

Failed tests: 
  NetworkBufferPoolTest.testDestroyAll:125 Should fail with an IllegalStateException
  LocalBufferPoolTest.destroyAndVerifyAllBuffersReturned:77 Did not return all buffers to memory segment pool after test. expected:<1024> but was:<1023>
  LocalBufferPoolTest.testRequestAfterDestroy:118 Call should have failed with an IllegalStateException

Tests in error: 
  LocalBufferPoolTest.testDestroyDuringBlockingRequest:323 » Execution java.lang...

Tests run: 608, Failures: 3, Errors: 1, Skipped: 0

[INFO] ------------------------------------------------------------------------
[INFO] BUILD FAILURE
[INFO] ------------------------------------------------------------------------
[INFO] Total time: 01:36 min
[INFO] Finished at: 2016-07-15T05:37:35-07:00
[INFO] Final Memory: 32M/2476M
[INFO] ------------------------------------------------------------------------
[ERROR] Failed to execute goal org.apache.maven.plugins:maven-surefire-plugin:2.17:test (default-test) on project flink-runtime: There are test failures.
[ERROR] 
[ERROR] Please refer to /space/parallel/flink/flink9/dataset/flink/FLINK-1930_4dbf030a6b0415832862c3fd0c3fe7403878a998/flink-runtime/target/surefire-reports for the individual test results.
[ERROR] -> [Help 1]
[ERROR] 
[ERROR] To see the full stack trace of the errors, re-run Maven with the -e switch.
[ERROR] Re-run Maven using the -X switch to enable full debug logging.
[ERROR] 
[ERROR] For more information about the errors and possible solutions, please read the following articles:
[ERROR] [Help 1] http://cwiki.apache.org/confluence/display/MAVEN/MojoFailureException
