Apache Maven 3.5.4 (1edded0938998edf8bf061f1ceb3cfdeccf443fe; 2018-06-17T11:33:14-07:00)
Maven home: /usr/local/apache-maven
Java version: 1.8.0_312, vendor: Private Build, runtime: /usr/lib/jvm/java-8-openjdk-amd64/jre
Default locale: en_US, platform encoding: UTF-8
OS name: "linux", version: "4.15.0-173-generic", arch: "amd64", family: "unix"
[INFO] Scanning for projects...
[INFO] ------------------------------------------------------------------------
[INFO] Reactor Build Order:
[INFO] 
[INFO] JGraphT - Parent                                                   [pom]
[INFO] JGraphT - Core                                                     [jar]
[INFO] JGraphT - I/O                                                      [jar]
[INFO] JGraphT - Optimized Graphs                                         [jar]
[INFO] JGraphT - Ext                                                      [jar]
[INFO] JGraphT - Guava Adapter                                            [jar]
[INFO] JGraphT - Demo                                                     [jar]
[INFO] JGraphT - Bundle                                                   [jar]
[INFO] JGraphT - Distributable Archives                                   [pom]
[INFO] 
[INFO] ------------------------< org.jgrapht:jgrapht >-------------------------
[INFO] Building JGraphT - Parent 1.2.1-SNAPSHOT                           [1/9]
[INFO] --------------------------------[ pom ]---------------------------------
[INFO] 
[INFO] --- maven-enforcer-plugin:1.0:enforce (enforce-maven) @ jgrapht ---
[INFO] Skipping Rule Enforcement.
[INFO] 
[INFO] ----------------------< org.jgrapht:jgrapht-core >----------------------
[INFO] Building JGraphT - Core 1.2.1-SNAPSHOT                             [2/9]
[INFO] --------------------------------[ jar ]---------------------------------
[INFO] 
[INFO] --- maven-enforcer-plugin:1.0:enforce (enforce-maven) @ jgrapht-core ---
[INFO] Skipping Rule Enforcement.
[INFO] 
[INFO] --- maven-resources-plugin:3.0.1:resources (default-resources) @ jgrapht-core ---
[INFO] Using 'UTF-8' encoding to copy filtered resources.
[INFO] skip non existing resourceDirectory /data-depot/user/Workspace/Reproducibility/Reproducibility-Scanner/reproducer/workspace/Bears-222/jgrapht-core/src/main/resources
[INFO] 
[INFO] --- maven-compiler-plugin:3.1:compile (default-compile) @ jgrapht-core ---
[INFO] Changes detected - recompiling the module!
[INFO] Compiling 346 source files to /data-depot/user/Workspace/Reproducibility/Reproducibility-Scanner/reproducer/workspace/Bears-222/jgrapht-core/target/classes
[WARNING] /data-depot/user/Workspace/Reproducibility/Reproducibility-Scanner/reproducer/workspace/Bears-222/jgrapht-core/src/main/java/org/jgrapht/alg/flow/MaximumFlowAlgorithmBase.java: /data-depot/user/Workspace/Reproducibility/Reproducibility-Scanner/reproducer/workspace/Bears-222/jgrapht-core/src/main/java/org/jgrapht/alg/flow/MaximumFlowAlgorithmBase.java uses unchecked or unsafe operations.
[WARNING] /data-depot/user/Workspace/Reproducibility/Reproducibility-Scanner/reproducer/workspace/Bears-222/jgrapht-core/src/main/java/org/jgrapht/alg/flow/MaximumFlowAlgorithmBase.java: Recompile with -Xlint:unchecked for details.
[INFO] 
[INFO] --- maven-bundle-plugin:3.5.0:manifest (default) @ jgrapht-core ---
[INFO] 
[INFO] --- maven-resources-plugin:3.0.1:testResources (default-testResources) @ jgrapht-core ---
[INFO] Using 'UTF-8' encoding to copy filtered resources.
[INFO] Copying 1 resource
[INFO] 
[INFO] --- maven-compiler-plugin:3.1:testCompile (default-testCompile) @ jgrapht-core ---
[INFO] Nothing to compile - all classes are up to date
[INFO] 
[INFO] --- maven-surefire-plugin:2.21.0:test (default-test) @ jgrapht-core ---
[INFO] 
[INFO] -------------------------------------------------------
[INFO]  T E S T S
[INFO] -------------------------------------------------------
[INFO] Running org.jgrapht.alg.shortestpath.BellmanFordShortestPathTest
[INFO] Tests run: 12, Failures: 0, Errors: 0, Skipped: 0, Time elapsed: 0.007 s - in org.jgrapht.alg.shortestpath.BellmanFordShortestPathTest
[INFO] Running org.jgrapht.alg.shortestpath.KShortestPathCostTest
[INFO] Tests run: 4, Failures: 0, Errors: 0, Skipped: 0, Time elapsed: 0.393 s - in org.jgrapht.alg.shortestpath.KShortestPathCostTest
[INFO] Running org.jgrapht.alg.shortestpath.AllDirectedPathsTest
[INFO] Tests run: 7, Failures: 0, Errors: 0, Skipped: 0, Time elapsed: 0.006 s - in org.jgrapht.alg.shortestpath.AllDirectedPathsTest
[INFO] Running org.jgrapht.alg.shortestpath.TreeSingleSourcePathsTest
[INFO] Tests run: 1, Failures: 0, Errors: 0, Skipped: 0, Time elapsed: 0 s - in org.jgrapht.alg.shortestpath.TreeSingleSourcePathsTest
[INFO] Running org.jgrapht.alg.shortestpath.SuurballeKDisjointShortestPathsTest
[INFO] Tests run: 20, Failures: 0, Errors: 0, Skipped: 0, Time elapsed: 0.048 s - in org.jgrapht.alg.shortestpath.SuurballeKDisjointShortestPathsTest
[INFO] Running org.jgrapht.alg.shortestpath.GraphMeasurerTest
[INFO] Tests run: 15, Failures: 0, Errors: 0, Skipped: 0, Time elapsed: 0.1 s - in org.jgrapht.alg.shortestpath.GraphMeasurerTest
[INFO] Running org.jgrapht.alg.shortestpath.JohnsonShortestPathsTest
[INFO] Tests run: 3, Failures: 0, Errors: 0, Skipped: 0, Time elapsed: 0.484 s - in org.jgrapht.alg.shortestpath.JohnsonShortestPathsTest
[INFO] Running org.jgrapht.alg.shortestpath.AStarShortestPathTest
[INFO] Tests run: 4, Failures: 0, Errors: 0, Skipped: 0, Time elapsed: 0.13 s - in org.jgrapht.alg.shortestpath.AStarShortestPathTest
[INFO] Running org.jgrapht.alg.shortestpath.MartinShortestPathTest
[INFO] Tests run: 2, Failures: 0, Errors: 0, Skipped: 0, Time elapsed: 0.003 s - in org.jgrapht.alg.shortestpath.MartinShortestPathTest
[INFO] Running org.jgrapht.alg.shortestpath.BhandariKDisjointShortestPathsTest
[INFO] Tests run: 21, Failures: 0, Errors: 0, Skipped: 0, Time elapsed: 0.034 s - in org.jgrapht.alg.shortestpath.BhandariKDisjointShortestPathsTest
[INFO] Running org.jgrapht.alg.shortestpath.ALTAdmissibleHeuristicTest
[INFO] Tests run: 2, Failures: 0, Errors: 0, Skipped: 0, Time elapsed: 0.898 s - in org.jgrapht.alg.shortestpath.ALTAdmissibleHeuristicTest
[INFO] Running org.jgrapht.alg.shortestpath.FloydWarshallPseudographsTest
[INFO] Tests run: 3, Failures: 0, Errors: 0, Skipped: 0, Time elapsed: 0.002 s - in org.jgrapht.alg.shortestpath.FloydWarshallPseudographsTest
[INFO] Running org.jgrapht.alg.shortestpath.TreeMeasurerTest
[INFO] Tests run: 3, Failures: 0, Errors: 0, Skipped: 0, Time elapsed: 0 s - in org.jgrapht.alg.shortestpath.TreeMeasurerTest
[INFO] Running org.jgrapht.alg.shortestpath.BidirectionalDijkstraShortestPathTest
[INFO] Tests run: 12, Failures: 0, Errors: 0, Skipped: 0, Time elapsed: 0.037 s - in org.jgrapht.alg.shortestpath.BidirectionalDijkstraShortestPathTest
[INFO] Running org.jgrapht.alg.shortestpath.KSPExampleTest
[INFO] Tests run: 3, Failures: 0, Errors: 0, Skipped: 0, Time elapsed: 0 s - in org.jgrapht.alg.shortestpath.KSPExampleTest
[INFO] Running org.jgrapht.alg.shortestpath.DijkstraShortestPathTest
[INFO] Tests run: 5, Failures: 0, Errors: 0, Skipped: 0, Time elapsed: 0.001 s - in org.jgrapht.alg.shortestpath.DijkstraShortestPathTest
[INFO] Running org.jgrapht.alg.shortestpath.FloydWarshallShortestPathsTest
[INFO] Tests run: 2, Failures: 0, Errors: 0, Skipped: 0, Time elapsed: 0.017 s - in org.jgrapht.alg.shortestpath.FloydWarshallShortestPathsTest
[INFO] Running org.jgrapht.alg.shortestpath.KShortestPathKValuesTest
[INFO] Tests run: 2, Failures: 0, Errors: 0, Skipped: 0, Time elapsed: 0.256 s - in org.jgrapht.alg.shortestpath.KShortestPathKValuesTest
[INFO] Running org.jgrapht.alg.shortestpath.AllPairsShortestPathsTest
[INFO] Tests run: 4, Failures: 0, Errors: 0, Skipped: 0, Time elapsed: 0.516 s - in org.jgrapht.alg.shortestpath.AllPairsShortestPathsTest
[INFO] Running org.jgrapht.alg.shortestpath.DijkstraClosestFirstIteratorTest
[INFO] Tests run: 1, Failures: 0, Errors: 0, Skipped: 0, Time elapsed: 0 s - in org.jgrapht.alg.shortestpath.DijkstraClosestFirstIteratorTest
[INFO] Running org.jgrapht.alg.shortestpath.KSPPathValidatorTest
[INFO] Tests run: 5, Failures: 0, Errors: 0, Skipped: 0, Time elapsed: 0.072 s - in org.jgrapht.alg.shortestpath.KSPPathValidatorTest
[INFO] Running org.jgrapht.alg.shortestpath.ListSingleSourcePathsTest
[INFO] Tests run: 1, Failures: 0, Errors: 0, Skipped: 0, Time elapsed: 0.007 s - in org.jgrapht.alg.shortestpath.ListSingleSourcePathsTest
[INFO] Running org.jgrapht.alg.shortestpath.KSPDiscardsValidPathsTest
[INFO] Tests run: 2, Failures: 0, Errors: 0, Skipped: 0, Time elapsed: 0 s - in org.jgrapht.alg.shortestpath.KSPDiscardsValidPathsTest
[INFO] Running org.jgrapht.alg.independentset.ChordalGraphIndependentSetFinderTest
[INFO] Tests run: 4, Failures: 0, Errors: 0, Skipped: 0, Time elapsed: 0.004 s - in org.jgrapht.alg.independentset.ChordalGraphIndependentSetFinderTest
[INFO] Running org.jgrapht.alg.TransitiveReductionTest
[INFO] Tests run: 8, Failures: 0, Errors: 0, Skipped: 0, Time elapsed: 0.001 s - in org.jgrapht.alg.TransitiveReductionTest
[INFO] Running org.jgrapht.alg.lca.TarjanLCAFinderTest
[INFO] Tests run: 20, Failures: 0, Errors: 0, Skipped: 0, Time elapsed: 7.129 s - in org.jgrapht.alg.lca.TarjanLCAFinderTest
[INFO] Running org.jgrapht.alg.lca.HeavyPathLCAFinderTest
[INFO] Tests run: 20, Failures: 0, Errors: 0, Skipped: 0, Time elapsed: 5.732 s - in org.jgrapht.alg.lca.HeavyPathLCAFinderTest
[INFO] Running org.jgrapht.alg.lca.NaiveLCAFinderTest
[INFO] Tests run: 5, Failures: 0, Errors: 0, Skipped: 0, Time elapsed: 0 s - in org.jgrapht.alg.lca.NaiveLCAFinderTest
[INFO] Running org.jgrapht.alg.lca.BinaryLiftingLCAFinderTest
[INFO] Tests run: 20, Failures: 0, Errors: 0, Skipped: 0, Time elapsed: 4.104 s - in org.jgrapht.alg.lca.BinaryLiftingLCAFinderTest
[INFO] Running org.jgrapht.alg.lca.EulerTourRMQLCAFinderTest
[INFO] Tests run: 20, Failures: 0, Errors: 0, Skipped: 0, Time elapsed: 4.979 s - in org.jgrapht.alg.lca.EulerTourRMQLCAFinderTest
[INFO] Running org.jgrapht.alg.clique.PivotBronKerboschCliqueFinderTest
[INFO] Tests run: 4, Failures: 0, Errors: 0, Skipped: 0, Time elapsed: 0.006 s - in org.jgrapht.alg.clique.PivotBronKerboschCliqueFinderTest
[INFO] Running org.jgrapht.alg.clique.DegeneracyBronKerboschCliqueFinderTest
[INFO] Tests run: 4, Failures: 0, Errors: 0, Skipped: 0, Time elapsed: 0.002 s - in org.jgrapht.alg.clique.DegeneracyBronKerboschCliqueFinderTest
[INFO] Running org.jgrapht.alg.clique.ChordalGraphMaxCliqueFinderTest
[INFO] Tests run: 4, Failures: 0, Errors: 0, Skipped: 0, Time elapsed: 0.01 s - in org.jgrapht.alg.clique.ChordalGraphMaxCliqueFinderTest
[INFO] Running org.jgrapht.alg.clique.AllVariantsBronKerboschCliqueFinderTest
[INFO] Tests run: 1, Failures: 0, Errors: 0, Skipped: 0, Time elapsed: 0.133 s - in org.jgrapht.alg.clique.AllVariantsBronKerboschCliqueFinderTest
[INFO] Running org.jgrapht.alg.clique.CliqueMinimalSeparatorDecompositionTest
[INFO] Tests run: 7, Failures: 0, Errors: 0, Skipped: 0, Time elapsed: 0.554 s - in org.jgrapht.alg.clique.CliqueMinimalSeparatorDecompositionTest
[INFO] Running org.jgrapht.alg.clique.BronKerboschCliqueFinderTest
[INFO] Tests run: 4, Failures: 0, Errors: 0, Skipped: 0, Time elapsed: 0.001 s - in org.jgrapht.alg.clique.BronKerboschCliqueFinderTest
[INFO] Running org.jgrapht.alg.cycle.HierholzerEulerianCycleTest
[INFO] Tests run: 36, Failures: 0, Errors: 0, Skipped: 0, Time elapsed: 2.426 s - in org.jgrapht.alg.cycle.HierholzerEulerianCycleTest
[INFO] Running org.jgrapht.alg.cycle.ChordalityInspectorTest
[INFO] Tests run: 44, Failures: 0, Errors: 0, Skipped: 0, Time elapsed: 0.026 s - in org.jgrapht.alg.cycle.ChordalityInspectorTest
[INFO] Running org.jgrapht.alg.cycle.BergeGraphInspectorTest
[INFO] Tests run: 21, Failures: 0, Errors: 0, Skipped: 0, Time elapsed: 0.59 s - in org.jgrapht.alg.cycle.BergeGraphInspectorTest
[INFO] Running org.jgrapht.alg.cycle.ChordalGraphMinimalVertexSeparatorFinderTest
[INFO] Tests run: 6, Failures: 0, Errors: 0, Skipped: 0, Time elapsed: 0 s - in org.jgrapht.alg.cycle.ChordalGraphMinimalVertexSeparatorFinderTest
[INFO] Running org.jgrapht.alg.cycle.JohnsonSimpleCyclesTest
[INFO] Tests run: 1, Failures: 0, Errors: 0, Skipped: 0, Time elapsed: 0 s - in org.jgrapht.alg.cycle.JohnsonSimpleCyclesTest
[INFO] Running org.jgrapht.alg.cycle.StackBFSFundamentalCycleBasisTest
[INFO] Tests run: 8, Failures: 0, Errors: 0, Skipped: 0, Time elapsed: 0.001 s - in org.jgrapht.alg.cycle.StackBFSFundamentalCycleBasisTest
[INFO] Running org.jgrapht.alg.cycle.DirectedSimpleCyclesTest
[INFO] Tests run: 1, Failures: 0, Errors: 0, Skipped: 0, Time elapsed: 3.234 s - in org.jgrapht.alg.cycle.DirectedSimpleCyclesTest
[INFO] Running org.jgrapht.alg.cycle.PatonCycleBaseTest
[INFO] Tests run: 15, Failures: 0, Errors: 0, Skipped: 0, Time elapsed: 0.305 s - in org.jgrapht.alg.cycle.PatonCycleBaseTest
[INFO] Running org.jgrapht.alg.cycle.CyclesTest
[INFO] Tests run: 5, Failures: 0, Errors: 0, Skipped: 0, Time elapsed: 0.001 s - in org.jgrapht.alg.cycle.CyclesTest
[INFO] Running org.jgrapht.alg.cycle.CycleDetectorTest
[INFO] Tests run: 4, Failures: 0, Errors: 0, Skipped: 0, Time elapsed: 0.001 s - in org.jgrapht.alg.cycle.CycleDetectorTest
[INFO] Running org.jgrapht.alg.cycle.QueueBFSFundamentalCycleBasisTest
[INFO] Tests run: 7, Failures: 0, Errors: 0, Skipped: 0, Time elapsed: 0.001 s - in org.jgrapht.alg.cycle.QueueBFSFundamentalCycleBasisTest
[INFO] Running org.jgrapht.alg.cycle.WeakChordalityInspectorTest
[INFO] Tests run: 26, Failures: 0, Errors: 0, Skipped: 0, Time elapsed: 0.193 s - in org.jgrapht.alg.cycle.WeakChordalityInspectorTest
[INFO] Running org.jgrapht.alg.cycle.ChinesePostmanTest
[INFO] Tests run: 16, Failures: 0, Errors: 0, Skipped: 0, Time elapsed: 0.015 s - in org.jgrapht.alg.cycle.ChinesePostmanTest
[INFO] Running org.jgrapht.alg.transform.LineGraphConverterTest
[INFO] Tests run: 6, Failures: 0, Errors: 0, Skipped: 0, Time elapsed: 0 s - in org.jgrapht.alg.transform.LineGraphConverterTest
[INFO] Running org.jgrapht.alg.partition.BipartitePartitioningTest
[INFO] Tests run: 14, Failures: 0, Errors: 0, Skipped: 0, Time elapsed: 1.025 s - in org.jgrapht.alg.partition.BipartitePartitioningTest
[INFO] Running org.jgrapht.alg.matching.GreedyMaximumCardinalityMatchingTest
[INFO] Tests run: 2, Failures: 0, Errors: 0, Skipped: 0, Time elapsed: 0.362 s - in org.jgrapht.alg.matching.GreedyMaximumCardinalityMatchingTest
[INFO] Running org.jgrapht.alg.matching.PathGrowingWeightedMatchingTest
[INFO] Tests run: 15, Failures: 0, Errors: 0, Skipped: 0, Time elapsed: 0.367 s - in org.jgrapht.alg.matching.PathGrowingWeightedMatchingTest
[INFO] Running org.jgrapht.alg.matching.NoHeuristicsPathGrowingWeightedMatchingTest
[INFO] Tests run: 15, Failures: 0, Errors: 0, Skipped: 0, Time elapsed: 0.263 s - in org.jgrapht.alg.matching.NoHeuristicsPathGrowingWeightedMatchingTest
[INFO] Running org.jgrapht.alg.matching.EdmondsMaximumCardinalityMatchingTest
[INFO] Tests run: 23, Failures: 0, Errors: 0, Skipped: 0, Time elapsed: 0.366 s - in org.jgrapht.alg.matching.EdmondsMaximumCardinalityMatchingTest
[INFO] Running org.jgrapht.alg.matching.blossom.v5.KolmogorovMinimumWeightPerfectMatchingTest
[INFO] Tests run: 1248, Failures: 0, Errors: 0, Skipped: 0, Time elapsed: 1.131 s - in org.jgrapht.alg.matching.blossom.v5.KolmogorovMinimumWeightPerfectMatchingTest
[INFO] Running org.jgrapht.alg.matching.blossom.v5.BlossomVInitializerTest
[INFO] Tests run: 11, Failures: 0, Errors: 0, Skipped: 0, Time elapsed: 0 s - in org.jgrapht.alg.matching.blossom.v5.BlossomVInitializerTest
[INFO] Running org.jgrapht.alg.matching.blossom.v5.BlossomVTreeEdgeTest
[INFO] Tests run: 2, Failures: 0, Errors: 0, Skipped: 0, Time elapsed: 0 s - in org.jgrapht.alg.matching.blossom.v5.BlossomVTreeEdgeTest
[INFO] Running org.jgrapht.alg.matching.blossom.v5.BlossomVPrimalUpdaterTest
[INFO] Tests run: 24, Failures: 0, Errors: 0, Skipped: 0, Time elapsed: 0.001 s - in org.jgrapht.alg.matching.blossom.v5.BlossomVPrimalUpdaterTest
[INFO] Running org.jgrapht.alg.matching.blossom.v5.BlossomVStateTest
[INFO] Tests run: 2, Failures: 0, Errors: 0, Skipped: 0, Time elapsed: 0.001 s - in org.jgrapht.alg.matching.blossom.v5.BlossomVStateTest
[INFO] Running org.jgrapht.alg.matching.blossom.v5.BlossomVTreeTest
[INFO] Tests run: 3, Failures: 0, Errors: 0, Skipped: 0, Time elapsed: 0 s - in org.jgrapht.alg.matching.blossom.v5.BlossomVTreeTest
[INFO] Running org.jgrapht.alg.matching.blossom.v5.BlossomVDualUpdaterTest
[INFO] Tests run: 6, Failures: 0, Errors: 0, Skipped: 0, Time elapsed: 0 s - in org.jgrapht.alg.matching.blossom.v5.BlossomVDualUpdaterTest
[INFO] Running org.jgrapht.alg.matching.blossom.v5.BlossomVNodeTest
[INFO] Tests run: 9, Failures: 0, Errors: 0, Skipped: 0, Time elapsed: 0 s - in org.jgrapht.alg.matching.blossom.v5.BlossomVNodeTest
[INFO] Running org.jgrapht.alg.matching.HopcroftKarpMaximumCardinalityBipartiteMatchingTest
[INFO] Tests run: 8, Failures: 0, Errors: 0, Skipped: 0, Time elapsed: 0.155 s - in org.jgrapht.alg.matching.HopcroftKarpMaximumCardinalityBipartiteMatchingTest
[INFO] Running org.jgrapht.alg.matching.GreedyWeightedMatchingTest
[INFO] Tests run: 13, Failures: 0, Errors: 0, Skipped: 0, Time elapsed: 0.18 s - in org.jgrapht.alg.matching.GreedyWeightedMatchingTest
[INFO] Running org.jgrapht.alg.matching.KuhnMunkresMinimalWeightBipartitePerfectMatchingTest
[INFO] Tests run: 11, Failures: 0, Errors: 0, Skipped: 0, Time elapsed: 0.005 s - in org.jgrapht.alg.matching.KuhnMunkresMinimalWeightBipartitePerfectMatchingTest
[INFO] Running org.jgrapht.alg.matching.MaximumWeightBipartiteMatchingTest
[INFO] Tests run: 5, Failures: 0, Errors: 0, Skipped: 0, Time elapsed: 0.006 s - in org.jgrapht.alg.matching.MaximumWeightBipartiteMatchingTest
[INFO] Running org.jgrapht.alg.isomorphism.VF2SubgraphIsomorphismInspectorTest
[INFO] Tests run: 8, Failures: 0, Errors: 0, Skipped: 0, Time elapsed: 0.817 s - in org.jgrapht.alg.isomorphism.VF2SubgraphIsomorphismInspectorTest
[INFO] Running org.jgrapht.alg.isomorphism.IsomorphicGraphMappingTest
[INFO] Tests run: 3, Failures: 0, Errors: 0, Skipped: 0, Time elapsed: 1.295 s - in org.jgrapht.alg.isomorphism.IsomorphicGraphMappingTest
[INFO] Running org.jgrapht.alg.isomorphism.AHUForestIsomorphismInspectorTest
[INFO] Tests run: 7, Failures: 0, Errors: 0, Skipped: 0, Time elapsed: 0.003 s - in org.jgrapht.alg.isomorphism.AHUForestIsomorphismInspectorTest
[INFO] Running org.jgrapht.alg.isomorphism.AHURootedTreeIsomorphismInspectorTest
[INFO] Tests run: 13, Failures: 0, Errors: 0, Skipped: 0, Time elapsed: 1.116 s - in org.jgrapht.alg.isomorphism.AHURootedTreeIsomorphismInspectorTest
[INFO] Running org.jgrapht.alg.isomorphism.GraphOrderingTest
[INFO] Tests run: 2, Failures: 0, Errors: 0, Skipped: 0, Time elapsed: 0 s - in org.jgrapht.alg.isomorphism.GraphOrderingTest
[INFO] Running org.jgrapht.alg.isomorphism.AHUUnrootedTreeIsomorphismInspectorTest

[INFO] Tests run: 14, Failures: 0, Errors: 0, Skipped: 0, Time elapsed: 0.554 s - in org.jgrapht.alg.isomorphism.AHUUnrootedTreeIsomorphismInspectorTest
[INFO] Running org.jgrapht.alg.isomorphism.VF2GraphIsomorphismInspectorTest
[INFO] Tests run: 3, Failures: 0, Errors: 0, Skipped: 0, Time elapsed: 0.007 s - in org.jgrapht.alg.isomorphism.VF2GraphIsomorphismInspectorTest
[INFO] Running org.jgrapht.alg.isomorphism.ColorRefinementIsomorphismInspectorTest
[INFO] Tests run: 9, Failures: 0, Errors: 0, Skipped: 0, Time elapsed: 0.013 s - in org.jgrapht.alg.isomorphism.ColorRefinementIsomorphismInspectorTest
[INFO] Running org.jgrapht.alg.tour.ChristofidesThreeHalvesApproxMetricTSPTest
[INFO] Tests run: 11, Failures: 0, Errors: 0, Skipped: 0, Time elapsed: 16.293 s - in org.jgrapht.alg.tour.ChristofidesThreeHalvesApproxMetricTSPTest
[INFO] Running org.jgrapht.alg.tour.PalmerHamiltonianCycleTest
[INFO] Tests run: 2, Failures: 0, Errors: 0, Skipped: 0, Time elapsed: 0.001 s - in org.jgrapht.alg.tour.PalmerHamiltonianCycleTest
[INFO] Running org.jgrapht.alg.tour.TwoApproxMetricTSPTest
[INFO] Tests run: 5, Failures: 0, Errors: 0, Skipped: 0, Time elapsed: 0.042 s - in org.jgrapht.alg.tour.TwoApproxMetricTSPTest
[INFO] Running org.jgrapht.alg.decomposition.DulmageMendelsohnDecompositionTest
[INFO] Tests run: 100, Failures: 0, Errors: 0, Skipped: 0, Time elapsed: 1.053 s - in org.jgrapht.alg.decomposition.DulmageMendelsohnDecompositionTest
[INFO] Running org.jgrapht.alg.decomposition.HeavyPathDecompositionTest
[INFO] Tests run: 9, Failures: 0, Errors: 0, Skipped: 0, Time elapsed: 0 s - in org.jgrapht.alg.decomposition.HeavyPathDecompositionTest
[INFO] Running org.jgrapht.alg.util.NeighborCacheTest
[INFO] Tests run: 4, Failures: 0, Errors: 0, Skipped: 0, Time elapsed: 0 s - in org.jgrapht.alg.util.NeighborCacheTest
[INFO] Running org.jgrapht.alg.util.AliasMethodSamplerTest
[INFO] Tests run: 3, Failures: 0, Errors: 0, Skipped: 0, Time elapsed: 0.087 s - in org.jgrapht.alg.util.AliasMethodSamplerTest
[INFO] Running org.jgrapht.alg.util.VertexDegreeComparatorTest
[INFO] Tests run: 1, Failures: 0, Errors: 0, Skipped: 0, Time elapsed: 0.017 s - in org.jgrapht.alg.util.VertexDegreeComparatorTest
[INFO] Running org.jgrapht.alg.util.UnionFindTest
[INFO] Tests run: 1, Failures: 0, Errors: 0, Skipped: 0, Time elapsed: 0 s - in org.jgrapht.alg.util.UnionFindTest
[INFO] Running org.jgrapht.alg.util.FixedSizeIntegerQueueTest
[INFO] Tests run: 1, Failures: 0, Errors: 0, Skipped: 0, Time elapsed: 0 s - in org.jgrapht.alg.util.FixedSizeIntegerQueueTest
[INFO] Running org.jgrapht.alg.util.PairTest
[INFO] Tests run: 10, Failures: 0, Errors: 0, Skipped: 0, Time elapsed: 0 s - in org.jgrapht.alg.util.PairTest
[INFO] Running org.jgrapht.alg.color.SmallestDegreeLastColoringTest
[INFO] Tests run: 9, Failures: 0, Errors: 0, Skipped: 0, Time elapsed: 0 s - in org.jgrapht.alg.color.SmallestDegreeLastColoringTest
[INFO] Running org.jgrapht.alg.color.ChordalGraphColoringTest
[INFO] Tests run: 5, Failures: 0, Errors: 0, Skipped: 0, Time elapsed: 0 s - in org.jgrapht.alg.color.ChordalGraphColoringTest
[INFO] Running org.jgrapht.alg.color.RandomGreedyColoring2Test
[INFO] Tests run: 7, Failures: 0, Errors: 0, Skipped: 0, Time elapsed: 0 s - in org.jgrapht.alg.color.RandomGreedyColoring2Test
[INFO] Running org.jgrapht.alg.color.LargestDegreeFirstColoringTest
[INFO] Tests run: 11, Failures: 0, Errors: 0, Skipped: 0, Time elapsed: 0.023 s - in org.jgrapht.alg.color.LargestDegreeFirstColoringTest
[INFO] Running org.jgrapht.alg.color.RandomGreedyColoringTest
[INFO] Tests run: 7, Failures: 0, Errors: 0, Skipped: 0, Time elapsed: 0.001 s - in org.jgrapht.alg.color.RandomGreedyColoringTest
[INFO] Running org.jgrapht.alg.color.BrownBacktrackColoringTest
[INFO] Tests run: 7, Failures: 0, Errors: 0, Skipped: 0, Time elapsed: 1.357 s - in org.jgrapht.alg.color.BrownBacktrackColoringTest
[INFO] Running org.jgrapht.alg.color.ColorRefinementAlgorithmTest
[INFO] Tests run: 4, Failures: 0, Errors: 0, Skipped: 0, Time elapsed: 0.001 s - in org.jgrapht.alg.color.ColorRefinementAlgorithmTest
[INFO] Running org.jgrapht.alg.color.GreedyColoringTest
[INFO] Tests run: 8, Failures: 0, Errors: 0, Skipped: 0, Time elapsed: 0.001 s - in org.jgrapht.alg.color.GreedyColoringTest
[INFO] Running org.jgrapht.alg.color.SaturationDegreeColoringTest
[INFO] Tests run: 8, Failures: 0, Errors: 0, Skipped: 0, Time elapsed: 0.004 s - in org.jgrapht.alg.color.SaturationDegreeColoringTest
[INFO] Running org.jgrapht.alg.TarjanLowestCommonAncestorTest
[INFO] Tests run: 3, Failures: 0, Errors: 0, Skipped: 0, Time elapsed: 0 s - in org.jgrapht.alg.TarjanLowestCommonAncestorTest
[INFO] Running org.jgrapht.alg.scoring.PageRankTest
[INFO] Tests run: 10, Failures: 0, Errors: 0, Skipped: 0, Time elapsed: 0.001 s - in org.jgrapht.alg.scoring.PageRankTest
[INFO] Running org.jgrapht.alg.scoring.ClusteringCoefficientTest
[INFO] Tests run: 15, Failures: 0, Errors: 0, Skipped: 0, Time elapsed: 0.173 s - in org.jgrapht.alg.scoring.ClusteringCoefficientTest
[INFO] Running org.jgrapht.alg.scoring.ClosenessCentralityTest
[INFO] Tests run: 8, Failures: 0, Errors: 0, Skipped: 0, Time elapsed: 0 s - in org.jgrapht.alg.scoring.ClosenessCentralityTest
[INFO] Running org.jgrapht.alg.scoring.HarmonicCentralityTest
[INFO] Tests run: 8, Failures: 0, Errors: 0, Skipped: 0, Time elapsed: 0 s - in org.jgrapht.alg.scoring.HarmonicCentralityTest
[INFO] Running org.jgrapht.alg.scoring.CorenessTest
[INFO] Tests run: 6, Failures: 0, Errors: 0, Skipped: 0, Time elapsed: 0 s - in org.jgrapht.alg.scoring.CorenessTest
[INFO] Running org.jgrapht.alg.scoring.BetweennessCentralityTest
[INFO] Tests run: 17, Failures: 0, Errors: 0, Skipped: 0, Time elapsed: 0.019 s - in org.jgrapht.alg.scoring.BetweennessCentralityTest
[INFO] Running org.jgrapht.alg.scoring.AlphaCentralityTest
[INFO] Tests run: 13, Failures: 0, Errors: 0, Skipped: 0, Time elapsed: 0.003 s - in org.jgrapht.alg.scoring.AlphaCentralityTest
[INFO] Running org.jgrapht.alg.flow.PushRelabelMinimumSTCutTest
[INFO] Tests run: 26, Failures: 0, Errors: 0, Skipped: 0, Time elapsed: 1.458 s - in org.jgrapht.alg.flow.PushRelabelMinimumSTCutTest
[INFO] Running org.jgrapht.alg.flow.GusfieldGomoryHuCutTreeTest
[INFO] Tests run: 7, Failures: 0, Errors: 0, Skipped: 0, Time elapsed: 0.212 s - in org.jgrapht.alg.flow.GusfieldGomoryHuCutTreeTest
[INFO] Running org.jgrapht.alg.flow.mincost.CapacityScalingMinimumCostFlowTest
[INFO] Tests run: 85, Failures: 0, Errors: 0, Skipped: 0, Time elapsed: 0.102 s - in org.jgrapht.alg.flow.mincost.CapacityScalingMinimumCostFlowTest
[INFO] Running org.jgrapht.alg.flow.PushRelabelMFImplTest
[INFO] Tests run: 23, Failures: 0, Errors: 0, Skipped: 0, Time elapsed: 0.018 s - in org.jgrapht.alg.flow.PushRelabelMFImplTest
[INFO] Running org.jgrapht.alg.flow.EdmondsKarpMinimumSTCutTest
[INFO] Tests run: 24, Failures: 0, Errors: 0, Skipped: 0, Time elapsed: 1.128 s - in org.jgrapht.alg.flow.EdmondsKarpMinimumSTCutTest
[INFO] Running org.jgrapht.alg.flow.PadbergRaoOddMinimumCutsetTest
[INFO] Tests run: 5, Failures: 0, Errors: 0, Skipped: 0, Time elapsed: 0.383 s - in org.jgrapht.alg.flow.PadbergRaoOddMinimumCutsetTest
[INFO] Running org.jgrapht.alg.flow.GusfieldEquivalentFlowTreeTest
[INFO] Tests run: 7, Failures: 0, Errors: 0, Skipped: 0, Time elapsed: 0.055 s - in org.jgrapht.alg.flow.GusfieldEquivalentFlowTreeTest
[INFO] Running org.jgrapht.alg.flow.DinicMFImplTest
[INFO] Tests run: 26, Failures: 0, Errors: 0, Skipped: 0, Time elapsed: 0.034 s - in org.jgrapht.alg.flow.DinicMFImplTest
[INFO] Running org.jgrapht.alg.flow.EdmondsKarpMFImplTest
[INFO] Tests run: 22, Failures: 0, Errors: 0, Skipped: 0, Time elapsed: 0.022 s - in org.jgrapht.alg.flow.EdmondsKarpMFImplTest
[INFO] Running org.jgrapht.alg.vertexcover.GreedyVCImplTest
[INFO] Tests run: 2, Failures: 0, Errors: 0, Skipped: 0, Time elapsed: 0.236 s - in org.jgrapht.alg.vertexcover.GreedyVCImplTest
[INFO] Running org.jgrapht.alg.vertexcover.EdgeBasedTwoApproxVCImplTest
[INFO] Tests run: 2, Failures: 0, Errors: 0, Skipped: 0, Time elapsed: 0.346 s - in org.jgrapht.alg.vertexcover.EdgeBasedTwoApproxVCImplTest
[INFO] Running org.jgrapht.alg.vertexcover.ClarksonTwoApproxVCImplTest
[INFO] Tests run: 3, Failures: 0, Errors: 0, Skipped: 0, Time elapsed: 0.893 s - in org.jgrapht.alg.vertexcover.ClarksonTwoApproxVCImplTest
[INFO] Running org.jgrapht.alg.vertexcover.RecursiveExactVCImplTest
[INFO] Tests run: 4, Failures: 0, Errors: 0, Skipped: 0, Time elapsed: 0 s - in org.jgrapht.alg.vertexcover.RecursiveExactVCImplTest
[INFO] Running org.jgrapht.alg.vertexcover.BarYehudaEvenTwoApproxVCImplTest
[INFO] Tests run: 3, Failures: 0, Errors: 0, Skipped: 0, Time elapsed: 0.375 s - in org.jgrapht.alg.vertexcover.BarYehudaEvenTwoApproxVCImplTest
[INFO] Running org.jgrapht.alg.TransitiveClosureTest
[INFO] Tests run: 6, Failures: 0, Errors: 0, Skipped: 0, Time elapsed: 0.004 s - in org.jgrapht.alg.TransitiveClosureTest
[INFO] Running org.jgrapht.alg.spanning.BoruvkaMinimumSpanningTreeTest
[INFO] Tests run: 3, Failures: 0, Errors: 0, Skipped: 0, Time elapsed: 2.108 s - in org.jgrapht.alg.spanning.BoruvkaMinimumSpanningTreeTest
[INFO] Running org.jgrapht.alg.spanning.KruskalMinimumSpanningTreeTest
[INFO] Tests run: 3, Failures: 0, Errors: 0, Skipped: 0, Time elapsed: 1.329 s - in org.jgrapht.alg.spanning.KruskalMinimumSpanningTreeTest
[INFO] Running org.jgrapht.alg.spanning.GreedyMultiplicativeSpannerTest
[INFO] Tests run: 6, Failures: 0, Errors: 0, Skipped: 0, Time elapsed: 0.003 s - in org.jgrapht.alg.spanning.GreedyMultiplicativeSpannerTest
[INFO] Running org.jgrapht.alg.spanning.PrimMinimumSpanningTreeTest
[INFO] Tests run: 3, Failures: 0, Errors: 0, Skipped: 0, Time elapsed: 1.237 s - in org.jgrapht.alg.spanning.PrimMinimumSpanningTreeTest
[INFO] Running org.jgrapht.alg.StoerWagnerMinimumCutTest
[INFO] Tests run: 10, Failures: 0, Errors: 0, Skipped: 0, Time elapsed: 0.001 s - in org.jgrapht.alg.StoerWagnerMinimumCutTest
[INFO] Running org.jgrapht.alg.connectivity.StrongConnectivityAlgorithmTest
[INFO] Tests run: 3, Failures: 0, Errors: 0, Skipped: 0, Time elapsed: 0.001 s - in org.jgrapht.alg.connectivity.StrongConnectivityAlgorithmTest
[INFO] Running org.jgrapht.alg.connectivity.BlockCutpointGraphTest
[INFO] Tests run: 2, Failures: 0, Errors: 0, Skipped: 0, Time elapsed: 0.058 s - in org.jgrapht.alg.connectivity.BlockCutpointGraphTest
[INFO] Running org.jgrapht.alg.connectivity.BiconnectivityInspectorTest
[INFO] Tests run: 8, Failures: 0, Errors: 0, Skipped: 0, Time elapsed: 0 s - in org.jgrapht.alg.connectivity.BiconnectivityInspectorTest
[INFO] Running org.jgrapht.alg.connectivity.ConnectivityInspectorTest
[INFO] Tests run: 2, Failures: 0, Errors: 0, Skipped: 0, Time elapsed: 0 s - in org.jgrapht.alg.connectivity.ConnectivityInspectorTest
[INFO] Running org.jgrapht.generate.PlantedPartitionGraphGeneratorTest
[INFO] Tests run: 22, Failures: 0, Errors: 0, Skipped: 0, Time elapsed: 0.006 s - in org.jgrapht.generate.PlantedPartitionGraphGeneratorTest
[INFO] Running org.jgrapht.generate.RandomRegularGraphGeneratorTest
[INFO] Tests run: 11, Failures: 0, Errors: 0, Skipped: 0, Time elapsed: 0.007 s - in org.jgrapht.generate.RandomRegularGraphGeneratorTest
[INFO] Running org.jgrapht.generate.BarabasiAlbertForestGeneratorTest
[INFO] Tests run: 8, Failures: 0, Errors: 0, Skipped: 0, Time elapsed: 0.682 s - in org.jgrapht.generate.BarabasiAlbertForestGeneratorTest
[INFO] Running org.jgrapht.generate.GnpRandomGraphGeneratorTest
[INFO] Tests run: 10, Failures: 0, Errors: 0, Skipped: 0, Time elapsed: 0 s - in org.jgrapht.generate.GnpRandomGraphGeneratorTest
[INFO] Running org.jgrapht.generate.WindmillGraphsGeneratorTest
[INFO] Tests run: 7, Failures: 0, Errors: 0, Skipped: 0, Time elapsed: 0 s - in org.jgrapht.generate.WindmillGraphsGeneratorTest
[INFO] Running org.jgrapht.generate.GnmRandomBipartiteGraphGeneratorTest
[INFO] Tests run: 5, Failures: 0, Errors: 0, Skipped: 0, Time elapsed: 0 s - in org.jgrapht.generate.GnmRandomBipartiteGraphGeneratorTest
[INFO] Running org.jgrapht.generate.ComplementGraphGeneratorTest
[INFO] Tests run: 4, Failures: 0, Errors: 0, Skipped: 0, Time elapsed: 0 s - in org.jgrapht.generate.ComplementGraphGeneratorTest
[INFO] Running org.jgrapht.generate.KleinbergSmallWorldGraphGeneratorTest
[INFO] Tests run: 4, Failures: 0, Errors: 0, Skipped: 0, Time elapsed: 0 s - in org.jgrapht.generate.KleinbergSmallWorldGraphGeneratorTest
[INFO] Running org.jgrapht.generate.BarabasiAlbertGraphGeneratorTest
[INFO] Tests run: 6, Failures: 0, Errors: 0, Skipped: 0, Time elapsed: 0 s - in org.jgrapht.generate.BarabasiAlbertGraphGeneratorTest
[INFO] Running org.jgrapht.generate.LinearizedChordDiagramGraphGeneratorTest
[INFO] Tests run: 8, Failures: 0, Errors: 0, Skipped: 0, Time elapsed: 0.001 s - in org.jgrapht.generate.LinearizedChordDiagramGraphGeneratorTest
[INFO] Running org.jgrapht.generate.PruferTreeGeneratorTest
[INFO] Tests run: 12, Failures: 0, Errors: 0, Skipped: 0, Time elapsed: 1.673 s - in org.jgrapht.generate.PruferTreeGeneratorTest
[INFO] Running org.jgrapht.generate.GnpRandomBipartiteGraphGeneratorTest
[INFO] Tests run: 8, Failures: 0, Errors: 0, Skipped: 0, Time elapsed: 0 s - in org.jgrapht.generate.GnpRandomBipartiteGraphGeneratorTest
[INFO] Running org.jgrapht.generate.GeneralizedPetersenGraphGeneratorTest
[INFO] Tests run: 7, Failures: 0, Errors: 0, Skipped: 0, Time elapsed: 0 s - in org.jgrapht.generate.GeneralizedPetersenGraphGeneratorTest
[INFO] Running org.jgrapht.generate.GnmRandomGraphGeneratorTest
[INFO] Tests run: 16, Failures: 0, Errors: 0, Skipped: 0, Time elapsed: 0.002 s - in org.jgrapht.generate.GnmRandomGraphGeneratorTest
[INFO] Running org.jgrapht.generate.GraphGeneratorTest
[INFO] Tests run: 10, Failures: 0, Errors: 0, Skipped: 0, Time elapsed: 0.019 s - in org.jgrapht.generate.GraphGeneratorTest
[INFO] Running org.jgrapht.generate.NamedGraphGeneratorTest
[INFO] Tests run: 36, Failures: 0, Errors: 0, Skipped: 0, Time elapsed: 1.337 s - in org.jgrapht.generate.NamedGraphGeneratorTest
[INFO] Running org.jgrapht.generate.WattsStrogatzGraphGeneratorTest
[ERROR] Tests run: 10, Failures: 0, Errors: 1, Skipped: 0, Time elapsed: 0.004 s <<< FAILURE! - in org.jgrapht.generate.WattsStrogatzGraphGeneratorTest
[ERROR] testNonIntegerVertices(org.jgrapht.generate.WattsStrogatzGraphGeneratorTest)  Time elapsed: 0.002 s  <<< ERROR!
java.lang.NullPointerException
	at org.jgrapht.generate.WattsStrogatzGraphGeneratorTest.testNonIntegerVertices(WattsStrogatzGraphGeneratorTest.java:193)

[INFO] Running org.jgrapht.GraphMetricsTest
[INFO] Tests run: 19, Failures: 0, Errors: 0, Skipped: 0, Time elapsed: 2.318 s - in org.jgrapht.GraphMetricsTest
[INFO] Running org.jgrapht.util.VertexToIntegerMappingTest
[INFO] Tests run: 4, Failures: 0, Errors: 0, Skipped: 0, Time elapsed: 0.213 s - in org.jgrapht.util.VertexToIntegerMappingTest
[INFO] Running org.jgrapht.util.RadixSortTest
[INFO] Tests run: 4, Failures: 0, Errors: 0, Skipped: 0, Time elapsed: 0.121 s - in org.jgrapht.util.RadixSortTest
[INFO] Running org.jgrapht.util.PrefetchIteratorTest
[INFO] Tests run: 2, Failures: 0, Errors: 0, Skipped: 0, Time elapsed: 0 s - in org.jgrapht.util.PrefetchIteratorTest
[INFO] Running org.jgrapht.util.UnmodifiableUnionSetTest
[INFO] Tests run: 7, Failures: 0, Errors: 0, Skipped: 0, Time elapsed: 0.002 s - in org.jgrapht.util.UnmodifiableUnionSetTest
[INFO] Running org.jgrapht.util.FibonacciHeapTest
[INFO] Tests run: 6, Failures: 0, Errors: 0, Skipped: 0, Time elapsed: 0.014 s - in org.jgrapht.util.FibonacciHeapTest
[INFO] Running org.jgrapht.graph.SerializationTest
[INFO] Tests run: 2, Failures: 0, Errors: 0, Skipped: 0, Time elapsed: 0.037 s - in org.jgrapht.graph.SerializationTest
[INFO] Running org.jgrapht.graph.CloneTest
[INFO] Tests run: 2, Failures: 0, Errors: 0, Skipped: 0, Time elapsed: 0 s - in org.jgrapht.graph.CloneTest
[INFO] Running org.jgrapht.graph.ListenableGraphTest
[INFO] Tests run: 4, Failures: 0, Errors: 0, Skipped: 0, Time elapsed: 0 s - in org.jgrapht.graph.ListenableGraphTest
[INFO] Running org.jgrapht.graph.SimpleDirectedGraphTest
[INFO] Tests run: 22, Failures: 0, Errors: 0, Skipped: 0, Time elapsed: 0.001 s - in org.jgrapht.graph.SimpleDirectedGraphTest
[INFO] Running org.jgrapht.graph.IncomingOutgoingEdgesTest
[INFO] Tests run: 2, Failures: 0, Errors: 0, Skipped: 0, Time elapsed: 0 s - in org.jgrapht.graph.IncomingOutgoingEdgesTest
[INFO] Running org.jgrapht.graph.WeightedGraphAsWeightedGraphTest
[INFO] Tests run: 7, Failures: 0, Errors: 0, Skipped: 0, Time elapsed: 0 s - in org.jgrapht.graph.WeightedGraphAsWeightedGraphTest
[INFO] Running org.jgrapht.graph.GraphWalkTest
[INFO] Tests run: 15, Failures: 0, Errors: 0, Skipped: 0, Time elapsed: 0 s - in org.jgrapht.graph.GraphWalkTest
[INFO] Running org.jgrapht.graph.AsSubgraphTest
[INFO] Tests run: 9, Failures: 0, Errors: 0, Skipped: 0, Time elapsed: 0.001 s - in org.jgrapht.graph.AsSubgraphTest
[INFO] Running org.jgrapht.graph.DirectedAcyclicGraphTest
[INFO] Tests run: 12, Failures: 0, Errors: 0, Skipped: 0, Time elapsed: 0.522 s - in org.jgrapht.graph.DirectedAcyclicGraphTest
[INFO] Running org.jgrapht.graph.WeightedGraphTest
[INFO] Tests run: 5, Failures: 0, Errors: 0, Skipped: 0, Time elapsed: 0 s - in org.jgrapht.graph.WeightedGraphTest
[INFO] Running org.jgrapht.graph.MaskVertexSetTest
[INFO] Tests run: 3, Failures: 0, Errors: 0, Skipped: 0, Time elapsed: 0.001 s - in org.jgrapht.graph.MaskVertexSetTest
[INFO] Running org.jgrapht.graph.builder.GraphTypeBuilderTest
[INFO] Tests run: 5, Failures: 0, Errors: 0, Skipped: 0, Time elapsed: 0 s - in org.jgrapht.graph.builder.GraphTypeBuilderTest
[INFO] Running org.jgrapht.graph.builder.GraphBuilderTest
[INFO] Tests run: 6, Failures: 0, Errors: 0, Skipped: 0, Time elapsed: 0 s - in org.jgrapht.graph.builder.GraphBuilderTest
[INFO] Running org.jgrapht.graph.SimpleIdentityDirectedGraphTest
[INFO] Tests run: 21, Failures: 0, Errors: 0, Skipped: 0, Time elapsed: 0 s - in org.jgrapht.graph.SimpleIdentityDirectedGraphTest
[INFO] Running org.jgrapht.graph.AsUnweightedGraphTest
[INFO] Tests run: 7, Failures: 0, Errors: 0, Skipped: 0, Time elapsed: 0 s - in org.jgrapht.graph.AsUnweightedGraphTest
[INFO] Running org.jgrapht.graph.DirectedGraphTest
[INFO] Tests run: 6, Failures: 0, Errors: 0, Skipped: 0, Time elapsed: 0 s - in org.jgrapht.graph.DirectedGraphTest
[INFO] Running org.jgrapht.graph.concurrent.AsSynchronizedGraphTest
....................
Time: 0.016

OK (20 tests)

....
Time: 0.005

OK (4 tests)

...
Time: 0.002

OK (3 tests)

..
Time: 0.008

OK (2 tests)

...
Time: 0.011

OK (3 tests)

.....
Time: 0.007

OK (5 tests)

....................
Time: 0.004

OK (20 tests)

[INFO] Tests run: 7, Failures: 0, Errors: 0, Skipped: 0, Time elapsed: 0.098 s - in org.jgrapht.graph.concurrent.AsSynchronizedGraphTest
[INFO] Running org.jgrapht.graph.MaskEdgeSetTest
[INFO] Tests run: 3, Failures: 0, Errors: 0, Skipped: 0, Time elapsed: 0 s - in org.jgrapht.graph.MaskEdgeSetTest
[INFO] Running org.jgrapht.graph.UnweightedGraphAsWeightedGraphTest
[INFO] Tests run: 6, Failures: 0, Errors: 0, Skipped: 0, Time elapsed: 0.001 s - in org.jgrapht.graph.UnweightedGraphAsWeightedGraphTest
[INFO] Running org.jgrapht.graph.MaskSubgraphTest
[INFO] Tests run: 3, Failures: 0, Errors: 0, Skipped: 0, Time elapsed: 0 s - in org.jgrapht.graph.MaskSubgraphTest
[INFO] Running org.jgrapht.graph.EqualsAndHashCodeTest
[INFO] Tests run: 6, Failures: 0, Errors: 0, Skipped: 0, Time elapsed: 0 s - in org.jgrapht.graph.EqualsAndHashCodeTest
[INFO] Running org.jgrapht.graph.AsGraphUnionTest
[INFO] Tests run: 4, Failures: 0, Errors: 0, Skipped: 0, Time elapsed: 0 s - in org.jgrapht.graph.AsGraphUnionTest
[INFO] Running org.jgrapht.graph.GenericGraphsTest
[INFO] Tests run: 6, Failures: 0, Errors: 0, Skipped: 0, Time elapsed: 0.001 s - in org.jgrapht.graph.GenericGraphsTest
[INFO] Running org.jgrapht.graph.AsUndirectedGraphTest
[INFO] Tests run: 13, Failures: 0, Errors: 0, Skipped: 0, Time elapsed: 0 s - in org.jgrapht.graph.AsUndirectedGraphTest
[INFO] Running org.jgrapht.GraphsTest
[INFO] Tests run: 11, Failures: 0, Errors: 0, Skipped: 0, Time elapsed: 0 s - in org.jgrapht.GraphsTest
[INFO] Running org.jgrapht.traverse.IgnoreDirectionTest
[INFO] Tests run: 1, Failures: 0, Errors: 0, Skipped: 0, Time elapsed: 0 s - in org.jgrapht.traverse.IgnoreDirectionTest
[INFO] Running org.jgrapht.traverse.DepthFirstIteratorTest
[INFO] Tests run: 4, Failures: 0, Errors: 0, Skipped: 0, Time elapsed: 0.001 s - in org.jgrapht.traverse.DepthFirstIteratorTest
[INFO] Running org.jgrapht.traverse.TopologicalOrderIteratorTest
[INFO] Tests run: 9, Failures: 0, Errors: 0, Skipped: 0, Time elapsed: 0.001 s - in org.jgrapht.traverse.TopologicalOrderIteratorTest
[INFO] Running org.jgrapht.traverse.ClosestFirstIteratorTest
[INFO] Tests run: 5, Failures: 0, Errors: 0, Skipped: 0, Time elapsed: 0.001 s - in org.jgrapht.traverse.ClosestFirstIteratorTest
[INFO] Running org.jgrapht.traverse.MaximumCardinalityIteratorTest
[INFO] Tests run: 5, Failures: 0, Errors: 0, Skipped: 0, Time elapsed: 0 s - in org.jgrapht.traverse.MaximumCardinalityIteratorTest
[INFO] Running org.jgrapht.traverse.RandomWalkIteratorTest
[INFO] Tests run: 5, Failures: 0, Errors: 0, Skipped: 0, Time elapsed: 0.001 s - in org.jgrapht.traverse.RandomWalkIteratorTest
[INFO] Running org.jgrapht.traverse.BreadthFirstIteratorTest
[INFO] Tests run: 5, Failures: 0, Errors: 0, Skipped: 0, Time elapsed: 0 s - in org.jgrapht.traverse.BreadthFirstIteratorTest
[INFO] Running org.jgrapht.traverse.DegeneracyOrderingIteratorTest
[INFO] Tests run: 2, Failures: 0, Errors: 0, Skipped: 0, Time elapsed: 0.001 s - in org.jgrapht.traverse.DegeneracyOrderingIteratorTest
[INFO] Running org.jgrapht.traverse.LexBreadthFirstIteratorTest
[INFO] Tests run: 5, Failures: 0, Errors: 0, Skipped: 0, Time elapsed: 0 s - in org.jgrapht.traverse.LexBreadthFirstIteratorTest
[INFO] Running org.jgrapht.GraphTestsTest
[INFO] Tests run: 20, Failures: 0, Errors: 0, Skipped: 0, Time elapsed: 0.007 s - in org.jgrapht.GraphTestsTest
[INFO] 
[INFO] Results:
[INFO] 
[ERROR] Errors: 
[ERROR]   WattsStrogatzGraphGeneratorTest.testNonIntegerVertices:193 » NullPointer
[INFO] 
[ERROR] Tests run: 2973, Failures: 0, Errors: 1, Skipped: 0
[INFO] 
[INFO] ------------------------------------------------------------------------
[INFO] Reactor Summary:
[INFO] 
[INFO] JGraphT - Parent 1.2.1-SNAPSHOT .................... SUCCESS [  0.250 s]
[INFO] JGraphT - Core ..................................... FAILURE [01:24 min]
[INFO] JGraphT - I/O ...................................... SKIPPED
[INFO] JGraphT - Optimized Graphs ......................... SKIPPED
[INFO] JGraphT - Ext ...................................... SKIPPED
[INFO] JGraphT - Guava Adapter ............................ SKIPPED
[INFO] JGraphT - Demo ..................................... SKIPPED
[INFO] JGraphT - Bundle ................................... SKIPPED
[INFO] JGraphT - Distributable Archives 1.2.1-SNAPSHOT .... SKIPPED
[INFO] ------------------------------------------------------------------------
[INFO] BUILD FAILURE
[INFO] ------------------------------------------------------------------------
[INFO] Total time: 01:24 min
[INFO] Finished at: 2022-07-14T18:48:25-07:00
[INFO] ------------------------------------------------------------------------
[ERROR] Failed to execute goal org.apache.maven.plugins:maven-surefire-plugin:2.21.0:test (default-test) on project jgrapht-core: There are test failures.
[ERROR] 
[ERROR] Please refer to /data-depot/user/Workspace/Reproducibility/Reproducibility-Scanner/reproducer/workspace/Bears-222/jgrapht-core/target/surefire-reports for the individual test results.
[ERROR] Please refer to dump files (if any exist) [date]-jvmRun[N].dump, [date].dumpstream and [date]-jvmRun[N].dumpstream.
[ERROR] -> [Help 1]
[ERROR] 
[ERROR] To see the full stack trace of the errors, re-run Maven with the -e switch.
[ERROR] Re-run Maven using the -X switch to enable full debug logging.
[ERROR] 
[ERROR] For more information about the errors and possible solutions, please read the following articles:
[ERROR] [Help 1] http://cwiki.apache.org/confluence/display/MAVEN/MojoFailureException
[ERROR] 
[ERROR] After correcting the problems, you can resume the build with the command
[ERROR]   mvn <goals> -rf :jgrapht-core
Running the tests related to the bug Bears-222...
The tests related to the bug Bears-222 were executed.