Apache Maven 3.5.4 (1edded0938998edf8bf061f1ceb3cfdeccf443fe; 2018-06-17T11:33:14-07:00)
Maven home: /usr/local/apache-maven
Java version: 1.8.0_312, vendor: Private Build, runtime: /usr/lib/jvm/java-8-openjdk-amd64/jre
Default locale: en_US, platform encoding: UTF-8
OS name: "linux", version: "4.15.0-173-generic", arch: "amd64", family: "unix"
[INFO] Scanning for projects...
[INFO] Inspecting build with total of 1 modules...
[INFO] Installing Nexus Staging features:
[INFO]   ... total of 1 executions of maven-deploy-plugin replaced with nexus-staging-maven-plugin
[INFO] 
[INFO] ------------------< io.github.classgraph:classgraph >-------------------
[INFO] Building ClassGraph 4.4.13-SNAPSHOT
[INFO] --------------------------------[ jar ]---------------------------------
[INFO] 
[INFO] --- maven-resources-plugin:2.6:resources (default-resources) @ classgraph ---
[INFO] Using 'UTF-8' encoding to copy filtered resources.
[INFO] skip non existing resourceDirectory /data-depot/user/Workspace/Reproducibility/Reproducibility-Scanner/reproducer/workspace/Bears-202/src/main/resources
[INFO] 
[INFO] --- maven-compiler-plugin:3.8.0:compile (default-compile) @ classgraph ---
[INFO] Nothing to compile - all classes are up to date
[INFO] 
[INFO] --- maven-bundle-plugin:3.5.1:manifest (bundle-manifest) @ classgraph ---
[INFO] 
[INFO] --- build-helper-maven-plugin:3.0.0:add-test-source (add-test-source) @ classgraph ---
[INFO] Test Source directory: /data-depot/user/Workspace/Reproducibility/Reproducibility-Scanner/reproducer/workspace/Bears-202/src/test/perf added.
[INFO] 
[INFO] --- maven-resources-plugin:2.6:testResources (default-testResources) @ classgraph ---
[INFO] Using 'UTF-8' encoding to copy filtered resources.
[INFO] Copying 22 resources
[INFO] 
[INFO] --- maven-compiler-plugin:3.8.0:testCompile (default-testCompile) @ classgraph ---
[INFO] Nothing to compile - all classes are up to date
[INFO] 
[INFO] --- maven-surefire-plugin:2.22.0:test (default-test) @ classgraph ---
[INFO] 
[INFO] -------------------------------------------------------
[INFO]  T E S T S
[INFO] -------------------------------------------------------
[INFO] Running com.xyz.MetaAnnotationTest
[INFO] Tests run: 8, Failures: 0, Errors: 0, Skipped: 0, Time elapsed: 0.251 s - in com.xyz.MetaAnnotationTest
[INFO] Running io.github.classgraph.test.methodannotation2.TestMethodMetaAnnotation
[INFO] Tests run: 3, Failures: 0, Errors: 0, Skipped: 0, Time elapsed: 0.179 s - in io.github.classgraph.test.methodannotation2.TestMethodMetaAnnotation
[INFO] Running io.github.classgraph.test.methodinfo.MethodInfoTest
[INFO] Tests run: 4, Failures: 0, Errors: 0, Skipped: 0, Time elapsed: 0.265 s - in io.github.classgraph.test.methodinfo.MethodInfoTest
[INFO] Running io.github.classgraph.test.ClassGraphTest
[INFO] Tests run: 19, Failures: 0, Errors: 0, Skipped: 0, Time elapsed: 1.375 s - in io.github.classgraph.test.ClassGraphTest
[INFO] Running io.github.classgraph.test.methodannotation.MethodAnnotationTest
[INFO] Tests run: 2, Failures: 0, Errors: 0, Skipped: 0, Time elapsed: 0.107 s - in io.github.classgraph.test.methodannotation.MethodAnnotationTest
[INFO] Running io.github.classgraph.test.fieldinfo.FieldInfoTest
[INFO] Tests run: 3, Failures: 0, Errors: 0, Skipped: 0, Time elapsed: 0.153 s - in io.github.classgraph.test.fieldinfo.FieldInfoTest
[INFO] Running io.github.classgraph.test.ClassInfoTest
[INFO] Tests run: 7, Failures: 0, Errors: 0, Skipped: 0, Time elapsed: 0.055 s - in io.github.classgraph.test.ClassInfoTest
[INFO] Running io.github.classgraph.test.classrefannotation.AnnotationClassRefTest
[INFO] Tests run: 1, Failures: 0, Errors: 0, Skipped: 0, Time elapsed: 0.048 s - in io.github.classgraph.test.classrefannotation.AnnotationClassRefTest
[INFO] Running io.github.classgraph.test.internal.InternalExternalTest
[INFO] Tests run: 4, Failures: 0, Errors: 0, Skipped: 0, Time elapsed: 0.184 s - in io.github.classgraph.test.internal.InternalExternalTest
[INFO] Running io.github.classgraph.test.fieldannotation.FieldAndMethodAnnotationTest
[INFO] Tests run: 3, Failures: 0, Errors: 0, Skipped: 0, Time elapsed: 0.157 s - in io.github.classgraph.test.fieldannotation.FieldAndMethodAnnotationTest
[INFO] Running io.github.classgraph.json.JSONSerializationTest
[INFO] Tests run: 2, Failures: 0, Errors: 0, Skipped: 0, Time elapsed: 0.135 s - in io.github.classgraph.json.JSONSerializationTest
[INFO] Running io.github.classgraph.issues.issue37.Issue37Test
[INFO] Tests run: 1, Failures: 0, Errors: 0, Skipped: 0, Time elapsed: 0.054 s - in io.github.classgraph.issues.issue37.Issue37Test
[INFO] Running io.github.classgraph.issues.issue83.Issue83Test
[INFO] Tests run: 2, Failures: 0, Errors: 0, Skipped: 0, Time elapsed: 0.032 s - in io.github.classgraph.issues.issue83.Issue83Test
[INFO] Running io.github.classgraph.issues.issue245.Issue245Test
[INFO] Tests run: 1, Failures: 0, Errors: 0, Skipped: 0, Time elapsed: 0.016 s - in io.github.classgraph.issues.issue245.Issue245Test
[INFO] Running io.github.classgraph.issues.issue38.Issue38Test
[INFO] Tests run: 1, Failures: 0, Errors: 0, Skipped: 0, Time elapsed: 0.055 s - in io.github.classgraph.issues.issue38.Issue38Test
[INFO] Running io.github.classgraph.issues.issue260.Issue260Test
[INFO] Tests run: 1, Failures: 0, Errors: 0, Skipped: 0, Time elapsed: 0.054 s - in io.github.classgraph.issues.issue260.Issue260Test
[INFO] Running io.github.classgraph.issues.issue46.Issue46Test
[INFO] Tests run: 1, Failures: 0, Errors: 0, Skipped: 0, Time elapsed: 0.035 s - in io.github.classgraph.issues.issue46.Issue46Test
[INFO] Running io.github.classgraph.issues.issue238.Issue238Test
[INFO] Tests run: 1, Failures: 0, Errors: 0, Skipped: 0, Time elapsed: 0.094 s - in io.github.classgraph.issues.issue238.Issue238Test
[INFO] Running io.github.classgraph.issues.issue167.Issue167Test
[INFO] Tests run: 2, Failures: 0, Errors: 0, Skipped: 0, Time elapsed: 0.125 s - in io.github.classgraph.issues.issue167.Issue167Test
[INFO] Running io.github.classgraph.issues.issue171.Issue171Test
[INFO] Tests run: 1, Failures: 0, Errors: 0, Skipped: 0, Time elapsed: 0.077 s - in io.github.classgraph.issues.issue171.Issue171Test
[INFO] Running io.github.classgraph.issues.issue100.Issue100Test
[INFO] Tests run: 1, Failures: 0, Errors: 0, Skipped: 0, Time elapsed: 0.076 s - in io.github.classgraph.issues.issue100.Issue100Test
[INFO] Running io.github.classgraph.issues.issue223.Issue223Test
[INFO] Tests run: 1, Failures: 0, Errors: 0, Skipped: 0, Time elapsed: 0.058 s - in io.github.classgraph.issues.issue223.Issue223Test
[INFO] Running io.github.classgraph.issues.issue107.Issue107Test
[INFO] Tests run: 1, Failures: 0, Errors: 0, Skipped: 0, Time elapsed: 0.047 s - in io.github.classgraph.issues.issue107.Issue107Test
[INFO] Running io.github.classgraph.issues.TestGetUniqueClasspathElements
[INFO] Tests run: 1, Failures: 0, Errors: 0, Skipped: 0, Time elapsed: 0.022 s - in io.github.classgraph.issues.TestGetUniqueClasspathElements
[INFO] Running io.github.classgraph.issues.IssuesTest
[INFO] Tests run: 6, Failures: 0, Errors: 0, Skipped: 0, Time elapsed: 0.343 s - in io.github.classgraph.issues.IssuesTest
[INFO] Running io.github.classgraph.issues.issue277.Issue227Test
[ERROR] Tests run: 2, Failures: 0, Errors: 1, Skipped: 0, Time elapsed: 0.005 s <<< FAILURE! - in io.github.classgraph.issues.issue277.Issue227Test
[ERROR] testNoArgsBlacklistLibOrExtJars(io.github.classgraph.issues.issue277.Issue227Test)  Time elapsed: 0.004 s  <<< ERROR!
java.lang.IllegalArgumentException: Can only blacklist jars by leafname: /usr/lib/jvm/java-8-openjdk-amd64/jre/lib/jce.jar
	at io.github.classgraph.issues.issue277.Issue227Test.testNoArgsBlacklistLibOrExtJars(Issue227Test.java:13)

[INFO] Running io.github.classgraph.issues.issue216.Issue216Test
[INFO] Tests run: 1, Failures: 0, Errors: 0, Skipped: 0, Time elapsed: 0.059 s - in io.github.classgraph.issues.issue216.Issue216Test
[INFO] Running io.github.classgraph.issues.issue101.Issue101Test
[INFO] Tests run: 3, Failures: 0, Errors: 0, Skipped: 0, Time elapsed: 0.163 s - in io.github.classgraph.issues.issue101.Issue101Test
[INFO] Running io.github.classgraph.issues.issue99.Issue99Test
[INFO] Tests run: 2, Failures: 0, Errors: 0, Skipped: 0, Time elapsed: 0.04 s - in io.github.classgraph.issues.issue99.Issue99Test
[INFO] Running io.github.classgraph.issues.issue175.Issue175Test
[INFO] Tests run: 9, Failures: 0, Errors: 0, Skipped: 0, Time elapsed: 0.249 s - in io.github.classgraph.issues.issue175.Issue175Test
[INFO] Running io.github.classgraph.issues.issue153.Issue153Test
[INFO] Tests run: 1, Failures: 0, Errors: 0, Skipped: 0, Time elapsed: 0.062 s - in io.github.classgraph.issues.issue153.Issue153Test
[INFO] Running io.github.classgraph.issues.issue193.Issue193Test
[INFO] Tests run: 1, Failures: 0, Errors: 0, Skipped: 0, Time elapsed: 0.48 s - in io.github.classgraph.issues.issue193.Issue193Test
[INFO] Running io.github.classgraph.issues.issue246.Issue246Test
[INFO] Tests run: 1, Failures: 0, Errors: 0, Skipped: 0, Time elapsed: 0.049 s - in io.github.classgraph.issues.issue246.Issue246Test
[INFO] Running io.github.classgraph.issues.issue80.Issue80Test
[INFO] Tests run: 1, Failures: 0, Errors: 0, Skipped: 0, Time elapsed: 1.273 s - in io.github.classgraph.issues.issue80.Issue80Test
[INFO] Running io.github.classgraph.issues.issue78.Issue78Test
[INFO] Tests run: 1, Failures: 0, Errors: 0, Skipped: 0, Time elapsed: 0.061 s - in io.github.classgraph.issues.issue78.Issue78Test
[INFO] Running io.github.classgraph.issues.issue209.Issue209Test
[INFO] Tests run: 1, Failures: 0, Errors: 0, Skipped: 0, Time elapsed: 0.056 s - in io.github.classgraph.issues.issue209.Issue209Test
[INFO] Running io.github.classgraph.issues.issue148.Issue148Test
[INFO] Tests run: 1, Failures: 0, Errors: 0, Skipped: 0, Time elapsed: 0.064 s - in io.github.classgraph.issues.issue148.Issue148Test
[INFO] Running io.github.classgraph.issues.issue255.Issue255Test
[INFO] Tests run: 1, Failures: 0, Errors: 0, Skipped: 0, Time elapsed: 0.033 s - in io.github.classgraph.issues.issue255.Issue255Test
[INFO] Running io.github.classgraph.issues.issue74.Issue74Test
[INFO] Tests run: 1, Failures: 0, Errors: 0, Skipped: 0, Time elapsed: 0.055 s - in io.github.classgraph.issues.issue74.Issue74Test
[INFO] Running io.github.classgraph.issues.issue128.Issue128Test
[ERROR] Tests run: 1, Failures: 0, Errors: 1, Skipped: 0, Time elapsed: 1.93 s <<< FAILURE! - in io.github.classgraph.issues.issue128.Issue128Test
[ERROR] issue128Test(io.github.classgraph.issues.issue128.Issue128Test)  Time elapsed: 1.929 s  <<< ERROR!
java.lang.RuntimeException: Able to download remote jar, but could not find files within jar
	at io.github.classgraph.issues.issue128.Issue128Test.issue128Test(Issue128Test.java:63)

[INFO] Running io.github.classgraph.issues.issue261.Issue261Test
[INFO] Tests run: 1, Failures: 0, Errors: 0, Skipped: 0, Time elapsed: 0.095 s - in io.github.classgraph.issues.issue261.Issue261Test
[INFO] Running io.github.classgraph.issues.issue140.Issue140Test
[INFO] Tests run: 1, Failures: 0, Errors: 0, Skipped: 0, Time elapsed: 0.05 s - in io.github.classgraph.issues.issue140.Issue140Test
[INFO] Running io.github.classgraph.issues.issue146.Issue146Test
[INFO] Tests run: 1, Failures: 0, Errors: 0, Skipped: 0, Time elapsed: 0.051 s - in io.github.classgraph.issues.issue146.Issue146Test
[INFO] Running io.github.classgraph.issues.issue152.Issue152Test
[INFO] Tests run: 1, Failures: 0, Errors: 0, Skipped: 0, Time elapsed: 0.049 s - in io.github.classgraph.issues.issue152.Issue152Test
[INFO] Running io.github.classgraph.issues.issue151.Issue151Test
[INFO] Tests run: 1, Failures: 0, Errors: 0, Skipped: 0, Time elapsed: 0.057 s - in io.github.classgraph.issues.issue151.Issue151Test
[INFO] Running io.github.classgraph.issues.issue166.Issue166Test
[INFO] Tests run: 3, Failures: 0, Errors: 0, Skipped: 0, Time elapsed: 0.173 s - in io.github.classgraph.issues.issue166.Issue166Test
[INFO] Running DefaultPackageTest
[INFO] Tests run: 2, Failures: 0, Errors: 0, Skipped: 0, Time elapsed: 0.087 s - in DefaultPackageTest
[INFO] Running DisableRecursiveScanningTest
[INFO] Tests run: 2, Failures: 0, Errors: 0, Skipped: 0, Time elapsed: 0.091 s - in DisableRecursiveScanningTest
[INFO] 
[INFO] Results:
[INFO] 
[ERROR] Errors: 
[ERROR]   Issue128Test.issue128Test:63 Runtime Able to download remote jar, but could no...
[ERROR]   Issue227Test.testNoArgsBlacklistLibOrExtJars:13 » IllegalArgument Can only bla...
[INFO] 
[ERROR] Tests run: 116, Failures: 0, Errors: 2, Skipped: 0
[INFO] 
[INFO] ------------------------------------------------------------------------
[INFO] BUILD FAILURE
[INFO] ------------------------------------------------------------------------
[INFO] Total time: 13.249 s
[INFO] Finished at: 2022-07-14T17:38:28-07:00
[INFO] ------------------------------------------------------------------------
[ERROR] Failed to execute goal org.apache.maven.plugins:maven-surefire-plugin:2.22.0:test (default-test) on project classgraph: There are test failures.
[ERROR] 
[ERROR] Please refer to /data-depot/user/Workspace/Reproducibility/Reproducibility-Scanner/reproducer/workspace/Bears-202/target/surefire-reports for the individual test results.
[ERROR] Please refer to dump files (if any exist) [date]-jvmRun[N].dump, [date].dumpstream and [date]-jvmRun[N].dumpstream.
[ERROR] -> [Help 1]
[ERROR] 
[ERROR] To see the full stack trace of the errors, re-run Maven with the -e switch.
[ERROR] Re-run Maven using the -X switch to enable full debug logging.
[ERROR] 
[ERROR] For more information about the errors and possible solutions, please read the following articles:
[ERROR] [Help 1] http://cwiki.apache.org/confluence/display/MAVEN/MojoFailureException
Running the tests related to the bug Bears-202...
The tests related to the bug Bears-202 were executed.