Apache Maven 3.6.3
Maven home: /usr/share/maven
Java version: 1.8.0_312, vendor: Private Build, runtime: /usr/lib/jvm/java-8-openjdk-amd64/jre
Default locale: en_US, platform encoding: UTF-8
OS name: "linux", version: "5.15.0-41-generic", arch: "amd64", family: "unix"
[INFO] Scanning for projects...
[WARNING] 
[WARNING] Some problems were encountered while building the effective model for fr.inria.gforge.spoon:spoon-core:jar:7.2.0-SNAPSHOT
[WARNING] 'build.plugins.plugin.version' for org.pitest:pitest-maven is missing. @ line 564, column 15
[WARNING] 
[WARNING] It is highly recommended to fix these problems because they threaten the stability of your build.
[WARNING] 
[WARNING] For this reason, future Maven versions might no longer support building such malformed projects.
[WARNING] 
[INFO] Inspecting build with total of 1 modules...
[INFO] Installing Nexus Staging features:
[INFO]   ... total of 1 executions of maven-deploy-plugin replaced with nexus-staging-maven-plugin
[INFO] 
[INFO] ------------------< fr.inria.gforge.spoon:spoon-core >------------------
[INFO] Building Spoon Core 7.2.0-SNAPSHOT
[INFO] --------------------------------[ jar ]---------------------------------
[INFO] 
[INFO] --- maven-enforcer-plugin:1.0:enforce (enforce-maven) @ spoon-core ---
[INFO] Skipping Rule Enforcement.
[INFO] 
[INFO] --- jacoco-maven-plugin:0.8.1:prepare-agent (default) @ spoon-core ---
[INFO] argLine set to -javaagent:/home/user/.m2/repository/org/jacoco/org.jacoco.agent/0.8.1/org.jacoco.agent-0.8.1-runtime.jar=destfile=/home/user/Workspace/reproducibility/Reproducibility-Scanner/reproducer/workspace/Bears-219/target/jacoco.exec
[INFO] 
[INFO] --- maven-resources-plugin:2.6:resources (default-resources) @ spoon-core ---
[INFO] Using 'UTF-8' encoding to copy filtered resources.
[INFO] Copying 3 resources
[INFO] Copying 1 resource
[INFO] 
[INFO] --- maven-compiler-plugin:3.7.0:compile (default-compile) @ spoon-core ---
[INFO] Nothing to compile - all classes are up to date
[INFO] 
[INFO] --- maven-resources-plugin:2.6:testResources (default-testResources) @ spoon-core ---
[INFO] Using 'UTF-8' encoding to copy filtered resources.
[INFO] Copying 190 resources
[INFO] 
[INFO] --- maven-compiler-plugin:3.7.0:testCompile (default-testCompile) @ spoon-core ---
[INFO] Nothing to compile - all classes are up to date
[INFO] 
[INFO] --- maven-surefire-plugin:2.21.0:test (default-test) @ spoon-core ---
[INFO] 
[INFO] -------------------------------------------------------
[INFO]  T E S T S
[INFO] -------------------------------------------------------
[INFO] Running spoon.reflect.ast.AstCheckerTest
[INFO] Tests run: 2, Failures: 0, Errors: 0, Skipped: 0, Time elapsed: 11.092 s - in spoon.reflect.ast.AstCheckerTest
[INFO] Running spoon.reflect.ast.CloneTest
[INFO] Tests run: 5, Failures: 0, Errors: 0, Skipped: 0, Time elapsed: 8.314 s - in spoon.reflect.ast.CloneTest
[INFO] Running spoon.reflect.declaration.CtTypeInformationTest
[INFO] Tests run: 4, Failures: 0, Errors: 0, Skipped: 0, Time elapsed: 0.394 s - in spoon.reflect.declaration.CtTypeInformationTest
[INFO] Running spoon.reflect.declaration.UnknownDeclarationTest
[INFO] Tests run: 1, Failures: 0, Errors: 0, Skipped: 0, Time elapsed: 0.031 s - in spoon.reflect.declaration.UnknownDeclarationTest
[INFO] Running spoon.reflect.visitor.CtScannerTest
[INFO] Tests run: 3, Failures: 0, Errors: 0, Skipped: 0, Time elapsed: 6.271 s - in spoon.reflect.visitor.CtScannerTest
[INFO] Running spoon.reflect.visitor.CtVisitorTest
[INFO] Tests run: 1, Failures: 0, Errors: 0, Skipped: 0, Time elapsed: 1.067 s - in spoon.reflect.visitor.CtVisitorTest
[INFO] Running spoon.reflect.visitor.CtIteratorTest
[INFO] Tests run: 1, Failures: 0, Errors: 0, Skipped: 0, Time elapsed: 0.169 s - in spoon.reflect.visitor.CtIteratorTest
[INFO] Running spoon.reflect.visitor.CtInheritanceScannerTest
[INFO] Tests run: 83, Failures: 0, Errors: 0, Skipped: 0, Time elapsed: 0.396 s - in spoon.reflect.visitor.CtInheritanceScannerTest
[INFO] Running spoon.reflect.visitor.CtInheritanceScannerMethodsTest
[INFO] Tests run: 1, Failures: 0, Errors: 0, Skipped: 0, Time elapsed: 0.958 s - in spoon.reflect.visitor.CtInheritanceScannerMethodsTest
[INFO] Running spoon.support.compiler.jdt.JDTBatchCompilerTest
[INFO] Tests run: 1, Failures: 0, Errors: 0, Skipped: 0, Time elapsed: 0.124 s - in spoon.support.compiler.jdt.JDTBatchCompilerTest
[INFO] Running spoon.support.compiler.jdt.JDTBuilderTest
[INFO] Tests run: 1, Failures: 0, Errors: 0, Skipped: 0, Time elapsed: 0 s - in spoon.support.compiler.jdt.JDTBuilderTest
[INFO] Running spoon.support.compiler.jdt.JDTBasedSpoonCompilerTest
[INFO] Tests run: 1, Failures: 0, Errors: 0, Skipped: 0, Time elapsed: 1.711 s - in spoon.support.compiler.jdt.JDTBasedSpoonCompilerTest
[INFO] Running spoon.support.compiler.jdt.ExtendedStringLiteralTest
[INFO] Tests run: 1, Failures: 0, Errors: 0, Skipped: 0, Time elapsed: 0.038 s - in spoon.support.compiler.jdt.ExtendedStringLiteralTest
[INFO] Running spoon.support.compiler.classpath.ComputeClasspathTest
[INFO] Tests run: 1, Failures: 0, Errors: 0, Skipped: 0, Time elapsed: 0 s - in spoon.support.compiler.classpath.ComputeClasspathTest
[INFO] Running spoon.support.visitor.java.JavaReflectionTreeBuilderTest
[INFO] Tests run: 19, Failures: 0, Errors: 0, Skipped: 0, Time elapsed: 1.705 s - in spoon.support.visitor.java.JavaReflectionTreeBuilderTest
[INFO] Running spoon.test.exceptions.ExceptionTest
[INFO] Tests run: 6, Failures: 0, Errors: 0, Skipped: 0, Time elapsed: 0.352 s - in spoon.test.exceptions.ExceptionTest
[INFO] Running spoon.test.constructor.ConstructorTest
[INFO] Tests run: 7, Failures: 0, Errors: 0, Skipped: 0, Time elapsed: 0.531 s - in spoon.test.constructor.ConstructorTest
[INFO] Running spoon.test.serializable.SerializableTest
[INFO] Tests run: 3, Failures: 0, Errors: 0, Skipped: 0, Time elapsed: 0.262 s - in spoon.test.serializable.SerializableTest
[INFO] Running spoon.test.serializable.ModelStreamerTest
Testing factory serialization with different compressors with source folder: ./src/main/java/spoon/reflect/declaration
110182 bytes for default
586801 bytes for NONE
72129 bytes for LZMA
112148 bytes for GZIP
80502 bytes for BZIP2
[INFO] Tests run: 5, Failures: 0, Errors: 0, Skipped: 0, Time elapsed: 3.652 s - in spoon.test.serializable.ModelStreamerTest
[INFO] Running spoon.test.serializable.SourcePositionTest
[INFO] Tests run: 1, Failures: 0, Errors: 0, Skipped: 0, Time elapsed: 0.034 s - in spoon.test.serializable.SourcePositionTest
[INFO] Running spoon.test.initializers.InitializerTest
[INFO] Tests run: 2, Failures: 0, Errors: 0, Skipped: 0, Time elapsed: 0.081 s - in spoon.test.initializers.InitializerTest
[INFO] Running spoon.test.annotation.AnnotationTest
[INFO] Tests run: 52, Failures: 0, Errors: 0, Skipped: 0, Time elapsed: 2.452 s - in spoon.test.annotation.AnnotationTest
[INFO] Running spoon.test.annotation.AnnotationValuesTest
[INFO] Tests run: 6, Failures: 0, Errors: 0, Skipped: 0, Time elapsed: 0.127 s - in spoon.test.annotation.AnnotationValuesTest
[INFO] Running spoon.test.annotation.AnnotationLoopTest
[INFO] Tests run: 1, Failures: 0, Errors: 0, Skipped: 0, Time elapsed: 0.034 s - in spoon.test.annotation.AnnotationLoopTest
[INFO] Running spoon.test.comparison.EqualTest
[INFO] Tests run: 5, Failures: 0, Errors: 0, Skipped: 0, Time elapsed: 0.228 s - in spoon.test.comparison.EqualTest
[INFO] Running spoon.test.ctElement.ElementTest
[INFO] Tests run: 1, Failures: 0, Errors: 0, Skipped: 0, Time elapsed: 0.002 s - in spoon.test.ctElement.ElementTest
[INFO] Running spoon.test.ctElement.MetadataTest
[INFO] Tests run: 1, Failures: 0, Errors: 0, Skipped: 0, Time elapsed: 0.037 s - in spoon.test.ctElement.MetadataTest
[INFO] Running spoon.test.lambda.LambdaTest
[INFO] Tests run: 23, Failures: 0, Errors: 0, Skipped: 0, Time elapsed: 1.973 s - in spoon.test.lambda.LambdaTest
[INFO] Running spoon.test.ctClass.CtClassTest
[INFO] Tests run: 8, Failures: 0, Errors: 0, Skipped: 0, Time elapsed: 2.993 s - in spoon.test.ctClass.CtClassTest
[INFO] Running spoon.test.prettyprinter.QualifiedThisRefTest
[INFO] Tests run: 3, Failures: 0, Errors: 0, Skipped: 0, Time elapsed: 0.157 s - in spoon.test.prettyprinter.QualifiedThisRefTest
[INFO] Running spoon.test.prettyprinter.LinesTest
[INFO] Tests run: 3, Failures: 0, Errors: 0, Skipped: 0, Time elapsed: 0.358 s - in spoon.test.prettyprinter.LinesTest
[INFO] Running spoon.test.prettyprinter.TestSniperPrinter
[INFO] Tests run: 9, Failures: 0, Errors: 0, Skipped: 0, Time elapsed: 0.674 s - in spoon.test.prettyprinter.TestSniperPrinter
[INFO] Running spoon.test.prettyprinter.DefaultPrettyPrinterTest
[INFO] Tests run: 14, Failures: 0, Errors: 0, Skipped: 0, Time elapsed: 0.877 s - in spoon.test.prettyprinter.DefaultPrettyPrinterTest
[INFO] Running spoon.test.prettyprinter.PrinterTest
[INFO] Tests run: 9, Failures: 0, Errors: 0, Skipped: 0, Time elapsed: 2.135 s - in spoon.test.prettyprinter.PrinterTest
[INFO] Running spoon.test.api.MetamodelTest
[INFO] Tests run: 16, Failures: 0, Errors: 0, Skipped: 0, Time elapsed: 3.258 s - in spoon.test.api.MetamodelTest
[INFO] Running spoon.test.api.NoClasspathTest
[INFO] Tests run: 5, Failures: 0, Errors: 0, Skipped: 0, Time elapsed: 0.184 s - in spoon.test.api.NoClasspathTest
[INFO] Running spoon.test.api.APITest
./target/nooutput_097d917f-a7dc-4649-92a2-8dc95dede304
[INFO] Tests run: 23, Failures: 0, Errors: 0, Skipped: 0, Time elapsed: 6.161 s - in spoon.test.api.APITest
[INFO] Running spoon.test.api.FileSystemFolderTest
[INFO] Tests run: 2, Failures: 0, Errors: 0, Skipped: 0, Time elapsed: 0 s - in spoon.test.api.FileSystemFolderTest
[INFO] Running spoon.test.staticFieldAccess.StaticAccessTest
[INFO] Tests run: 2, Failures: 0, Errors: 0, Skipped: 0, Time elapsed: 0.137 s - in spoon.test.staticFieldAccess.StaticAccessTest
[INFO] Running spoon.test.filters.CUFilterTest
[INFO] Tests run: 3, Failures: 0, Errors: 0, Skipped: 0, Time elapsed: 0.123 s - in spoon.test.filters.CUFilterTest
[INFO] Running spoon.test.filters.FilterTest
[INFO] Tests run: 43, Failures: 0, Errors: 0, Skipped: 0, Time elapsed: 3.655 s - in spoon.test.filters.FilterTest
[INFO] Running spoon.test.position.PositionTest
2022-07-25 20:23:07,600 ERROR spoon.support.compiler.jdt.JDTCommentBuilder - "/* c2 */" cannot be added into the AST, with parent class spoon.support.reflect.code.CtLiteralImplplease report the bug by posting on https://github.com/INRIA/spoon/issues/2482
2022-07-25 20:23:07,603 ERROR spoon.support.compiler.jdt.JDTCommentBuilder - "// c5" cannot be added into the AST, with parent class spoon.support.reflect.code.CtLiteralImplplease report the bug by posting on https://github.com/INRIA/spoon/issues/2482
2022-07-25 20:23:07,604 ERROR spoon.support.compiler.jdt.JDTCommentBuilder - "/* c6 */" cannot be added into the AST, with parent class spoon.support.reflect.code.CtLiteralImplplease report the bug by posting on https://github.com/INRIA/spoon/issues/2482
2022-07-25 20:23:07,604 ERROR spoon.support.compiler.jdt.JDTCommentBuilder - "// c7" cannot be added into the AST, with parent class spoon.support.reflect.code.CtLiteralImplplease report the bug by posting on https://github.com/INRIA/spoon/issues/2482
2022-07-25 20:23:07,975 ERROR spoon.support.compiler.jdt.JDTCommentBuilder - "/* c2 */" cannot be added into the AST, with parent class spoon.support.reflect.code.CtLiteralImplplease report the bug by posting on https://github.com/INRIA/spoon/issues/2482
2022-07-25 20:23:07,975 ERROR spoon.support.compiler.jdt.JDTCommentBuilder - "// c5" cannot be added into the AST, with parent class spoon.support.reflect.code.CtLiteralImplplease report the bug by posting on https://github.com/INRIA/spoon/issues/2482
2022-07-25 20:23:07,976 ERROR spoon.support.compiler.jdt.JDTCommentBuilder - "/* c6 */" cannot be added into the AST, with parent class spoon.support.reflect.code.CtLiteralImplplease report the bug by posting on https://github.com/INRIA/spoon/issues/2482
2022-07-25 20:23:07,976 ERROR spoon.support.compiler.jdt.JDTCommentBuilder - "// c7" cannot be added into the AST, with parent class spoon.support.reflect.code.CtLiteralImplplease report the bug by posting on https://github.com/INRIA/spoon/issues/2482
2022-07-25 20:23:08,186 ERROR spoon.support.compiler.jdt.JDTCommentBuilder - "/* c2 */" cannot be added into the AST, with parent class spoon.support.reflect.code.CtLiteralImplplease report the bug by posting on https://github.com/INRIA/spoon/issues/2482
2022-07-25 20:23:08,187 ERROR spoon.support.compiler.jdt.JDTCommentBuilder - "// c5" cannot be added into the AST, with parent class spoon.support.reflect.code.CtLiteralImplplease report the bug by posting on https://github.com/INRIA/spoon/issues/2482
2022-07-25 20:23:08,187 ERROR spoon.support.compiler.jdt.JDTCommentBuilder - "/* c6 */" cannot be added into the AST, with parent class spoon.support.reflect.code.CtLiteralImplplease report the bug by posting on https://github.com/INRIA/spoon/issues/2482
2022-07-25 20:23:08,187 ERROR spoon.support.compiler.jdt.JDTCommentBuilder - "// c7" cannot be added into the AST, with parent class spoon.support.reflect.code.CtLiteralImplplease report the bug by posting on https://github.com/INRIA/spoon/issues/2482
2022-07-25 20:23:08,555 ERROR spoon.support.compiler.jdt.JDTCommentBuilder - "/* c2 */" cannot be added into the AST, with parent class spoon.support.reflect.code.CtLiteralImplplease report the bug by posting on https://github.com/INRIA/spoon/issues/2482
2022-07-25 20:23:08,555 ERROR spoon.support.compiler.jdt.JDTCommentBuilder - "// c5" cannot be added into the AST, with parent class spoon.support.reflect.code.CtLiteralImplplease report the bug by posting on https://github.com/INRIA/spoon/issues/2482
2022-07-25 20:23:08,555 ERROR spoon.support.compiler.jdt.JDTCommentBuilder - "/* c6 */" cannot be added into the AST, with parent class spoon.support.reflect.code.CtLiteralImplplease report the bug by posting on https://github.com/INRIA/spoon/issues/2482
2022-07-25 20:23:08,555 ERROR spoon.support.compiler.jdt.JDTCommentBuilder - "// c7" cannot be added into the AST, with parent class spoon.support.reflect.code.CtLiteralImplplease report the bug by posting on https://github.com/INRIA/spoon/issues/2482
[INFO] Tests run: 31, Failures: 0, Errors: 0, Skipped: 0, Time elapsed: 1.359 s - in spoon.test.position.PositionTest
[INFO] Running spoon.test.position.TestSourceFragment
[INFO] Tests run: 7, Failures: 0, Errors: 0, Skipped: 0, Time elapsed: 0.038 s - in spoon.test.position.TestSourceFragment
[INFO] Running spoon.test.jdtimportbuilder.ImportBuilderTest
[INFO] Tests run: 8, Failures: 0, Errors: 0, Skipped: 0, Time elapsed: 0.405 s - in spoon.test.jdtimportbuilder.ImportBuilderTest
[INFO] Running spoon.test.query_function.VariableReferencesTest
2022-07-25 20:23:09,217 WARN spoon.Launcher - Spoon is now using the 'no classpath mode' by default. If you want to ensure using Spoon in full classpath mode, please use the new flag: --cpmode fullclasspath.
2022-07-25 20:23:09,217 WARN spoon.Launcher - Spoon now parse by default the comments. Consider using the option --disable-comments if you want the old behaviour.
2022-07-25 20:23:09,218 INFO spoon.Launcher - Spoon version 7.2.0-SNAPSHOT
2022-07-25 20:23:09,218 INFO spoon.Launcher - running Spoon...
2022-07-25 20:23:09,218 INFO spoon.Launcher - start processing...
2022-07-25 20:23:09,265 INFO spoon.Launcher - end of processing: 
2022-07-25 20:23:09,265 INFO spoon.Launcher - no errors, no warnings
2022-07-25 20:23:09,296 WARN spoon.Launcher - Spoon is now using the 'no classpath mode' by default. If you want to ensure using Spoon in full classpath mode, please use the new flag: --cpmode fullclasspath.
2022-07-25 20:23:09,296 WARN spoon.Launcher - Spoon now parse by default the comments. Consider using the option --disable-comments if you want the old behaviour.
2022-07-25 20:23:09,297 INFO spoon.Launcher - Spoon version 7.2.0-SNAPSHOT
2022-07-25 20:23:09,297 INFO spoon.Launcher - running Spoon...
2022-07-25 20:23:09,297 INFO spoon.Launcher - start processing...
2022-07-25 20:23:09,347 INFO spoon.Launcher - end of processing: 
2022-07-25 20:23:09,347 INFO spoon.Launcher - no errors, no warnings
2022-07-25 20:23:09,367 WARN spoon.Launcher - Spoon is now using the 'no classpath mode' by default. If you want to ensure using Spoon in full classpath mode, please use the new flag: --cpmode fullclasspath.
2022-07-25 20:23:09,367 WARN spoon.Launcher - Spoon now parse by default the comments. Consider using the option --disable-comments if you want the old behaviour.
2022-07-25 20:23:09,368 INFO spoon.Launcher - Spoon version 7.2.0-SNAPSHOT
2022-07-25 20:23:09,368 INFO spoon.Launcher - running Spoon...
2022-07-25 20:23:09,368 INFO spoon.Launcher - start processing...
2022-07-25 20:23:09,415 INFO spoon.Launcher - end of processing: 
2022-07-25 20:23:09,415 INFO spoon.Launcher - no errors, no warnings
2022-07-25 20:23:09,419 WARN spoon.Launcher - Spoon is now using the 'no classpath mode' by default. If you want to ensure using Spoon in full classpath mode, please use the new flag: --cpmode fullclasspath.
2022-07-25 20:23:09,419 WARN spoon.Launcher - Spoon now parse by default the comments. Consider using the option --disable-comments if you want the old behaviour.
2022-07-25 20:23:09,419 INFO spoon.Launcher - Spoon version 7.2.0-SNAPSHOT
2022-07-25 20:23:09,419 INFO spoon.Launcher - running Spoon...
2022-07-25 20:23:09,419 INFO spoon.Launcher - start processing...
2022-07-25 20:23:09,465 INFO spoon.Launcher - end of processing: 
2022-07-25 20:23:09,465 INFO spoon.Launcher - no errors, no warnings
2022-07-25 20:23:09,481 WARN spoon.Launcher - Spoon is now using the 'no classpath mode' by default. If you want to ensure using Spoon in full classpath mode, please use the new flag: --cpmode fullclasspath.
2022-07-25 20:23:09,481 WARN spoon.Launcher - Spoon now parse by default the comments. Consider using the option --disable-comments if you want the old behaviour.
2022-07-25 20:23:09,482 INFO spoon.Launcher - Spoon version 7.2.0-SNAPSHOT
2022-07-25 20:23:09,482 INFO spoon.Launcher - running Spoon...
2022-07-25 20:23:09,482 INFO spoon.Launcher - start processing...
2022-07-25 20:23:09,527 INFO spoon.Launcher - end of processing: 
2022-07-25 20:23:09,528 INFO spoon.Launcher - no errors, no warnings
2022-07-25 20:23:09,533 WARN spoon.Launcher - Spoon is now using the 'no classpath mode' by default. If you want to ensure using Spoon in full classpath mode, please use the new flag: --cpmode fullclasspath.
2022-07-25 20:23:09,533 WARN spoon.Launcher - Spoon now parse by default the comments. Consider using the option --disable-comments if you want the old behaviour.
2022-07-25 20:23:09,534 INFO spoon.Launcher - Spoon version 7.2.0-SNAPSHOT
2022-07-25 20:23:09,534 INFO spoon.Launcher - running Spoon...
2022-07-25 20:23:09,534 INFO spoon.Launcher - start processing...
2022-07-25 20:23:09,579 INFO spoon.Launcher - end of processing: 
2022-07-25 20:23:09,579 INFO spoon.Launcher - no errors, no warnings
2022-07-25 20:23:09,585 WARN spoon.Launcher - Spoon is now using the 'no classpath mode' by default. If you want to ensure using Spoon in full classpath mode, please use the new flag: --cpmode fullclasspath.
2022-07-25 20:23:09,585 WARN spoon.Launcher - Spoon now parse by default the comments. Consider using the option --disable-comments if you want the old behaviour.
2022-07-25 20:23:09,585 INFO spoon.Launcher - Spoon version 7.2.0-SNAPSHOT
2022-07-25 20:23:09,585 INFO spoon.Launcher - running Spoon...
2022-07-25 20:23:09,586 INFO spoon.Launcher - start processing...
2022-07-25 20:23:09,632 INFO spoon.Launcher - end of processing: 
2022-07-25 20:23:09,632 INFO spoon.Launcher - no errors, no warnings
2022-07-25 20:23:09,670 WARN spoon.Launcher - Spoon is now using the 'no classpath mode' by default. If you want to ensure using Spoon in full classpath mode, please use the new flag: --cpmode fullclasspath.
2022-07-25 20:23:09,671 WARN spoon.Launcher - Spoon now parse by default the comments. Consider using the option --disable-comments if you want the old behaviour.
2022-07-25 20:23:09,671 INFO spoon.Launcher - Spoon version 7.2.0-SNAPSHOT
2022-07-25 20:23:09,671 INFO spoon.Launcher - running Spoon...
2022-07-25 20:23:09,671 INFO spoon.Launcher - start processing...
2022-07-25 20:23:09,716 INFO spoon.Launcher - end of processing: 
2022-07-25 20:23:09,716 INFO spoon.Launcher - no errors, no warnings
[INFO] Tests run: 8, Failures: 0, Errors: 0, Skipped: 0, Time elapsed: 0.536 s - in spoon.test.query_function.VariableReferencesTest
[INFO] Running spoon.test.query_function.testclasses.VariableReferencesModelTest
[INFO] Tests run: 15, Failures: 0, Errors: 0, Skipped: 0, Time elapsed: 0.002 s - in spoon.test.query_function.testclasses.VariableReferencesModelTest
[INFO] Running spoon.test.reflect.visitor.ReferenceQueryTest
[INFO] Tests run: 1, Failures: 0, Errors: 0, Skipped: 0, Time elapsed: 0.035 s - in spoon.test.reflect.visitor.ReferenceQueryTest
[INFO] Running spoon.test.parameters.ParameterTest
[INFO] Tests run: 3, Failures: 0, Errors: 0, Skipped: 0, Time elapsed: 0.143 s - in spoon.test.parameters.ParameterTest
[INFO] Running spoon.test.jar.JarTest
[INFO] Tests run: 4, Failures: 0, Errors: 0, Skipped: 0, Time elapsed: 0.111 s - in spoon.test.jar.JarTest
[INFO] Running spoon.test.support.ResourceTest
[INFO] Tests run: 4, Failures: 0, Errors: 0, Skipped: 0, Time elapsed: 0.167 s - in spoon.test.support.ResourceTest
[INFO] Running spoon.test.methodreference.MethodReferenceTest
[INFO] Tests run: 13, Failures: 0, Errors: 0, Skipped: 0, Time elapsed: 1.245 s - in spoon.test.methodreference.MethodReferenceTest
[INFO] Running spoon.test.ctBlock.TestCtBlock
[INFO] Tests run: 3, Failures: 0, Errors: 0, Skipped: 0, Time elapsed: 0.108 s - in spoon.test.ctBlock.TestCtBlock
[INFO] Running spoon.test.sourcePosition.SourcePositionTest
[INFO] Tests run: 3, Failures: 0, Errors: 0, Skipped: 0, Time elapsed: 0.119 s - in spoon.test.sourcePosition.SourcePositionTest
[INFO] Running spoon.test.field.FieldTest
[INFO] Tests run: 6, Failures: 0, Errors: 0, Skipped: 0, Time elapsed: 0.189 s - in spoon.test.field.FieldTest
[INFO] Running spoon.test.casts.CastTest
[INFO] Tests run: 5, Failures: 0, Errors: 0, Skipped: 0, Time elapsed: 0.195 s - in spoon.test.casts.CastTest
[INFO] Running spoon.test.visibility.VisibilityTest
[INFO] Tests run: 5, Failures: 0, Errors: 0, Skipped: 0, Time elapsed: 0.423 s - in spoon.test.visibility.VisibilityTest
[INFO] Running spoon.test.ctCase.SwitchCaseTest
[INFO] Tests run: 2, Failures: 0, Errors: 0, Skipped: 0, Time elapsed: 0.07 s - in spoon.test.ctCase.SwitchCaseTest
[INFO] Running spoon.test.logging.LogTest
2022-07-25 20:23:12,634 WARN spoon.Launcher - Spoon is now using the 'no classpath mode' by default. If you want to ensure using Spoon in full classpath mode, please use the new flag: --cpmode fullclasspath.
2022-07-25 20:23:12,635 WARN spoon.Launcher - Spoon now parse by default the comments. Consider using the option --disable-comments if you want the old behaviour.
2022-07-25 20:23:12,635 DEBUG spoon.Launcher - destination: /home/user/Workspace/reproducibility/Reproducibility-Scanner/reproducer/workspace/Bears-219/spooned-classes
2022-07-25 20:23:12,635 DEBUG spoon.Launcher - source classpath: null
2022-07-25 20:23:12,636 DEBUG spoon.Launcher - template classpath: []
2022-07-25 20:23:12,636 INFO spoon.Launcher - Log info
2022-07-25 20:23:12,636 WARN spoon.Launcher - Log warn
2022-07-25 20:23:12,636 ERROR spoon.Launcher - Log error
2022-07-25 20:23:12,637 DEBUG spoon.Launcher - Log debug
2022-07-25 20:23:12,637 WARN spoon.Launcher - Spoon is now using the 'no classpath mode' by default. If you want to ensure using Spoon in full classpath mode, please use the new flag: --cpmode fullclasspath.
2022-07-25 20:23:12,637 WARN spoon.Launcher - Spoon now parse by default the comments. Consider using the option --disable-comments if you want the old behaviour.
2022-07-25 20:23:12,637 DEBUG spoon.Launcher - destination: /home/user/Workspace/reproducibility/Reproducibility-Scanner/reproducer/workspace/Bears-219/spooned-classes
2022-07-25 20:23:12,638 DEBUG spoon.Launcher - source classpath: null
2022-07-25 20:23:12,638 DEBUG spoon.Launcher - template classpath: []
2022-07-25 20:23:12,638 INFO spoon.Launcher - Log info
2022-07-25 20:23:12,638 WARN spoon.Launcher - Log warn
2022-07-25 20:23:12,638 ERROR spoon.Launcher - Log error
2022-07-25 20:23:12,638 DEBUG spoon.Launcher - Log debug
2022-07-25 20:23:12,639 WARN spoon.Launcher - Spoon is now using the 'no classpath mode' by default. If you want to ensure using Spoon in full classpath mode, please use the new flag: --cpmode fullclasspath.
2022-07-25 20:23:12,639 WARN spoon.Launcher - Spoon now parse by default the comments. Consider using the option --disable-comments if you want the old behaviour.
2022-07-25 20:23:12,639 INFO spoon.Launcher - Log info
2022-07-25 20:23:12,640 WARN spoon.Launcher - Log warn
2022-07-25 20:23:12,640 ERROR spoon.Launcher - Log error
2022-07-25 20:23:12,640 WARN spoon.Launcher - Spoon is now using the 'no classpath mode' by default. If you want to ensure using Spoon in full classpath mode, please use the new flag: --cpmode fullclasspath.
2022-07-25 20:23:12,640 WARN spoon.Launcher - Spoon now parse by default the comments. Consider using the option --disable-comments if you want the old behaviour.
2022-07-25 20:23:12,641 WARN spoon.Launcher - Log warn
2022-07-25 20:23:12,641 ERROR spoon.Launcher - Log error
2022-07-25 20:23:12,642 ERROR spoon.Launcher - Log error
[INFO] Tests run: 6, Failures: 0, Errors: 0, Skipped: 0, Time elapsed: 0.006 s - in spoon.test.logging.LogTest
[INFO] Running spoon.test.varargs.VarArgsTest
[INFO] Tests run: 1, Failures: 0, Errors: 0, Skipped: 0, Time elapsed: 0.033 s - in spoon.test.varargs.VarArgsTest
[INFO] Running spoon.test.delete.DeleteTest
[INFO] Tests run: 14, Failures: 0, Errors: 0, Skipped: 0, Time elapsed: 0.591 s - in spoon.test.delete.DeleteTest
[INFO] Running spoon.test.replace.ReplaceTest
[INFO] Tests run: 17, Failures: 0, Errors: 0, Skipped: 0, Time elapsed: 0.716 s - in spoon.test.replace.ReplaceTest
[INFO] Running spoon.test.replace.ReplaceParametrizedTest
[INFO] Tests run: 83, Failures: 0, Errors: 0, Skipped: 0, Time elapsed: 0.085 s - in spoon.test.replace.ReplaceParametrizedTest
[INFO] Running spoon.test.processing.ProcessingTest
[INFO] Tests run: 10, Failures: 0, Errors: 0, Skipped: 0, Time elapsed: 0.344 s - in spoon.test.processing.ProcessingTest
[INFO] Running spoon.test.ctBodyHolder.CtBodyHolderTest
[INFO] Tests run: 6, Failures: 0, Errors: 0, Skipped: 0, Time elapsed: 0.258 s - in spoon.test.ctBodyHolder.CtBodyHolderTest
[INFO] Running spoon.test.pkg.PackageTest
[INFO] Tests run: 12, Failures: 0, Errors: 0, Skipped: 0, Time elapsed: 0.514 s - in spoon.test.pkg.PackageTest
[INFO] Running spoon.test.change.ChangeCollectorTest
[INFO] Tests run: 1, Failures: 0, Errors: 0, Skipped: 0, Time elapsed: 0.024 s - in spoon.test.change.ChangeCollectorTest
[INFO] Running spoon.test.imports.ImportTest
[INFO] Tests run: 48, Failures: 0, Errors: 0, Skipped: 0, Time elapsed: 3.027 s - in spoon.test.imports.ImportTest
[INFO] Running spoon.test.imports.ImportScannerTest
2022-07-25 20:23:30,783 WARN spoon.Launcher - ImportScannerTest: Import scanner imports 606 unused imports and misses 0 imports
[INFO] Tests run: 7, Failures: 0, Errors: 0, Skipped: 0, Time elapsed: 12.682 s - in spoon.test.imports.ImportScannerTest
[INFO] Running spoon.test.imports.ImportAndExtendWithPackageNameTest
[INFO] Tests run: 1, Failures: 0, Errors: 0, Skipped: 0, Time elapsed: 0.03 s - in spoon.test.imports.ImportAndExtendWithPackageNameTest
[INFO] Running spoon.test.factory.FactoryTest
[INFO] Tests run: 5, Failures: 0, Errors: 0, Skipped: 0, Time elapsed: 0.141 s - in spoon.test.factory.FactoryTest
[INFO] Running spoon.test.factory.CodeFactoryTest
[INFO] Tests run: 1, Failures: 0, Errors: 0, Skipped: 0, Time elapsed: 0 s - in spoon.test.factory.CodeFactoryTest
[INFO] Running spoon.test.factory.ConstructorFactoryTest
[INFO] Tests run: 2, Failures: 0, Errors: 0, Skipped: 0, Time elapsed: 0.029 s - in spoon.test.factory.ConstructorFactoryTest
[INFO] Running spoon.test.factory.AnnotationFactoryTest
[INFO] Tests run: 1, Failures: 0, Errors: 0, Skipped: 0, Time elapsed: 0.034 s - in spoon.test.factory.AnnotationFactoryTest
[INFO] Running spoon.test.factory.FieldFactoryTest
[INFO] Tests run: 2, Failures: 0, Errors: 0, Skipped: 0, Time elapsed: 0.118 s - in spoon.test.factory.FieldFactoryTest
[INFO] Running spoon.test.factory.ExecutableFactoryTest
[INFO] Tests run: 1, Failures: 0, Errors: 0, Skipped: 0, Time elapsed: 0 s - in spoon.test.factory.ExecutableFactoryTest
[INFO] Running spoon.test.factory.TypeFactoryTest
[INFO] Tests run: 5, Failures: 0, Errors: 0, Skipped: 0, Time elapsed: 0.111 s - in spoon.test.factory.TypeFactoryTest
[INFO] Running spoon.test.factory.ClassFactoryTest
[INFO] Tests run: 2, Failures: 0, Errors: 0, Skipped: 0, Time elapsed: 0 s - in spoon.test.factory.ClassFactoryTest
[INFO] Running spoon.test.main.MainTest
[INFO] Tests run: 5, Failures: 0, Errors: 0, Skipped: 0, Time elapsed: 22.91 s - in spoon.test.main.MainTest
[INFO] Running spoon.test.enums.EnumsTest
[INFO] Tests run: 8, Failures: 0, Errors: 0, Skipped: 0, Time elapsed: 0.256 s - in spoon.test.enums.EnumsTest
[INFO] Running spoon.test.enums.EnumsTypeTest
[INFO] Tests run: 2, Failures: 0, Errors: 0, Skipped: 0, Time elapsed: 0.034 s - in spoon.test.enums.EnumsTypeTest
[INFO] Running spoon.test.intercession.RemoveTest
[INFO] Tests run: 1, Failures: 0, Errors: 0, Skipped: 0, Time elapsed: 0.027 s - in spoon.test.intercession.RemoveTest
[INFO] Running spoon.test.intercession.insertBefore.InsertMethodsTest
[INFO] Tests run: 9, Failures: 0, Errors: 0, Skipped: 0, Time elapsed: 0.558 s - in spoon.test.intercession.insertBefore.InsertMethodsTest
[INFO] Running spoon.test.intercession.OneCanCallSetterWithNullParameterizedTest
[INFO] Tests run: 126, Failures: 0, Errors: 0, Skipped: 0, Time elapsed: 0.258 s - in spoon.test.intercession.OneCanCallSetterWithNullParameterizedTest
[INFO] Running spoon.test.intercession.IntercessionTest
[WARNING] Tests run: 8, Failures: 0, Errors: 0, Skipped: 1, Time elapsed: 3.16 s - in spoon.test.intercession.IntercessionTest
[INFO] Running spoon.test.architecture.SpoonArchitectureEnforcerTest
2022-07-25 20:24:14,718 ERROR spoon.support.compiler.jdt.JDTCommentBuilder - "/* c2 */" cannot be added into the AST, with parent class spoon.support.reflect.code.CtLiteralImplplease report the bug by posting on https://github.com/INRIA/spoon/issues/2482
2022-07-25 20:24:14,718 ERROR spoon.support.compiler.jdt.JDTCommentBuilder - "// c5" cannot be added into the AST, with parent class spoon.support.reflect.code.CtLiteralImplplease report the bug by posting on https://github.com/INRIA/spoon/issues/2482
2022-07-25 20:24:14,719 ERROR spoon.support.compiler.jdt.JDTCommentBuilder - "/* c6 */" cannot be added into the AST, with parent class spoon.support.reflect.code.CtLiteralImplplease report the bug by posting on https://github.com/INRIA/spoon/issues/2482
2022-07-25 20:24:14,719 ERROR spoon.support.compiler.jdt.JDTCommentBuilder - "// c7" cannot be added into the AST, with parent class spoon.support.reflect.code.CtLiteralImplplease report the bug by posting on https://github.com/INRIA/spoon/issues/2482
[INFO] Tests run: 8, Failures: 0, Errors: 0, Skipped: 0, Time elapsed: 21.959 s - in spoon.test.architecture.SpoonArchitectureEnforcerTest
[INFO] Running spoon.test.compilationunit.TestCompilationUnit
[INFO] Tests run: 9, Failures: 0, Errors: 0, Skipped: 0, Time elapsed: 0.286 s - in spoon.test.compilationunit.TestCompilationUnit
[INFO] Running spoon.test.compilationunit.GetBinaryFilesTest
[INFO] Tests run: 5, Failures: 0, Errors: 0, Skipped: 0, Time elapsed: 0.389 s - in spoon.test.compilationunit.GetBinaryFilesTest
[INFO] Running spoon.test.strings.StringTest
[INFO] Tests run: 1, Failures: 0, Errors: 0, Skipped: 0, Time elapsed: 0.033 s - in spoon.test.strings.StringTest
[INFO] Running spoon.test.strings.StringLiteralTest
[INFO] Tests run: 1, Failures: 0, Errors: 0, Skipped: 0, Time elapsed: 0.039 s - in spoon.test.strings.StringLiteralTest
[INFO] Running spoon.test.secondaryclasses.ClassesTest
[INFO] Tests run: 6, Failures: 0, Errors: 0, Skipped: 0, Time elapsed: 0.238 s - in spoon.test.secondaryclasses.ClassesTest
[INFO] Running spoon.test.method.MethodTest
[INFO] Tests run: 6, Failures: 0, Errors: 0, Skipped: 0, Time elapsed: 0.224 s - in spoon.test.method.MethodTest
[INFO] Running spoon.test.signature.SignatureTest
[INFO] Tests run: 8, Failures: 0, Errors: 0, Skipped: 0, Time elapsed: 0.566 s - in spoon.test.signature.SignatureTest
[INFO] Running spoon.test.loop.LoopTest
[INFO] Tests run: 2, Failures: 0, Errors: 0, Skipped: 0, Time elapsed: 0.077 s - in spoon.test.loop.LoopTest
[INFO] Running spoon.test.interfaces.InterfaceTest
[INFO] Tests run: 6, Failures: 0, Errors: 0, Skipped: 0, Time elapsed: 0.25 s - in spoon.test.interfaces.InterfaceTest
[INFO] Running spoon.test.interfaces.TestInterfaceWithoutSetup
[INFO] Tests run: 2, Failures: 0, Errors: 0, Skipped: 0, Time elapsed: 0.113 s - in spoon.test.interfaces.TestInterfaceWithoutSetup
[INFO] Running spoon.test.reference.AnnotationFieldReferenceTest
[INFO] Tests run: 1, Failures: 0, Errors: 0, Skipped: 0, Time elapsed: 0.034 s - in spoon.test.reference.AnnotationFieldReferenceTest
[INFO] Running spoon.test.reference.VariableAccessTest
[INFO] Tests run: 11, Failures: 0, Errors: 0, Skipped: 0, Time elapsed: 0.43 s - in spoon.test.reference.VariableAccessTest
[INFO] Running spoon.test.reference.ExecutableReferenceGenericTest
[INFO] Tests run: 12, Failures: 0, Errors: 0, Skipped: 0, Time elapsed: 0.47 s - in spoon.test.reference.ExecutableReferenceGenericTest
[INFO] Running spoon.test.reference.ElasticsearchStackoverflowTest
[INFO] Tests run: 1, Failures: 0, Errors: 0, Skipped: 0, Time elapsed: 0.056 s - in spoon.test.reference.ElasticsearchStackoverflowTest
[INFO] Running spoon.test.reference.TypeReferenceTest
[INFO] Tests run: 28, Failures: 0, Errors: 0, Skipped: 0, Time elapsed: 1.018 s - in spoon.test.reference.TypeReferenceTest
[INFO] Running spoon.test.reference.CloneReferenceTest
[INFO] Tests run: 2, Failures: 0, Errors: 0, Skipped: 0, Time elapsed: 0.084 s - in spoon.test.reference.CloneReferenceTest
[INFO] Running spoon.test.reference.ExecutableReferenceTest
[INFO] Tests run: 8, Failures: 0, Errors: 0, Skipped: 0, Time elapsed: 0.384 s - in spoon.test.reference.ExecutableReferenceTest
[INFO] Running spoon.test.type.TypeTest
[INFO] Tests run: 13, Failures: 0, Errors: 0, Skipped: 0, Time elapsed: 0.611 s - in spoon.test.type.TypeTest
[INFO] Running spoon.test.refactoring.RefactoringTest
[INFO] Tests run: 4, Failures: 0, Errors: 0, Skipped: 0, Time elapsed: 0.338 s - in spoon.test.refactoring.RefactoringTest
[INFO] Running spoon.test.refactoring.MethodsRefactoringTest
[INFO] Tests run: 5, Failures: 0, Errors: 0, Skipped: 0, Time elapsed: 0.424 s - in spoon.test.refactoring.MethodsRefactoringTest
[INFO] Running spoon.test.refactoring.CtRenameLocalVariableRefactoringTest
[INFO] Tests run: 4, Failures: 0, Errors: 0, Skipped: 0, Time elapsed: 6.474 s - in spoon.test.refactoring.CtRenameLocalVariableRefactoringTest
[INFO] Running spoon.test.literal.LiteralTest
[INFO] Tests run: 5, Failures: 0, Errors: 0, Skipped: 0, Time elapsed: 0.532 s - in spoon.test.literal.LiteralTest
[INFO] Running spoon.test.compilation.CompilationTest
>> Hello: Bar <<
>> Hello: FooEx <<
>> Hello: IBar <<
>> Hello: SimpleProcessor <<
[INFO] Tests run: 13, Failures: 0, Errors: 0, Skipped: 0, Time elapsed: 3.54 s - in spoon.test.compilation.CompilationTest
[INFO] Running spoon.test.modifiers.TestModifiers
[INFO] Tests run: 6, Failures: 0, Errors: 0, Skipped: 0, Time elapsed: 0.345 s - in spoon.test.modifiers.TestModifiers
[INFO] Running spoon.test.limits.utils.InternalTest
[INFO] Tests run: 2, Failures: 0, Errors: 0, Skipped: 0, Time elapsed: 0.071 s - in spoon.test.limits.utils.InternalTest
[INFO] Running spoon.test.snippets.SnippetTest
[INFO] Tests run: 7, Failures: 0, Errors: 0, Skipped: 0, Time elapsed: 0.372 s - in spoon.test.snippets.SnippetTest
[INFO] Running spoon.test.OutputTypeTest
[INFO] Tests run: 1, Failures: 0, Errors: 0, Skipped: 0, Time elapsed: 0.001 s - in spoon.test.OutputTypeTest
[INFO] Running spoon.test.executable.ExecutableTest
[INFO] Tests run: 4, Failures: 0, Errors: 0, Skipped: 0, Time elapsed: 0.149 s - in spoon.test.executable.ExecutableTest
[INFO] Running spoon.test.executable.ExecutableRefTest
[INFO] Tests run: 5, Failures: 0, Errors: 0, Skipped: 0, Time elapsed: 0.238 s - in spoon.test.executable.ExecutableRefTest
[INFO] Running spoon.test.parent.ParentTest
[WARNING] Tests run: 11, Failures: 0, Errors: 0, Skipped: 1, Time elapsed: 0.809 s - in spoon.test.parent.ParentTest
[INFO] Running spoon.test.parent.TopLevelTypeTest
[INFO] Tests run: 1, Failures: 0, Errors: 0, Skipped: 0, Time elapsed: 0.034 s - in spoon.test.parent.TopLevelTypeTest
[INFO] Running spoon.test.parent.NullParentTest
[INFO] Tests run: 8, Failures: 0, Errors: 0, Skipped: 0, Time elapsed: 0.321 s - in spoon.test.parent.NullParentTest
[INFO] Running spoon.test.parent.SetParentTest
[INFO] Tests run: 69, Failures: 0, Errors: 0, Skipped: 0, Time elapsed: 0.064 s - in spoon.test.parent.SetParentTest
[INFO] Running spoon.test.parent.ContractOnSettersParametrizedTest
[INFO] Tests run: 69, Failures: 0, Errors: 0, Skipped: 0, Time elapsed: 0.718 s - in spoon.test.parent.ContractOnSettersParametrizedTest
[INFO] Running spoon.test.invocations.InvocationTest
[INFO] Tests run: 3, Failures: 0, Errors: 0, Skipped: 0, Time elapsed: 0.126 s - in spoon.test.invocations.InvocationTest
[INFO] Running spoon.test.generics.GenericsTest
[INFO] Tests run: 48, Failures: 0, Errors: 0, Skipped: 0, Time elapsed: 2.57 s - in spoon.test.generics.GenericsTest
[INFO] Running spoon.test.module.TestModule
[WARNING] Tests run: 8, Failures: 0, Errors: 0, Skipped: 2, Time elapsed: 0.067 s - in spoon.test.module.TestModule
[INFO] Running spoon.test.eval.EvalTest
[INFO] Tests run: 10, Failures: 0, Errors: 0, Skipped: 0, Time elapsed: 0.56 s - in spoon.test.eval.EvalTest
[INFO] Running spoon.test.model.IncrementalLauncherTest
[INFO] Tests run: 4, Failures: 0, Errors: 0, Skipped: 0, Time elapsed: 2.818 s - in spoon.test.model.IncrementalLauncherTest
[INFO] Running spoon.test.model.AnonymousExecutableTest
[INFO] Tests run: 1, Failures: 0, Errors: 0, Skipped: 0, Time elapsed: 0.049 s - in spoon.test.model.AnonymousExecutableTest
[INFO] Running spoon.test.model.SwitchCaseTest
[INFO] Tests run: 2, Failures: 0, Errors: 0, Skipped: 0, Time elapsed: 0.081 s - in spoon.test.model.SwitchCaseTest
[INFO] Running spoon.test.model.TypeTest
[INFO] Tests run: 8, Failures: 0, Errors: 0, Skipped: 0, Time elapsed: 0.344 s - in spoon.test.model.TypeTest
[INFO] Running spoon.test.model.BlockTest
[INFO] Tests run: 2, Failures: 0, Errors: 0, Skipped: 0, Time elapsed: 0.072 s - in spoon.test.model.BlockTest
[INFO] Running spoon.test.fieldaccesses.FieldAccessTest
[INFO] Tests run: 16, Failures: 0, Errors: 0, Skipped: 0, Time elapsed: 0.66 s - in spoon.test.fieldaccesses.FieldAccessTest
[INFO] Running spoon.test.staticFieldAccess2.ImplicitStaticFieldReferenceTest
[INFO] Tests run: 16, Failures: 0, Errors: 0, Skipped: 0, Time elapsed: 1.286 s - in spoon.test.staticFieldAccess2.ImplicitStaticFieldReferenceTest
[INFO] Running spoon.test.control.ControlTest
[INFO] Tests run: 2, Failures: 0, Errors: 0, Skipped: 0, Time elapsed: 0.07 s - in spoon.test.control.ControlTest
[INFO] Running spoon.test.properties.PropertiesTest
[INFO] Tests run: 1, Failures: 0, Errors: 0, Skipped: 0, Time elapsed: 0.036 s - in spoon.test.properties.PropertiesTest
[INFO] Running spoon.test.targeted.TargetedExpressionTest
[INFO] Tests run: 17, Failures: 0, Errors: 0, Skipped: 0, Time elapsed: 0.702 s - in spoon.test.targeted.TargetedExpressionTest
[INFO] Running spoon.test.javadoc.JavaDocTest
[INFO] Tests run: 2, Failures: 0, Errors: 0, Skipped: 0, Time elapsed: 0.081 s - in spoon.test.javadoc.JavaDocTest
[INFO] Running spoon.test.labels.TestLabels
[INFO] Tests run: 1, Failures: 0, Errors: 0, Skipped: 0, Time elapsed: 0.035 s - in spoon.test.labels.TestLabels
[INFO] Running spoon.test.path.PathTest
[INFO] Tests run: 16, Failures: 0, Errors: 0, Skipped: 0, Time elapsed: 0.657 s - in spoon.test.path.PathTest
[INFO] Running spoon.test.condition.ConditionalTest
[INFO] Tests run: 6, Failures: 0, Errors: 0, Skipped: 0, Time elapsed: 0.225 s - in spoon.test.condition.ConditionalTest
[INFO] Running spoon.test.role.TestCtRole
[INFO] Tests run: 6, Failures: 0, Errors: 0, Skipped: 0, Time elapsed: 0.001 s - in spoon.test.role.TestCtRole
[INFO] Running spoon.test.constructorcallnewclass.NewClassTest
[INFO] Tests run: 7, Failures: 0, Errors: 0, Skipped: 0, Time elapsed: 0.475 s - in spoon.test.constructorcallnewclass.NewClassTest
[INFO] Running spoon.test.constructorcallnewclass.ConstructorCallTest
[INFO] Tests run: 6, Failures: 0, Errors: 0, Skipped: 0, Time elapsed: 0.297 s - in spoon.test.constructorcallnewclass.ConstructorCallTest
[INFO] Running spoon.test.variable.AccessTest
[INFO] Tests run: 8, Failures: 0, Errors: 0, Skipped: 0, Time elapsed: 0.313 s - in spoon.test.variable.AccessTest
[INFO] Running spoon.test.variable.AccessFullyQualifiedFieldTest
[INFO] Tests run: 9, Failures: 0, Errors: 0, Skipped: 0, Time elapsed: 0.676 s - in spoon.test.variable.AccessFullyQualifiedFieldTest
[INFO] Running spoon.test.variable.InferredVariableTest
[INFO] Tests run: 2, Failures: 0, Errors: 0, Skipped: 0, Time elapsed: 0.085 s - in spoon.test.variable.InferredVariableTest
[INFO] Running spoon.test.arrays.ArraysTest
[INFO] Tests run: 8, Failures: 0, Errors: 0, Skipped: 0, Time elapsed: 0.372 s - in spoon.test.arrays.ArraysTest
[INFO] Running spoon.test.trycatch.TryCatchTest
[INFO] Tests run: 12, Failures: 0, Errors: 0, Skipped: 0, Time elapsed: 0.621 s - in spoon.test.trycatch.TryCatchTest
[INFO] Running spoon.test.ctType.CtTypeTest
[INFO] Tests run: 8, Failures: 0, Errors: 0, Skipped: 0, Time elapsed: 0.348 s - in spoon.test.ctType.CtTypeTest
[INFO] Running spoon.test.ctType.CtTypeParameterTest
[INFO] Tests run: 2, Failures: 0, Errors: 0, Skipped: 0, Time elapsed: 0.088 s - in spoon.test.ctType.CtTypeParameterTest
[INFO] Running spoon.test.comment.CommentTest
[INFO] Tests run: 24, Failures: 0, Errors: 0, Skipped: 0, Time elapsed: 18.751 s - in spoon.test.comment.CommentTest
[INFO] Running spoon.test.visitor.VisitorTest
[INFO] Tests run: 1, Failures: 0, Errors: 0, Skipped: 0, Time elapsed: 0.039 s - in spoon.test.visitor.VisitorTest
[INFO] Running spoon.test.visitor.AssignmentsEqualsTest
[INFO] Tests run: 1, Failures: 0, Errors: 0, Skipped: 0, Time elapsed: 0.041 s - in spoon.test.visitor.AssignmentsEqualsTest
[INFO] Running spoon.test.method_overriding.MethodOverriddingTest
[INFO] Tests run: 4, Failures: 0, Errors: 0, Skipped: 0, Time elapsed: 0.142 s - in spoon.test.method_overriding.MethodOverriddingTest
[INFO] Running spoon.test.template.TemplateClassAccessTest
[INFO] Tests run: 1, Failures: 0, Errors: 0, Skipped: 0, Time elapsed: 0.06 s - in spoon.test.template.TemplateClassAccessTest
[INFO] Running spoon.test.template.TemplateEnumAccessTest
[INFO] Tests run: 1, Failures: 0, Errors: 0, Skipped: 0, Time elapsed: 0.108 s - in spoon.test.template.TemplateEnumAccessTest
[INFO] Running spoon.test.template.core.ParameterInfoTest
[INFO] Tests run: 21, Failures: 0, Errors: 0, Skipped: 0, Time elapsed: 0.006 s - in spoon.test.template.core.ParameterInfoTest
[INFO] Running spoon.test.template.TemplateArrayAccessTest
[INFO] Tests run: 2, Failures: 0, Errors: 0, Skipped: 0, Time elapsed: 0.109 s - in spoon.test.template.TemplateArrayAccessTest
[INFO] Running spoon.test.template.TemplateTest
0
[INFO] Tests run: 24, Failures: 0, Errors: 0, Skipped: 0, Time elapsed: 2.075 s - in spoon.test.template.TemplateTest
[INFO] Running spoon.test.template.TemplateInvocationSubstitutionTest
[INFO] Tests run: 3, Failures: 0, Errors: 0, Skipped: 0, Time elapsed: 0.146 s - in spoon.test.template.TemplateInvocationSubstitutionTest
[INFO] Running spoon.test.template.TemplateReplaceReturnTest
[INFO] Tests run: 2, Failures: 0, Errors: 0, Skipped: 0, Time elapsed: 0.157 s - in spoon.test.template.TemplateReplaceReturnTest
[INFO] Running spoon.test.template.PatternTest
[INFO] Tests run: 34, Failures: 0, Errors: 0, Skipped: 0, Time elapsed: 1.938 s - in spoon.test.template.PatternTest
[INFO] Running spoon.processing.ProcessingTest
[INFO] Tests run: 2, Failures: 0, Errors: 0, Skipped: 0, Time elapsed: 0.045 s - in spoon.processing.ProcessingTest
[INFO] Running spoon.processing.CtGenerationTest
[INFO] Tests run: 4, Failures: 0, Errors: 0, Skipped: 0, Time elapsed: 26.42 s - in spoon.processing.CtGenerationTest
[INFO] Running spoon.MavenLauncherTest
[ERROR] Tests run: 8, Failures: 2, Errors: 1, Skipped: 1, Time elapsed: 19.65 s <<< FAILURE! - in spoon.MavenLauncherTest
[ERROR] mavenLauncherTestMultiModulesAndVariables(spoon.MavenLauncherTest)  Time elapsed: 2.801 s  <<< FAILURE!
java.lang.AssertionError: Content of classpath: 
	at spoon.MavenLauncherTest.mavenLauncherTestMultiModulesAndVariables(MavenLauncherTest.java:158)

[ERROR] multiModulesProjectTest(spoon.MavenLauncherTest)  Time elapsed: 3.358 s  <<< FAILURE!
java.lang.AssertionError: expected:<166> but was:<17>
	at spoon.MavenLauncherTest.multiModulesProjectTest(MavenLauncherTest.java:124)

[ERROR] spoonMavenLauncherTest(spoon.MavenLauncherTest)  Time elapsed: 10.617 s  <<< ERROR!
java.lang.NumberFormatException: For input string: ""
	at spoon.MavenLauncherTest.spoonMavenLauncherTest(MavenLauncherTest.java:111)

[INFO] Running spoon.JarLauncherTest
INFO:  Decompiling class se/kth/castor/MyI
INFO:  ... done
INFO:  Decompiling class se/kth/castor/App
INFO:  ... done
INFO:  Decompiling class se/kth/castor/UseJson
INFO:  ... done
INFO:  Decompiling class Bidon
INFO:  ... done
INFO:  Decompiling class Enclosing
INFO:  ... done
[INFO] Tests run: 3, Failures: 0, Errors: 0, Skipped: 0, Time elapsed: 1.606 s - in spoon.JarLauncherTest
[INFO] Running spoon.testing.CtElementAssertTest
[INFO] Tests run: 5, Failures: 0, Errors: 0, Skipped: 0, Time elapsed: 0.227 s - in spoon.testing.CtElementAssertTest
[INFO] Running spoon.testing.CtPackageAssertTest
[INFO] Tests run: 4, Failures: 0, Errors: 0, Skipped: 0, Time elapsed: 0.11 s - in spoon.testing.CtPackageAssertTest
[INFO] Running spoon.testing.FileAssertTest
[INFO] Tests run: 2, Failures: 0, Errors: 0, Skipped: 0, Time elapsed: 0.15 s - in spoon.testing.FileAssertTest
[INFO] Running spoon.testing.AbstractAssertTest
[INFO] Tests run: 4, Failures: 0, Errors: 0, Skipped: 0, Time elapsed: 0.271 s - in spoon.testing.AbstractAssertTest
[INFO] Running spoon.decompiler.SpoonClassFileTransformerTest
[INFO] Tests run: 1, Failures: 0, Errors: 0, Skipped: 0, Time elapsed: 0.444 s - in spoon.decompiler.SpoonClassFileTransformerTest
[INFO] Running spoon.LauncherTest
[INFO] Tests run: 4, Failures: 0, Errors: 0, Skipped: 0, Time elapsed: 0.155 s - in spoon.LauncherTest
[INFO] 
[INFO] Results:
[INFO] 
[ERROR] Failures: 
[ERROR]   MavenLauncherTest.mavenLauncherTestMultiModulesAndVariables:158 Content of classpath: 
[ERROR]   MavenLauncherTest.multiModulesProjectTest:124 expected:<166> but was:<17>
[ERROR] Errors: 
[ERROR]   MavenLauncherTest.spoonMavenLauncherTest:111 » NumberFormat For input string: ...
[INFO] 
[ERROR] Tests run: 1610, Failures: 2, Errors: 1, Skipped: 5
[INFO] 
[INFO] ------------------------------------------------------------------------
[INFO] BUILD FAILURE
[INFO] ------------------------------------------------------------------------
[INFO] Total time:  04:07 min
[INFO] Finished at: 2022-07-25T20:26:08-07:00
[INFO] ------------------------------------------------------------------------
[ERROR] Failed to execute goal org.apache.maven.plugins:maven-surefire-plugin:2.21.0:test (default-test) on project spoon-core: There are test failures.
[ERROR] 
[ERROR] Please refer to /home/user/Workspace/reproducibility/Reproducibility-Scanner/reproducer/workspace/Bears-219/target/surefire-reports for the individual test results.
[ERROR] Please refer to dump files (if any exist) [date]-jvmRun[N].dump, [date].dumpstream and [date]-jvmRun[N].dumpstream.
[ERROR] -> [Help 1]
[ERROR] 
[ERROR] To see the full stack trace of the errors, re-run Maven with the -e switch.
[ERROR] Re-run Maven using the -X switch to enable full debug logging.
[ERROR] 
[ERROR] For more information about the errors and possible solutions, please read the following articles:
[ERROR] [Help 1] http://cwiki.apache.org/confluence/display/MAVEN/MojoFailureException
Running the tests related to the bug Bears-219...
The tests related to the bug Bears-219 were executed.